Are PJs the new pants? With adult onesies\, velour tracks gain popularity\, sheets-to-streets aesthetics the new normal
Indian government should make Tibet one of the key issues in its policies on China: Lobsang Sangay
Logistics pact to be cornerstone of military coop\, says Barry O’Farrell
Earthquake of 4.7 magnitude hits Ladakh's Kargil
Heavy rain lashes parts of Delhi
Blast in Pulwama\, no casualties reported
America loves India\, says US President Donald Trump
World’s largest pension fund loses $165 bn in worst quarter
WHO ending hydroxycholorquine trial for COVID
Lord Jagannath returns to sanctum sanctorum of 12th-century temple after Rath Yatra
Number of COVID-19 patients in hospitals down\, 9\,900 beds free: Arvind Kejriwal
Quant Fund gains 108% by dumping China stocks a day after buying
Modi leverages soft power of Buddhism to woo allies
Kanye West announces he's running for US President
Glaxo\, Sanofi near 500 million pound UK vaccine deal: Times
Many retired Gorkha soldiers in 6.6k applicants for J&K domicile
Will Xi Jinping’s muscle-flexing be counter-productive?
View: Higher fuel taxes\, fewer subsidies are good policy
Gold funds underpin pandemic price rally as jewelers vanish
Delhi gets 10\,000-bed COVID-19 care centre; LG says it will play crucial role in fight against pandemic
Amid furore over monuments\, Trump seeks 'garden' of US heroes
PM Modi extends greetings on 'Guru Purnima'
Global cues\, TCS earnings major drivers for markets this week: Analysts
Record 24\,850 coronavirus cases in single day in India
Madhya Pradesh: Village girl who cycles 24 km to school & back gets 98.5%
Monthly wage loss from first 2 lockdowns Rs 34\,000 cr: Study
Heavy rains continue in Mumbai\, suburbs; Powai lake overflows
The week that was in 10 stocks: Stocks hitting upper circuits; those that lost 50%
Lamborghini India banks on healthy order book to prevent sales decline
4 Assam Rifles personnel\, 10 NDRF staffers among 22 new COVID-19 cases in Mizoram
Lost in oil’s rally: $2 trillion-a-year refining industry crisis
At 104\, Maharashtra's oldest beats Covid with willpower
Centre is pro-industry\, pro-development: Nitin Gadkari
Mercedes to recall 660\,000 vehicles in China for oil leak
Morale of armed forces very high\, ready to sacrifice lives for country: ITBP DG
TCS earnings\, IIP data among 6 factors guiding market this week
Big events can be held while adhering to COVID-19 protocol: Adityanath
Maharashtra govt's priority is to tackle COVID-19 crisis: Aaditya Thackeray
CBSE\, Facebook to train students and teachers on digital safety
At 42.7 m\, June e-way bills close to pre-Covid days
St Stephen's College admission process from July 7-18; interviews to be held online
Amit Shah\, Rajnath Singh visit newly-created 1\,000-bed COVID-19 hospital
How badminton star PV Sindhu carved a niche for herself
Thousands leave Bengaluru fearing fresh lockdown
Tweet Buster: Two years to return to pre-Covid growth! Will Q2 offer hope?
Virat Kohli under 'conflict of interest' scanner\, Sanjeev Gupta writes to BCCI Ethics Officer
Rural markets faring better than urban centres amid coronavirus pandemic: Maruti Suzuki
PM Narendra Modi meets President to discuss various issues: Rashtrapati Bhavan
Large projects on to augment India's border infra: Gadkari
India to save 20% logistic cost in supplies to CIS countries via Chabahar: Mansukh Lal Mandaviya
Power demand slump narrows to 2.6 per cent in July beginning
Federal Bank bets on gold loans to drive credit demand in sluggish economy
DHFL defaults on NCD repayments of Rs 50 cr; says can't pay due to moratorium restrictions
Kanpur effect: Crackdown begins on mafia in Noida\, properties\, cars worth crores attached
IED blast in J&K's Pulwama leaves CRPF personnel injured
HMD Global bets on Finnish roots\, focus on security for success in Indian market
TMC MP calls FM Sitharaman \"venomous snake\"\, BJP says he's talking \"nonsense\"
Scientists discover small proteins which may reduce inflammation caused by COVID-19
FPIs pull out Rs 3\,741 cr in three trading sessions in July
Vikas Dubey's main aide arrested\, was present during firing at police when 8 cops were killed
Finmin may review capital requirement of PSU banks after second quarter
Atma nirbhar Bharat call to help country capitalise on its inherent strengths: Venkaiah Naidu
COVID-19 War Room to come up in national capital to keep eye on city's fight against virus
Odisha: GST collection in June at 2\,693.75 cr\, Q1 mop up dips 35% due to lockdown
COVID-19 impact: Realtors look at new trends among home buyers
MP cabinet expansion: BJP MLA writes to CM\, says people upset
US dips under 50\,000 new coronavirus cases
Indian exchanges see just 4 IPOs in June quarter: EY India
Japan floods leave up to 34 dead\, many at nursing homes
Industry for alternate sourcing destination as cost from China not going down: Signify Innovations
COVID-19 recovery rate in 21 states\, UTs higher than national average of 60.77%: Health Ministry
Indian drug firms recall products in US market
Former RBI governor Patel pens book on dealing with NPA issue
Income tax department amends TDS form\, makes it more comprehensive
BSF alerts units along Bangladesh border against spurt in human trafficking during COVID-19
Maruti Suzuki chairman pens book on industrialising India
New Sebi norms to give more fund-raising flexibility to stressed firms
FinMin's decision to levy penalty for late payment to vendors will assure timely payments: GeM CEO
Auction process of coal blocks witnesses good start; 1\,140 entities in technical session: Joshi
Nepal's ruling party in grave crisis: PM Oli to Cabinet ministers
IHCL resilient to disruptive challenges: MD & CEO Puneet Chhatwal
Trump blames China's 'secrecy\, cover-up' for spread of COVID-19
Coal India suffers avg daily production hit of 56 per cent during three-day strike
Trade setup: Nifty resilient; don’t chase the rally blindly\, use it to protect profit
US holiday fuels worries about skyrocketing virus cases
Shift Millennium Bus Depot from Yamuna flood plains: NGT appointed panel
Nagaland govt’s assessment that law and order is fine are distorted facts: NPF
Top 10 firms add Rs 1.37 lakh cr in m-cap; TCS\, RIL major gainers
Parents\, teachers scramble for ways to teach as e-learning remains a dream in rural India
Southern Railway sets up biz unit to boost freight traffic
Telecom tariff hike inevitable\, two rounds of increases likely in 12-18 months: EY
India should focus on 15 items of imports to achieve self-reliance: Assocham
Tech Mahindra to bid for BSNL 4G tender\, says Indian firms have capabilities
Ahead of Market: 12 things that will decide stock action on Monday
Trade unions to mobilise people to build public opinion against commercial coal mining
Reliance plans to up aviation fuel stations by 50 per cent
Goldman lowers US GDP forecast\, sees 4.6% contraction in 2020
BOE Governor warns over negative interest rates\, reports Times
LG sees 'window of opportunity' to come back into Indian smartphone market
Locust menace: FAO asks India to be on high alert for next 4 weeks
PM Modi's Ladakh visit underscored India's resolve to beat back Chinese aggression: Brahma Chellaney
Eight killed in fire at candle-making factory in Modi Nagar
Indiabulls sells Rs 4\,000 cr loan portfolio to Oaktree
Property registrations in Delhi-NCR dip by 68%
Covid-19 impact: Q1 to be a washout for IT sector\, say analysts
Thierry Delaporte has tough task at Wipro\, where he takes over as CEO on July 6
Government may need to further extend tax return deadline if COVID cases continue to rise: Experts
Electrification work at world's 'largest' Covid care centre completed in record time: Discom
ICICI Bank plans to raise funds via equity sale
Andhra crosses million-mark in Covid-19 tests to emerge 3rd Indian state
Community transmission adding up to rising covid cases: Assam Health Minister
Edelweiss Group books Rs 2\,245 cr net loss on upfront Covid provisioning
India exporting tea to China and Iran despite covid\, border standoff
Tamil Nadu reports 4150 Covid-19 cases as state lifts complete lockdown from Monday
COVID-19: Thiruvananthapuram district \"sitting on active volcano\"
Space policy\, Space Activities Bill in final stages: ISRO chairman
40 websites of banned group Sikhs For Justice blocked by government
30 kg gold sent in diplomatic baggage seized in Kerala; misuse of immunity by syndicate suspected: Customs
7 out of 12 PSBs have negative RoAs and the worst is yet to come
Software consulting services provided to Indian company's foreign client liable to GST: AAR
About 70 per cent startups impacted by COVID-19: Survey
India-EU plans next edition of the Summit mid-July to pursue rules based international order
Sugar exporters eye deals with China\, waiting for border tension to ease
Separatists' recommendations for Jammu & Kashmir students highlighted their role in stirs against forces: NIA
Karnataka plans law to home-quarantine senior citizens\, says Sudhakar
Two-way India- Bangladesh trade via West Bengal restored after Delhi's herculean efforts
Railways in talks with states to bring back Dedicated Freight Corridor workers; 7000 return to worksites
Yes Bank puts up for sale properties of Avantha Group\, RHC Holdings for recovery of over Rs 1\,000 crore
BPCL holds 62 patents; 68 more innovations awaiting approvals
US: Florida hits more than 200\,000 coronavirus cases
IAF deploys 2 MI-17 choppers to contain locusts invasion near Jodhpur
View: For sustainable social security\, the govt’s role must be that of enabler\, not provider
Welspun One Logistics plans to invest Rs 900 crore to develop warehousing park near Mumbai
How Russia’s ‘Quiet Diplomacy’ helped in reducing tensions between India and China
As India-China standoff enters its third month\, Ladakh stalemate continues
Ladakh Scouts should be given major role along LAC: Veterans
India’s spending on LAC roads has tripled in 4 years
Amazon stake knot in any Reliance-Future deal
Cop tipped off Vikas Dubey about raid\, says aide
Two weeks to start the trial\, six months at least to finish: Experts
CBI registers 30 FIRs in 30 days
Covid-19: 10 states\, 1 UT to allow rapid antigen tests
