Arvind Kejriwal's tryst with Ramlila Maidan continues\, to be sworn-in as Delhi CM at same venue for 3rd time
UN official says airstrikes kill over 30 civilians in Yemen
Govt picks national flavour: Namaste wins over Kem Cho
Ficci: Some drugs may not last beyond Feb because of virus crisis
EAM S.Jaishankar meets US peace envoy for Afghanistan\, Saudi counterpart in Munich
BCCI CEO Rahul Johri has put in his papers\, but it’s not official yet
Another 70 people test positive for coronavirus on ship in Japan
New virus has infected more than 67\,000 people globally
New Chinese coronavirus cases show slight fall; Chinese tourist dies in France
Coronavirus updates\, AGR crisis among 5 key factors that may guide D-Street this week
View: Why the stimulus has failed to lift the economy
If a bank chief isn't beholden to a FinMin join secretary; he will behave differently\, says Montek Singh Ahluwalia
ED: Panama firm set up Mirchi Jr’s shell company
These 7 sectors likely to remain immune to coronavirus jitters
View: Indian military women deserve a fighting chance
65th Filmfare Awards: ‘Gully Boy’ wins biggest honour of the night\, Ranveer\, Alia bag best actor and actress
8 out of top 10 firms add Rs 1 lakh crore to m-cap; RIL biggest gainer
Embassy in Japan trying to get Indians off cruise ship early
Looking to make a foray into pre-owned car business in India: Porsche
Will not just defend market share but also charge at competition: Maruti Suzuki MD
Sidharth Shukla beats nemesis Asim Riaz\, emerges as the winner of 'Bigg Boss 13'
World's first yoga university outside India to start classes later this year
Equity MF inflows drop 50% to Rs 12\,000 cr in Q3 on valuation\, growth concerns
IMG clears BPCL sale bid documents\, to be issued after ministerial group nod
FPIs remain net buyers in Feb\, invest Rs 24\,617 crore
Oil India to move TDSAT against DoT seeking Rs 48\,489 crore
Ties between India and US are 'unshakeable': Wells
Trump's timely visit to India could open new period in bilateral ties: Former US envoy
Nifty can test Budget lows if it moves below 12\,000: Kunal Bothra
PM Modi on day-long visit to Varanasi
Gold imports dip 9% to $25 billion during Apr-Jan
Arvind Kejriwal sworn in as Delhi chief minister
Jamia video: Priyanka Gandhi says govt's intentions would be exposed if no action taken
Mentha oil price hits season low; outlook bearish
Kejriwal 3.0: Satyendra Jain takes oath as Delhi minister
Discoms' outstanding dues to power gencos rise nearly 50% to Rs 88\,177 cr in December
Delhi Police should remain calm while dealing with miscreants: Amit Shah
Global economic policy direction now hinges on China’s next move
Solar home system improving quality of life in Southeast Asian countries: Report
Unichem\, Macleods Pharma recall drugs from US market
Jamia committee releases video of paramilitary personnel attacking students in library on Dec 15
Tweet Buster: Why investing in smallcap stock is like navigating a minefield
Looking to get Zojila tunnel completed without cost escalation; project may undergo design changes: Nitin Gadkari
Want to work with Centre for smooth governance of Delhi: Arvind Kejriwal
Shaheen Bagh protesters yet to receive permission from Delhi Police to march to Amit Shah's residence
Modi-Shah not invincible: Raut on Delhi Assembly poll results
Budget was disappointing for lacking vision; but fiscal\, taxation measures welcome: EAC-PM member Ashima Goyal
Govt allows firms to list global depository receipts at IFSC
DLF plans to raise Rs 2\,000 crore via sale of commercial land to existing JV or new partners
Trust for construction of Ram temple in Ayodhya will work rapidly: PM
Opec underestimates China coronavirus threat
Senior AAP leader Imran Hussain sworn in as Delhi minister
Kejriwal's ministers go by their choice\, take oath in different ways
Dollar defies detractors with its strongest start in 5 years
Warren Buffett’s Berkshire raises stake in Biogen\, Kroger
FRBM not breached in the union budget: Nirmala Sitharaman
New optional tax regime may adversely affect savings in India: Experts
Stock market bulls have gone off the rails. Again
Govt to infuse Rs 1\,300 cr in Exim Bank next fiscal
Maharashtra govt 'unnatural\, unrealistic': JP Nadda
Expectations high on 'mini' trade deal during Trump's visit: India Inc
About 92% of large taxpayers filed annual returns for 2017-18: GSTN
Non-life insurers register 7.2 pc rise in Jan premium income at Rs 17\,226 cr
Should I quit: Manmohan asked me after Rahul ordinance episode\, says Montek Singh Ahluwalia
Trade setup: Nifty needs to top 12\,230 level for a runaway rally
Tata Steel capex likely to hit Rs 9\,000 crore in FY20
PM inaugurates 'Kashi Ek Roop Anek' exhibition in Varanasi
National Conference decides to participate in J&K Panchayat polls\, wants 'roadblocks' to be removed
DEA had red flagged possible risks over IL&FS crisis in 2018
We remain firm on decisions on Article 370\, CAA despite pressure: PM
From AAP's education master to Kejriwal's second-in-command--Manish Sisodia dons multiple hats
A cocktail of voyeurism and sadomasochism: How ‘Bigg Boss 13’ appealed to the worst in viewers
Final test of 406 people who returned from Wuhan found to be negative
Irregularities found at Pakistan’s top bank after U.S. sanction
Shaheen Bagh protest an attempt to impose views on others: Kerala Governor
India in talks with Russia on mega deal for long-term import of crude oil
Deloitte to stop offering non-audit services to their audit clients
India\, Norway will work together in exerting pressure on countries for quick climate action: Prakash Javadekar
Indian online audience spends 3/4th of their business news reading time on Economictimes.com
Ships are skipping China and it’s causing turmoil for trade
Time to go national: AAP supporters at Arvind Kejriwal's swearing-in event
India's cleanest city Indore aims to be most ''silent'' as well
G-20 ministers ready to count the cost of coronavirus
CAA was brought out of humanitarian considerations\, opposition politicized it: BJP
Airtel\, Voda Idea\, Tata Teleservices likely to pay AGR dues on Monday: DoT source
No timeline to remove I-T exemptions: Nirmala Sitharaman
Opposition strength in Rajya Sabha to weaken further this year\, Congress to lose seats
MP: BJP unveils Gond queen's statue in Bhopal\, Congress protests
MMTC Q3 net profit falls 62 per cent to Rs 12.48 crore
Finance Ministry to assess impact of coronavirus outbreak on trade
AAP expansion plan: Party to connect with one crore people under month-long nationwide campaign
Jamia committee releases video of purported police brutality inside library; political parties react
Bengaluru Open: Sports tech startups ride the tennis wave
No lack of communication between Jyotiraditya Scindia and Kamal Nath: Digvijaya Singh
No handshakes: Viral outbreak spooks Asian places of worship
Flagged off by PM\, Kashi Mahakal Express left Varanasi with a seat reserved for Lord Shiva
Best wishes to Kejriwal for a fruitful tenure: PM Modi
UN: Antarctic high temp records will take months to verify
Starting April\, Indian Navy to induct four more P8I reconnaissance aircraft
Government plans tribal items’ push\, in India and abroad
Odisha to have a larger FY20-21 Budget\, despite lesser Central funds
No point thinking about poor run of form: Mayank Agarwal\, cricketer
Election Commission push for pending poll reforms at law ministry meet
Treat us like something between a telco and a newspaper\, says Facebook's Zuckerberg
Sharad Pawar to meet NCP ministers today as Uddhav Thackeray backs NPR
US raises tariffs on EU aircraft to 15%
Israel’s Benny Gantz vows to form government without Benjamin Netanyahu
