Opec confirms March meeting date\, ending Saudi-Russia tussle
CJI seeks Nitin Gadkari's help on air pollution\, but drops idea
Oil up 2.5% on slowing pace of coronavirus\, US move on Venezuela
ICC Women's T20 World Cup: It will be judged as much by attendance and media coverage as by the performances
Fed policymakers cautiously optimistic on US economy despite new risks\, minutes show
CBI to seek nod to prosecute nearly six public servants
PolicyBazaar rejigs the top deck\, names Sarbvir Singh as its CEO
Mass shooting in German city leaves 8 dead\, several critically injured: Report
Money flow from banks to NBFCs picks up in Oct-Dec
Rajya Sabha rules of procedure likely to be overhauled
Tech bodies to take Data Bill worries to house committee
Dissent in Karnataka: BJP grows louder after cabinet expansion
Trump in India: $2 billion helicopter deal cleared; missile shield LoA received
CCI has no proof against Amazon and Flipkart: Karnataka HC
Analyst Calls: APL Apollo Tubes\,Jindal Stainless\, Sundaram Finance
No death due to Police: Yogi on anti-CAA stir
Trump in India: Welcome in Gujarat\, sunset at Taj Mahal
Trump ousts top defense official who certified Ukraine aid
CM Yogi wants air of festivity in Agra
Adani in talks with Simplex promoters for equity stake
Donald Trump names his Germany ambassador to top intelligence post
PM-Kisan Scheme benefits not reaching tillers: RBI directors
Gold eases from 7-year peak on slowing virus spread\, China stimulus hopes
Slowing virus\, China stimulus hopes support stocks\, yen nurses losses
Weak funding\, slowdown continue to exert pressure on banks\, NBFCs: Fitch
Buy Alembic Pharmaceuticals\, price target Rs 720: Jayesh Bhanushali
Buy Multi Commodity Exchange of India\, price target Rs 1\,385: Jayesh Bhanushali
Buy TV Today Network\, price target Rs 275: Jayesh Bhanushali
J&K opposition changes tack\, willing to join poll process
China cuts benchmark lending rate to prop-up virus-hit economy
Centrum maintains ‘buy’ on Sundaram Finance\, target price Rs 1\,900
CD Equisearch maintains ‘accumulate’ on Supreme Industries\, target price Rs 1\,615
Edelweiss maintains ‘Buy’ on Jindal Stainless\, target price Rs 57
Axis Securities maintains ‘buy’ on APL Apollo Tubes\, target price Rs 2\,370
US left wondering why India chose not to walk that extra mile
SBI Cap Securities maintains ‘hold’ on Sadhhav Engineering\, target price Rs 114
Coronavirus: Niti CEO to find ways to reduce drug import dependence on China
Whatfix raises $32 million from Sequoia\, others
Oil rises on supply worries\, while virus-led demand concerns ease
Assam government receives Clause 6 report
Coronavirus Impact: A long shutdown in China will leave a mark on key sectors
India\, US ink pact on intellectual property rights
Brookfield\, Mubadala may invest $600m in Tata Power’s InvIT
Covid-19 impact: Govt won’t penalise companies hit by supply shortages
Dunzo picks up $11 million from Alteria Capital
What changed for D-Street while you were sleeping
Safe-haven yen takes a hit as hopes for China stimulus grow
Indo-US trade deal: The ball is now in Washington's court
Ashok Leyland may gain on hopes of higher sales in H1 next fiscal
Vodafone Idea counter sees strong spike in delivery
They see wallets in our hands\, but say we have stones: Protesters to SC interlocutors
Walmart bets on PhonePe cash withdrawal facility
Axis Bank set to pick up over 20% in Max Life
Going for the skill? Learn the TCS\, Infosys way
IRCTC steams ahead to another record high
Stocks in the news: Max Financial\, Vodafone Idea\, Simplex Infra\, Axis Bank and Power Grid
Congress stakes claim to one Bihar RS seat\, NCP to 2 from Maha Share
'BUY' or 'SELL' ideas from experts for Thursday\, 20 February\, 2020
Pakistan set to raise Kashmir at Geneva again
PGCIL not to move TDSAT; other PSUs may follow suit
Telecom companies dues to jump after new DoT math
Investments in construction among the worst globally
Five mutual funds that have beaten peers on SIP charts
Fab Five: Funds that have beaten peers on SIP charts
Buy InterGlobe Aviation\, price target Rs 1\,526: Kunal Bothra
Buy Voltas\, price target Rs 755: Kunal Bothra
I-T department moves HC against Flipkart's ITAT ruling
Payment not a worry: Iran\, Uco Bank tell tea traders
India & US delink trade deal from Donald Trump's visit\, eye FTA
KSRTC Bus Accident: Toll rises to 20 in Tamil Nadu bus tragedy; survivors shell shocked
Buy HDFC\, price target Rs 2\,424: CK Narayan
This stock rose 155% in last one year\, but still trades below IPO price
Buy Colgate-Palmolive\, price target Rs 1\,375: CK Narayan
Share market update: Suzlon Energy\, MFSL among top gainers on BSE
China announces biggest drop in new virus cases in almost a month
Regional drink brands grow at twice the rate of Pepsi\, Coca-Cola
Post $110 million funding\, Unacademy is now worth $510 million
Cabinet approves crop cover rejig\, dairy sop schemes
There’s no permanent berthplace for Mahakal
Wall Street has a new big bull on Tesla
Share market update: Hathway Cable\, Optiemus Infra among top losers on BSE
Rupee opens 23 paise down at 71.79 against US dollar
Buzzing stocks: Vodafone Idea\, YES Bank\, IRCTC\, MFSL
Crane accident kills 3\, injures 9 on set of Kamal Haasan's 'Indian 2'\, actor opens up
IPL franchises to cross Rs 500 crore in sponsorship revenues in 2020
Share market update: Auto shares mixed; Ashok Leyland up 2%
5G Trials: DoT to meet telcos\, vendors
Vistara to soon offer inflight calling\, internet services
Tarini Jindal found home away from home in London; says loves travelling with family
Retirement mutual funds' AUM jump 24.46% during April 2019–January 2020
Max Financial jumps 11% as Axis Bank looks to buy 20% stake in Max Life
Nifty tests 12\,100\, Sensex dips 75 points as crude oil prices jump
India recommended as host for AFC Women's Asian Cup 2022
Silicon Valley inventor of 'cut\, copy and paste' dies
Apax Partners\, other PEs in talks to buy CSS
Share market update: Bank shares gain; IndusInd Bank climbs 4%
Stock market update: IT shares advance; Just Dial rises 2%
Coal Auction: Centre decides on minimum discounts for power cos
Gold rate today: Gold hovers near life-highs as investors move to safe havens
Share market update: Pharma shares up; Dr Reddy's Lab gains 2%
When you come from nothing\, it makes you hungry and determined: Maria Sharapova
Vodafone Idea shares rally over 50% in two days; here's why
Stock market update: Private banks edge higher; IndusInd Bank climbs 4%
Stock market update: Realty shares mixed; Godrej Properties up 2%
Debt funds see inflow of over Rs 94\,000 crore in December quarter
Ban on transfer and posting of officials lifted
Airbus to cut over 2\,300 jobs at defense and space division
Share market update: 45 stocks hit 52-week highs on NSE
Stock market update: Sugar stocks mixed; Ponni Sugars jumps 5%
Hurry! This LIC pension scheme that can provide Rs 10\,000 a month will end March 31
Share market update: Metal shares decline; NALCO dips 2%
Stock market update: Cement stocks advance; Saurashtra Cement gains 3%
Job offers delayed in Asia’s financial hubs in coronavirus fallout
Power-hungry JSW Energy could be a long-term bet
No detail too small for Saudi Prince as G-20 offers redemption
Share market update: FMCG shares trade higher; GCPL rises 2%
Inox Leisure gains 22% on good financials\, strong expansion
Don't fall for the poisonous lookalike ‘bhadraksha’; maximise the divine effects of rudraksha
Share market update: PSU bank shares rise; J & K Bank climbs 3%
Death toll in China's coronavirus climbs to 2\,118
Suzlon surges 10% amid reports of SBI approving restructuring proposal
Share market update: OMCs trade mixed; HPCL down 1%
Scale your business fast: DMC will offer knowledge\, strategies and latest trends in digital world
Indo-US trade deal not 'stuck'; Govt sources in India: Trump says saving 'big deal' for later
If grey market is telling the real story\, here is your next multibagger
Share market update: Power shares mixed; NHPC dips 2%
Industry is in a bad shape\, but Airtel was always safe: Mittal
Commodity outlook: Most metals gain; here’s how others may trade today
Cabinet okays Bill to regulate Rs 3\,000 crore fertility industry
Share market update: Telecom shares mixed; Vodafone Idea surges 11%
Stock market update: 65 stocks hit 52-week lows on NSE
Bet on smaller banks for 5-10% upside\, but long-term outlook weak: Hemang Jani
Order freezing ex-PNB chief's assets set aside
Cayman 1st on fin secrecy index
Share market update: Consumer Durables shares trade higher; Crompton rises 2%
Donald Trump to visit India with son-in-law\, treasury & commerce secys\, trade rep\, NSA
China cuts loan rate as it battles coronavirus impact
Share market update: BSE Capital Goods index up; AIA Engineering rises 2%
Sterlite Technologies shares jump over 7%
City gas distributors may not have to tie up supplies for 5 years
Share market update: Media shares gain; Zee Media jumps 4%
War with Netflix and Disney looms for India’s top local streamer
UBS names ING chief Hamers to head Swiss banking giant
Top intraday trading ideas for afternoon trade on Thursday\, February 20\, 2020
Long association with Bengal: UBI stakeholders fear losing identity with merger
Not 70 lakh\, but over one lakh to attend Trump roadshow
Can I claim tax deductions on my SIP investment?
Chidambaram slams Centre's move to make crop insurance voluntary
Share market update: Nifty Financial Services index up; Indiabulls Housing surges 14%
AB InBev wants its premium brands to have a bigger play in India's beer market
India 'bigger problem' than China on reducing carbon emissions: US presidential aspirant Michael Bloomberg
Happy feet: Welspun CEO's dance with employees wins over Twitterati; Harsh Goenka admires Dipali Goenka's work culture
Share market update: Infra stocks rise; Suzlon Energy jumps 9%
UIDAI wants 400 Aadhaar cards deactivated in Telangana
Uphaar tragedy: SC dismisses curative plea by victims; no further jail term for Ansal brothers
Share market update: PSU shares advance; REC gains over 2%
SBI Cards IPO to open on March 2
Share market update: Nifty Energy Index flat; ONGC up 2%
Share market update: Fertilizer stocks mixed; Nagarjuna Fertilizers climbs 4%
Share market update: Mining stocks trade lower; Inani Marbles down 2%
MH-60 Seahawk: Why India is in love with this 'Romeo' helicopter
Affidavit case: Fadnavis appears before court\, gets bail
Coronavirus outbreak chills China’s red-hot home rental startups
API makers surge up to 110% in 50 days as virus hits Chinese exports
Amicus Capital invests Rs 70 crore in Berar Finance
Share market update: Nifty commodities index flat; Tata Steel up 2%
Louis Vuitton India net profit jumps over 24% in FY19
Asia FX sentiment weakens; bearish bets pile on Singapore dollar: Poll
Thomas Cook shares hit upper circuit on share buyback buzz
India should consider local manufacturing of telecom equipment: Country’s top cybersecurity official
Aircel-Maxis: Delhi court grants time till May 4 to CBI\, ED to complete probe
India ranks 77th on sustainability\, 131st in child flourishing index rankings: UN report
Best corporate bond funds to invest in 2020
Best corporate bond mutual funds to invest in 2020
Buy Ujjivan Financial Services\, price target Rs 400: Kunal Bothra
Buy Birlasoft\, price target Rs 110: Kunal Bothra
N. Macedonia wins EU praise for pioneering coal-to-solar shift
Buy Biocon\, price target Rs 325: Kunal Bothra
Germany's PNE wins new wind projects\, shares hit 17-year high
Indiabulls Group stocks jump up to 15% on reports of no irregularity in deals
Vijayawada: HC seeks explanation on payments to power cos
Radicalism disturbing world peace\, only India has solution: Bhagwat
Tokyo shares close higher as weaker yen lifts automakers; virus caps gains
Australia\, NZ shares close at record highs
Coronavirus impact: Outbreak slashes China's carbon emissions; makes air cleaner
Andhra Pradesh govt proposes to set up solar plants to produce 10\,000 MW
CCS pension rules relaxed for central govt staff appointed just before Jan 1\, 2004
China sees drop in new virus cases\, two Japan cruise passengers die
India's third coronavirus patient discharged from hospital in Kerala
SC questions issuance of death warrants by trial courts before expiry of time period for appeal
Rajasthan gets largest investment of Rs 4\,000cr in solar sector
PAN card\, land and bank documents no proof of citizenship: Guwahati HC
Number of Indians getting permanent residency in Canada increases as US toughens visa policies
Look at disinvestment from a larger perspective\, not just investors’ point of view: Mohammad Khan
State human rights commissions asked to join common NHRC portal
China lab says conspiracy theories hurting efforts to curb virus
Voda Idea likely to pay Rs 1\,000 cr in AGR dues today: Source
Nirogi Rajasthan\, prosperous farmer top priorities for Rajasthan govt: Gehlot
Zerodha applies for mutual fund license
China objects to Home Minister Amit Shah's visit to Arunachal Pradesh
Nirbhaya convict Vinay Sharma bangs head against wall\, receives minor injuries
Chinese banks' bad loans may spike by up to $1.1 trln due to virus hit: S&P Global
SBI Cards IPO to open on March 2: Everything you need to know
TRIL appoints Ritesh Sachdev as senior vice president and head- commercial leasing and asset management
Indian textile and apparel industry to be affected due to coronavirus attack in China: CMAI
Pick pharma stocks carefully; Ipca\, Torrent look good in the midcap space: Mukul Kochhar
Barbeque Nation IPO: All you need to know
Deutsche Bank boosts loans to cash-strapped tycoons in India
Self-reliance in small arms manufacturing fundamentally necessary for India: CISC R Hari Kumar
Share market update: BSE Midcap index up; MFSL surges 10%
Thrashing of Dalits: Rahul Gandhi asks Cong govt in Rajasthan to take immediate action
Coronavirus may drag global GDP by 1 percentage point if containment delayed beyond June: Report
Crude oil futures up on spot demand\, global cues
China stocks find footing on rate cut\, policy support hopes
European shares muted as investors assess virus risks
Hyundai's new Creta to look like this from inside
ICRA cuts diamond sector outlook to negative on coronavirus
Precious Metals: Gold\, silver fall in futures trade amid sluggish demand
Udemy secures $50 mn investment from Benesse Holdings
Goldman sees little room for RBI to ease rates
MG Motor India's SUV Hector bookings cross 50\,000 units
India allots import licences for 1.1 mn tonnes of refined palmolein from Indonesia: Sources
Fitch removes Bharti Airtel rating from ‘watch negative’
Agri Commodities: Mustard\, soya oil slump in futures trade amid weak demand
Impact of proposed new income tax rates on a Rs 15 lakh salary
Impact of proposed new income tax rates on a Rs 20 lakh salary
Overnight mutual funds AAUM grows 5 times in 10 months
Sula Vineyards launches country's first canned wine
Passenger vehicle retail sales fall 5 per cent in January: FADA
Vehicle retail registered second-straight month of decline in January
Institute of Technology\, NIRMA University are winners of 5th Mitsubishi Electric Cup
Is IIFL Focused Equity Fund a safe option?
No intention to scrap Art 371: Amit Shah assures Northeast
Gold village of Kerala: How Koduvally's local jewellers came together to take on organised retail's might
Nirbhaya: Court seeks Tihar jail authorities' reply on convict Vinay's plea for medical treatment
Police detain students marching towards UP Bhawan demanding Kafeel Khan\, Tahir Madni's release
Dubai- the world capital of blockchain development
Harry\, Meghan's royal duties to end on March 31; Queen reviewing couple's use of 'Sussex Royal' label
Deepika Padukone rocks a black bodysuit with a blazer\, trolls have a field day
One more Indian tests positive for coronavirus on cruise ship off Japan
Ahmedabad: Cricket stadium ready to host Trump\, gets building use nod
Future Lifestyle Fashions to raise over Rs 600 crore from promoters\, IFC
Now tourists can take a tour of Puducherry Lt Governor's house\, Raj Nivas\, during the day
Assam situation improving\, no concerns as yet: Chandra Shekhar Ghosh\, Bandhan Bank
Hindujas\, Cerberus may partner to bid for YES Bank stake
New Parliament House likely to cost Rs 776 crore
SC order on commissioning of women enabling\, will give clarity moving forward: Army chief
'Like a zombie apocalypse': Residents on edge as coronavirus cases surge in South Korea
Bet on largecaps as economic recovery looks elusive: Andrew Holland
Maharashtra Govt invites private builders to partner MHADA for Affordable Housing
Reliance\, HDFC twins pull Sensex lower; Nifty below 12\,100
Will go public in next 15-18 months\, says SBI Mutual Fund CEO
Kiran Mazumdar-Shaw lauds AAP's 'mohalla clinic'; says primary healthcare can play key role in combating outbreaks like coronavirus
EEPC India seeks expansion of Sabka Vishwas scheme to matters relating to customs
HDFC Bank SME book doubles to Rs 1.48 lakh cr in under 3 years
Axis inks pact with Max Fin and its unit for likely strategic deal
Icra revises domestic pharma industry outlook to negative due to coronavirus outbreak
Budget 2020 was a missed opportunity: Kantar Frrole report
As SC orders permanent commission to women in Indian Army\, a look at armies around the world
LPG prices may come down next month: Dharmendra Pradhan
Altair\, IIT Madras sign MoU to foster startups with technology access
India congratulates Ghani for winning 2nd term as Afghan president
Super Smelters to invest close to Rs 1\,000 crore in setting up a greenfield steel unit in West Bengal
To avoid ''office of profit'' row\, no perks for Ravindra Waikar\, Arvind Sawant?
Discoms use drones for effective maintenance of power distribution infrastructure in Delhi
Customs to roll out faceless assessment across India
Have You Heard of This Festival?
Tech View: Nifty50 forms bearish candle; but the bias stays positive
F&O: Nifty forms a small-bodied candle\, suggests buying interest
Samsung brings its new foldable phone\, Galaxy Z Flip\, to India at Rs 1.10 lakh
Obit: A look back at the life of Larry Tesler\, the man who created most indispensable shortcut for keyboard warriors
CWC must hold leadership elections to energise workers: Tharoor
Trump visit will bolster support for Republicans in US election\, feels Indian American doctor and fund raiser
Fintech investments in India nearly doubled to $3.7 billion in 2019\, says Accenture
India says will not 'rush into' a trade deal with US
Sebi should allow bundling of MF with loans\, other financial products: Industry body
Air India extends suspension of its China flights till June 30
Award of fresh coal supply contract by government is positive for the power sector: ICRA
A ‘Cold/Mess’ situation: Prateek Kuhad leaves the Internet confused with his retweets
Apple gives AR tool ‘Quick Look’ a facelift; adds button for preview\, link with payment gateways
Kunal Bahl says change important for companies to stay relevant\, cites Facebook’s example to emphasise on need for innovation
Macho culture\, coding contests & hackathons: Why women are being put off by Data Science roles
Man's best friend: What makes your cute little furry companion special?
Adani Gas gets oil regulator nod for demerger\, stake sale to Total
What's on your plate? Choosing a big breakfast over a lavish dinner may prevent diabetes
Academy Award winner Mahershala Ali to star in Apple drama 'Swan Song'
Guru Ravidas Temple: Ex-MP moves SC\, seeks contempt action against DDA\, Delhi govt
Government to verify telcos' AGR math via test checks before March 17: Sources
Market Movers: Indiabulls stocks rally; IRCTC\, YES Bank all abuzz
Steven Spielberg’s 23-yr-old daughter joins adult entertainment industry\, says parents 'not upset'
SC appointed interlocutors hold discussions with Shaheen Bagh for second consecutive day
Rupee slides 10 paise to over 1-month low of 71.64 against US dollar
Ather Energy expands operation to 4 more cities
India-focussed offshore funds\, ETFs see $2 billion outflow in December quarter
TikTok to focus on self regulation to ensure people 'post responsibly'
Hiver launches ‘Lite shared inbox’ to help small businesses
Why empowering patients in the healthcare sector is important?
RBI minutes: MPC members feel economy still hasn't bottomed out
Govt dealing with AGR crisis\, focussed on reviving sustainability of sector: Sunil Mittal
Streamlining internal processes enabled us lead OTP performance in January: AirAsia India CEO
Govt to bar telecom vendors of countries that disallow purchase from Indian firms
Applause Entertainment\, Firework partner to create short format originals and IPs
Trump visit: US first lady likely to visit Delhi govt school\, interact with students
Haryana procures record 6 lakh tonnes of mustard
View: TCS\, Infosys\, HCL\, Nasscom\, do you hear the call of COVID19?
In 2020\, J&K administration busy with Investors Summit\, census\, Amarnath Yatra
Inflation concerns prompted members to pause: RBI MPC minutes
Bitcoin goes wild as volatility jumps to 3-month high
India rejects China’s objection to Shah’s Arunachal visit
AGR dues: Govt to look at balancing SC order compliance\, telcos' health\, consumer interest
Morgan Stanley to buy E*Trade Financial in $13 billion deal
Our men foiling BAT action even before Pakistan is able to launch them: Indian Army chief Naravane
DRDO anti-drone system to be deployed for Trump-Modi roadshow
Westinghouse set to sign pact with Indian firm for nuclear reactors during Trump visit
Context of Trump's remark was balance of trade\, bid to address concerns: MEA
Centre releases Rs 19\,950 crore as GST compensation to states and UTs
Taliban deputy leader says 'committed' to peace in NYT op-ed
Woman raises pro-Pak slogans at anti-CAA stir in Bengaluru
SAT upholds Sebi decision to recover over Rs 300 cr from Samruddha Jeevan in CIS case
India needs to invest $109 billion to halve its road crash fatalities in next decade: World Bank report
GDR manipulation: Sebi bans officials of Resurgere Mines and Minerals India
Coronavirus impact: TV prices may rise up to 10% from March
Sebi bans Midvalley Entertainment\, officials from securities market for 7 years
Kuwait opens defence attaché office in India to ramp up security cooperation
BSE equity derivatives turnover touches record high of Rs 5\,251 crore
Oil firms on supply threats and easing demand woes
Asia Pacific carriers to lose $27.8 billion revenue due to coronavirus: IATA
Gold climbs to 7-yr high as virus woes boost safety demand
Wall Street steady as virus fears build; E*Trade surges on buyout deal
New Delhi downplays Trump's comments that US not treated well by India
RBI clears appointment of Sunil Gurbaxani as Dhanlaxmi Bank MD
RBI clears Sunil Gurbaxani appointment Dhanlaxmi Bank MD
Ram Mandir Trust members meet PM\, invite him to visit Ayodhya for bhoomi pujan
Rahul sole contender for party president's post: Congress on anxieties over leadership issue
India\, US eyeing to ink five pacts during Trump's visit
Anti-CAA protests: Karnataka Home Minister never apologised for police action\, says Ramachandra Guha
Punjab releases Rs 349.50 crore for GPF\, Verka plant and cycle valley project
AEPC identifies top 10 product lines to enhance apparel exports
Amit Shah assures that centre is considering Meghalaya assembly resolution on ILP
Telcos owe around Rs 22\,589 crore as licence fees; rest Rs 70k crore is interest\, penalty
Finance ministry collecting data to assess extent of financial exclusion in West Bengal\, Bihar and northeast
Police: Suspect detained after stabbing at London mosque
France’s Groupe ADP to buy 49% stake in GMR Airports for Rs 10\,780 crore
Indian Railways' dedicated Freight Corridor to give Amazon\, Flipkart cheaper way to transport
New Covid-19 cases decline\, but tracking method revised again
US IRS sues Facebook for $9 billion in unpaid taxes
Extinction watch: Rhinoceros\, hunted for its horn
How 5G technology is critical to India's digital dream
Global IT companies told to assign value to brands
View: The diminishing importance of cheap labour makes five reforms India’s need of the hour
The numbers favour Australia but Indian team is looking to create history
View: Banking sector may meet telcos' fate. Here's how to avert it
How Innovation-driven firms are introducing new medical devices that are disrupting traditional models
