Twitter\, TikTok in talks for possible merger: Report
AI Express plane landed 1\,000 metre beyond actual touchdown point: Aviation experts
New Zealand marks 100 days of coronavirus elimination
Prime Minister Narendra Modi wants farmers to slash use of urea
Aatmanirbhar Bharat: Taking a leaf out of Centre’s playbook\, states too push local procurement
Grant Thornton report: How ITNL led to fall of Infrastructure Leasing & Financial Services
Filling the void: Clones clock up big demand on TikTok ban and Covid-19 pandemic
5 things you should know about a standard health insurance product
Thanks to the lockdown\, 3 out of 5 people are now ready with vacation plans: Survey
Why we love to tell stories of our investing success and not about losses\, missed opportunities
How gold and silver performed for the week ending August 6\, 2020
Motilal Oswal Multicap 35 mutual fund review: How it is making a comeback after a blip last year
IT sector likely to be multi-year winner: Stocks that can help you ride the digital wave
How to select the right portfolio management service
Stock market is inching towards Jan peak\, but this rally is different: Here are 9 reasons why
Does my daughter have a right to my property while I am alive?
Should you plan a vacation now? The answers to these 5 questions will help you decide
Realty hot spot series: Prime residential area in Thane with multi-storey apartments\, good connectivity
Stock pick of the week: Reasons why Exide Industries is expected to come back strong in 2021-22
MF portfolio doctor: 10% annual hike in mutual fund SIPs can help Malik accumulate Rs 1 crore in 15 years
4 online tools useful in personal finance
Benjamin Graham kind of value investing is difficult to implement in India: Neil Parag Parikh\, PPFAS MF
Your 9-point checklist for a covid-free holiday
Coronavirus impact: Why the idea of diversification is looking like the old bridge on river Choluteca
Money & Relationships: What may go wrong when you buy property\, take home loan jointly with sibling
Locked out of distribution networks\, regional brands may find it hard to regain ground
Buzz of TikTok return causes uncertainty; investors now in a wait-and-watch mode
Coronavirus is making it tough to breathe\, even for Indian pharmaceuticals
Buffett’s favourite market indicator hints a major selloff’s in the making
Aramco CEO says still working on RIL deal
Baba Ramdev's Patanjali considers bidding for IPL after Vivo retires on short notice
Baba Ramdev's Patanjali considers bidding for IPL after Vivo vacates its slot
Stocks in the news: Bharat Forge\, Prestige Estates\, Titan\, Eveready\, BEL\, Cipla\, BoB and Divi's Lab
RBI's restrictions: Banks in a fix over current account curbs
Swiggy joins quick grocery delivery race with InstaMart
Hyderabad pharmaceutical Raghava Life Sciences gets nod to make Favipiravir API
BCCI invites bids for IPL 2020 title sponsorship rights by August 18
Blackstone set to acquire Rs 12\,745 crore of Prestige assets
Indian companies ready to export coronavirus test kits\, target Latin America\, Eastern Europe markets
LDF deflects blame\, targets IUML\, which points to 'piecemeal' process
Call ladder on Tata Consumer could bring more upside
Not 'pandemic'\, 'corona' or 'Covid-19'\, but '2020' could be the word of the year
While coronavirus keeps stores closed\, eCommerce saves the day for mid-level brands
BJP cites 'poaching fears' as reason to shift 19 MLAs to Gujarat\, keeps a tab on 'factionalism'
Global cos eyeing SsangYong stake as Mahindra looking to scale down role in loss-making biz
2021 will be the year of Dekho Apna Desh\, says Tourism Minister Prahlad Singh Patel
SGX Nifty down 15 points; here's what changed for market while you were sleeping
LeapFrog ramps up India exposure\, scouts for deals
We are gradually reducing underweight in select financials and cyclicals: Parag Thakkar
Business in slow lane in key states\, show July economic indicators
Power projects may not be able to use 'grandfather' clause for Chinese imports\, according to MNRE
Brokers smile as retail investors storm Street
I can see a big split among BJP MLAs\, says CM Ashok Gehlot
J&K High Court finds nothing amiss in UT decision to raise earnest money deposit
FDI powers to RBI may cut processing time sharply\, to improve ease of doing biz
Gold loan companies say asset price risks well taken care of
Allow gathering of 100-200 instead of 50 persons: Bihar BJP to Election Commission
Gold holds steady on virus fears\, US-China tensions
Add philanthropy & Ambani slips in global ranking
Asian shares cautious as Sino-US tensions weigh
Oil prices back on the rise on U.S. stimulus hopes\, Iraq output cut
M&M in line for sustained re-rating on rural gains
Dollar tries to keep rally alive in a short market
Actress and former Miss India World\, Natasha Suri\, tests positive for Covid-19
Hong Kong media tycoon Jimmy Lai arrested under security law\, bearing out 'worst fears'
Focus on Rajasthan HC orders during Ashok Gehlot's second stint in a similar 'merger' case
Nifty is going to be irrelevant\, real opportunities are outside the index: Gautam Shah
India faces lost generation as coronavirus worsens an already bad child-labour problem
Punjab needs \"new Captains\": Partap Singh Bajwa
President Ram Nath Kovind to host a truncated 'at home' amid Covid-19
India's coronavirus mortality rate may retreat below key threshold. Here's what it means
Trending stocks: Vodafone Idea shares up nearly 1%
Trending stocks: YES Bank shares gain nearly 5% in early trade
This BFSI boss says loss of social connect inevitable in permanent WFH\, managers must prepare themselves
Trending stocks: IndusInd Bank shares gain 1%
Gold prices jump on worries over rising Covid-19 cases
Is Covid-19 a blessing in disguise for green energy companies?
Trending stocks: ICICI Bank shares up nearly 1%
Trending stocks: Bajaj Finance shares rise over 1%
Divi's Laboratories Ltd. shares up 11.72% as Nifty gains
Trending stocks: SBI Card shares trade flat in early session
Saudi Aramco still aims for $15 billion investment in India’s Reliance
HDFC Bank\, L&T drive Sensex 300 points higher; Nifty tops 11\,300
Share market update: 68 stocks hit 52-week highs on NSE
Bharat Heavy Electricals Ltd. shares gain 6.38% as Sensex rises
Call on online sale of liquor pending in Karnataka\, but political opposition on a high
Environment impact assessment draft must be withdrawn to stop 'environmental destruction': Rahul Gandhi
Share price of Motherson Sumi Systems Ltd. rises as Nifty strengthens
India lacks in ease of doing business\, says Volkswagen's top boss
327 items form 3/4th of imports from China\, ‘can be alternatively sourced’
Ashok Leyland Ltd. shares up 3.6% as Nifty gains
Near-6\,000 new Covid-19 cases in Karnataka; state tally rises to 1.78 lakh
RBI’s silence on record India bond sales leaves traders baffled
Share market update: 2 stocks hit 52-week lows on NSE
No drought of funds for flood relief in Karnataka as government hikes compensation for victims
Share price of Lupin Ltd. jumps as Sensex gains 288.0 points
Titan shares up ahead of Q1 results; here’s what to expect
Defence stocks rally up to 13%. Here are the likely winners of govt's 'Make in India' move
Apollo Hospitals Enterprise Ltd. shares up 1.93% as Nifty gains
Mutual funds folio count surges by 18 lakh in June quarter
Buy Lupin\, target price Rs 1015: Motilal Oswal
Neutral on Pidilite Industries\, target price Rs 1335: Motilal Oswal
Buy Mahindra & Mahindra\, target price Rs 720: Motilal Oswal
Add DCB Bank\, target price Rs 87: ICICI Securities
Buy Apar Industries\, target price Rs 423: Emkay Global
Reduce Bata India\, target price Rs 1100: ICICI Securities
Sell Blue Star\, target price Rs 445: Emkay Global
Hold Kajaria Ceramics\, target price Rs 386: Emkay Global
Buy Dalmia Bharat\, target price Rs 1000: Anand Rathi
Buy HPCL\, target price Rs 304: Motilal Oswal
Buy Divi's Laboratories\, target price Rs 3350: Motilal Oswal
Buy Alkem Laboratories\, target price Rs 3665: Motilal Oswal
Buy Amara Raja Batteries\, target price Rs 845: Edelweiss
Buy Birla Corporation\, target price Rs 779: Emkay Global
Buy Britannia Industries\, target price Rs 4300: Axis Securities
Rupee opens 2 paise down at 74.95 against dollar
REC Ltd. shares rise 2.13% as Sensex climbs
Share market updates: Bank shares rise; Kotak Mahindra Bank gains 2%
Biggest India opportunity lies at the bottom of the pyramid: Google’s Karan Bajwa
Share market update: Auto stocks up; Mahindra & Mahindra jumps 6%
Share price of Shree Cements Ltd. jumps as Sensex gains 273.43 points
BJP\, Congress leaders on toes as Manipur MLAs to participate in trust vote in Assembly
Share price of Aurobindo Pharma Ltd. rises as Nifty strengthens
Rally has not been as narrow as it appears to be\, says Taher Badshah of Invesco MF
Share market update: Nifty Financial Services index up; ICICI Lombard climbs 3%
Commodity outlook: Base metals fall; here's how others may fare
ED quizzes Rhea for the second time\, 'wants more answers' over mismatch of income & expenditure
Share price of Hindustan Petroleum Corporation Ltd. jumps as Sensex gains 326.24 points
Share market update: FMCG shares advance; Emami soars 16%
Share price of Cummins India Ltd. jumps as Sensex gains 321.01 points
Share price of Info Edge (India) Ltd. rises as Nifty strengthens
Dr Reddy’s likely to do better\, downside possible in Titan in short run: Sandip Sabharwal
Share market update: IT stocks up; Tech Mahindra gains 1%
Share price of Indiabulls Housing Finance Ltd. rises as Nifty strengthens
The Indian tycoon Zuckerberg backed threatens to topple him on global rich list
Share price of Ambuja Cements Ltd. rises as Nifty strengthens
Share market update: Media shares advance; DB Corp jumps 5%
Steel Strips Wheels bags orders worth USD 237\,000 from US
Maharashtra: Fire at commercial building in Thane; no casualty reported
India reassures Nepal after Jaishankar’s remark on Gautama Buddha's birthplace
Frequent earthquakes prompting people to look for home insurance: Survey
Bajaj Holdings & Investment Ltd. shares up 1.5% as Nifty gains
Pharma company Digital Vision under DCGI lens for contaminated cough syrup
Fans start celebrating Rajinikanth's 45th anniversary in Tamil cinema 1 week in advance\, actor responds
Share price of Tata Power Company Ltd. jumps as Sensex gains 361.5 points
Share market update: Nifty Metal index flat; Hindustan Zinc loses 1%
Federal Bank Ltd. shares decline 0.37% as Sensex climbs
Salman Khan set to return with 'Bigg Boss 2020'\, shoots new promo at Panvel farmhouse
Rapper Badshah questioned for 3rd day in a row over fake influencers case\, denies allegations against him
Equity mutual funds see net outflows in July
Biocon Ltd. shares rise 2.58% as Sensex climbs
Further hearing needed in 2009 contempt case against Prashant Bhushan\, Tarun Tejpal: SC
Share market update: Nifty Pharma index soars 6%; Cipla surges 10%
Piramal Enterprises Ltd. shares gain 1.77% as Sensex rises
Share price of LIC Housing Finance Ltd. rises as Nifty strengthens
PM Modi inaugurates first ever optical fibre cable project for Andaman and Nicobar Islands
Share price of ICICI Prudential Life Insurance Company Ltd. rises as Nifty strengthens
Pune based IT firm Persistent Systems' CEO Chris O'Connor resigns citing personal reasons
India's largest crocodile park strapped for cash after coronavirus lockdowns
Flipkart launches its startup accelerator program Flipkart Leap
Share price of Havells India Ltd. jumps as Sensex gains 337.28 points
Can Vodafone Idea survive even if SC lets it stagger AGR dues?
Divi's Laboratories shares zoom over 18% after Q1 results
Share market update: NIfty PSU Bank index up; SBI climbs 2%
Share price of SBI Life Insurance Company Ltd. as Sensex gains 290.16 points
Equity MFs see first monthly outflow in 4 years: Amfi
AC\, commercial refrigeration businesses to return to normal by last quarter of this fiscal: Blue Star
Share price of HDFC Life Insurance Company Ltd. jumps as Sensex gains 302.0 points
New rule coming? You may soon be eligible for gratuity even without 5 years on the job
New rule coming? You may soon be eligible for gratuity even without 5 years on the job\, says report
TVS Motor Company Ltd. shares decline 0.3% as Sensex climbs
Share market update: Nifty Private Bank index up; HDFC Bank gains 1%
Cipla shares rally 10% after Q1 earnings
Marico Ltd. shares 0.0% as Sensex rises
Hansal Mehta to make web series on gangster Vikas Dubey\, says sees an 'edgy political thriller' emerging out of it
Combination of skilling\, AI deployment helping businesses succeed: Microsoft research
Share price of Page Industries Ltd. falls as Nifty strengthens
Share price of Bosch Ltd. falls as Sensex gains 259.1 points
Share market update: Realty stocks advance; Indiabulls Real Estate jumps 7%
Share price of Bharti Infratel Ltd. rises as Nifty strengthens
Jhunjhunwala's VIP bet is down 50% since Feb highs\, yet it has no takers
Petronet LNG Ltd. shares gain 0.98% as Sensex rises
Share market update: BSE Power index rises; Adani Power climbs 4%
Oil rises 1% on Saudi Aramco's upbeat demand view\, Iraq supply cut
Share price of ACC Ltd. falls as Sensex gains 303.43 points
Manmohan Singh offers three remedies to help the crumbling economy pull itself together
Share price of Voltas Ltd. falls as Nifty strengthens
Burman family open to hike Eveready stake\, no takeover plans: Mohit Burman
How publishers can invest in a privacy-forward future now
Share market update: BSE Consumer Durables index up; Blue Star rises 3%
NMDC Ltd. shares gain 1.57% as Sensex rises
Will give digital degrees online to pass outs who haven't received them\, DU tells HC
Godfrey Phillips' cigarette plant located in Navi Mumbai resumes production
Share price of Tata Consumer Products Ltd. falls as Nifty strengthens
Kozhikode plane crash: Air India Express says 56 injured passengers discharged from hospitals
Share price of MRF Ltd. falls as Sensex gains 280.93 points
Share market update: BSE Capital Goods index jumps 4%; BEL leaps 10%
Share price of Indraprastha Gas Ltd. rises as Nifty strengthens
Urban India has to perform for rural economy to grow on an absolute basis: Sanjeev Prasad
Share market update: BSE Telecom index up; HFCL skyrockets 13%
Share price of Shriram Transport Finance Company Ltd. jumps as Sensex gains 290.49 points
How can I build a diversified mutual fund portfolio?
LIVE Market Technicals with CK Narayan
Pidilite Industries Ltd. shares rise 1.51% as Sensex climbs
Former President Pranab Mukherjee tests positive for COVID-19
Andaman optical fibre cable project symbol of PM Modi's commitment to ease of living: JP Nadda
Andhra Pradesh unveils new Industrial Policy\, identifies 10 thrust areas to propel economic growth
Crompton Greaves Consumer Electricals Ltd. shares up 0.36% as Nifty gains
Oil stocks boost FTSE 100 as China data signals recovery
Share market update: Nifty Infrastructure index gains; Reliance Power surges 9%
Honda Cars India begins pre-launch bookings of new Jazz
Mahindra & Mahindra Financial Services Ltd. shares down 0.85% as Nifty gains
China shares rise as slowing factory deflation boosts recovery hopes
Microsoft's TikTok bid spotlights Windows maker's history with China
Priyanka Chopra Jonas says quarantine time has been a 'blessing' and helped her become creative
Sushant Singh Rajput death: Mumbai Police opposes CBI probe\, tells SC that Bihar Police FIR 'politically motivated'
Share market update: Nifty Commodities index rises; Tata Power climbs 3%
IFC commits $10 million investment in Endiya Partners-II
Loss in Karnataka due to floods and torrential so far is estimated to be Rs 3\,500-4\,000 cr: Minister
Rahul Gandhi's objections to draft EIA 'unnecessary and premature'\, says Javadekar
Australia shares end near 3-week high\, buoyed by financials
Colgate-Palmolive (India) Ltd. shares decline 0.47% as Sensex climbs
India to promote manufacturing of some products to boost market share
UGC in SC questions decisions by Delhi\, Maharashtra to cancel exams amid COVID-19 pandemic
15% students enrolled in Delhi govt schools not traceable since lockdown\, not attending e-classes
Share market update: Midcap stocks advance; PNB Housing Fin leaps 10%
Siemens Ltd. shares decline 1.85% as Sensex climbs
Short bonds in India lead selloff as demand worries loom
Lockdown woes: L&T Metro Rail may invoke force majeure clause for loss of ops in Hyderabad
Avenue Supermarts Ltd. shares down 0.96% as Nifty gains
DocSumo raises $220 k seed funding from Better Capital\, Barclays\, others
Netflix India makes 'Binod' memes on 'Stranger Things'\, 'Sex Education'\, netizens have a hearty laugh
Container Corporation of India Ltd. shares decline 15.8% as Sensex climbs
Shares climb as China industrial data offers hope for coronavirus recovery
Numaligarh Refinery Limited gets environmental clearance for the Refinery Expansion Project
Share Market update: Smallcap stocks rise; RTN Power spikes 20%
European stocks flat as tech losses offset China data optimism
Gold dips as dollar holds onto gains; US-China spat in focus
Healthcare and hygiene portfolio has grown by 29% in Q1: Emami
Machines beat men in PMS mart to deliver solid returns to rich investors in July
Enquiry on in 63 moons complaint against Chidambaram: CBI to Bombay High Court
Net outflows in equity mutual funds due to profit booking\, say analysts
Rupee settles 3 paise higher at 74.90 against US dollar
Concor faces downgrades over land valuation uncertainty
Telangana crosses 80\,000 mark in Covid cases\, death toll reaches 637
India's economy is slowly recovering\, shows Nomura India Business Resumption Index
BSE StAR MF launches direct investment portal for corporates
Indian Hotels gains 3.5% as company reduces costs by 51% in June quarter
Rockefeller Foundation names FSSAI as finalist for Food System Vision prize
Railways to take action against agency issuing false recruitment advertisement
Reliance Industries' asset monetisation to boost credit quality: S&P
Cochin Shipyard Q1 results: Profit down 65% to Rs 43 crore
SAT suspends judicial work till Aug 19 amid COVID-19
Govt likely to allow co-op banks to lend under MSME Emergency Credit Guarantee Scheme
Rajasthan political row: SC to hear tomorrow pleas on merger of six BSP MLAs with Congress
DU online open book exam begins\, students complain about difficulty in uploading answer sheets
Rs 10\,000 crore Fund of Funds for MSMEs to be operational soon: SBI Chairman
We are strong in SUVs\, SCVs and pickups and we will focus there: Pawan Goenka
Prof David Simchi-Levi at NITIE Webinar - Government should prioritize critical supply chains to apply stress-test\"
TTK Prestige Q1 results: PAT dips 94% to Rs 2.14 crore
Microsoft faces complex technical challenges in TikTok carveout\, risks ire of Trump administration
Sanjay Nirupam attacks Sanjay Raut for comments on Sushant Singh Rajput's family
Studds commissions 2 new facilities in Haryana; invests Rs 200 crore in plants
Union Bank slashes MCLR by up to 15 bps
Venkaiah Naidu lays foundation stone for housing complex for Rajya Sabha employees
PM Modi holds meeting with CMs of six states to review flood situation
Aamir Khan & Kareena Kapoor Khan-starrer 'Laal Singh Chaddha' release date pushed to Christmas of 2021
Chris Pratt & Katherine Schwarzenegger become parents\, welcome baby girl
Baghjan gas well inferno: Blowout preventer placed over the well
SpiceJet introduces in-flight entertainment that can be accessed on personal devices
Tata Projects completes 110 km Surathani-Phuket transmission line project in Thailand
As Rajasthan rebellion fails\, Sachin Pilot meets Gandhis and falls in line
Sushant Singh Rajput death: Rhea Chakraborty approaches SC against 'unfair media trial'\, claims she is being singled out
ConveGenius augments its portfolio\, acquires Gray Matters India
'Desi' dating app QuackQuack sees massive lockdown growth\, crosses ten million user-mark
As domestic tea prices surge\, companies consider imports for first time
Balance of payments to be 'very\, very strong' this year\, green shoots visible in economy: Piyush Goyal
July auto retail better than June but there's still a long way to recovery
Telcos gain as SC hears submissions in AGR case
F&O: Falling VIX suggests Nifty’s overall trend remains bullish
AstraZeneca Pharma India Q1 results: Net profit declines 13% at Rs 18.63 crore
Indus Towers close to signing fibre deal with Reliance Jio\, Tata Sky\, Tata Tele
Right from 1950\, we have followed wrong policies raising production cost: RC Bhargava
Political leaders from South deprived of opportunities by Hindi politics: Kumaraswamy
LG Electronics sets up company-owned e-store in India\, hopes to boost appliance sales
Andaman fibre link to unlock true potential of 4G\, 5G in region: Sunil Mittal
Civil Aviation Minister Hardeep Puri says Kozhikode runway safety as per ICAO guidelines\, questions Cong MPs' tweets
Equitas Holdings Q1 results: Net profit down 25% at Rs 52.5 crore
L&T\, financials drive Sensex 142 points higher; Nifty above 11\,250
Shah Faesal\, who resigned from IAS\, steps down as president of Jammu and Kashmir People's Movement
LIC launches revival campaign for lapsed policies
Titan Q1 results: Firm posts Rs 270 crore loss as lockdown dents sales
Public Enterprises Selection Board selects Soma Mondal as the next chairman of SAIL
India's rental home market takes a hit as expats working in the country uncertain about return
Day 1 of resuming work was much fun\, Teabox CEO felt like a kid in a candy store
Petroleum and Natural Gas Regulatory Board Chairman bats for unified gas price
Pakistani troops fire at border posts along LoC in another ceasefire violation
Tech View: Nifty forms a Gravestone Doji pattern to signal indecisiveness
Spectrum of bankrupt telcos who owe statutory dues cannot be sold: Govt to SC
The shift to a work-from-home model may not get more women into workforce: Industry leaders
UMANG app sees 180% jump in usage\, 11.27 lakh claims between April and July 2020: EPFO
India plans Rs 10\,000 cr transshipment port at Great Nicobar Island: PM Modi
India's top airline IndiGo to raise up to $534 mn via share sale
ADVANTAGES OF SIP INVESTMENTS IN VOLATILE MARKETS​
Market Movers: Defence\, pharma stocks rally; 201 stocks hit their 52-week highs
Zostel bets big on domestic travel\, set to open five hundred new properties in two years
WHO chief decries 'vast global gap' in funds needed to fight coronavirus pandemic
Titan Q1 results: Revenue declines 62% due to Covid-19 led disruption
China sends fighter jets as US health chief Alex Azar visits Taiwan
Karnataka keen to set up immunology research centre\, says Dy CM
Sanjay Dutt discharged from hospital\, returns home
ICICI Bank sets floor price at Rs 351.36 a share for QIP issue
Titan Q1 takeaways: September quarter sales may also be hit as customers stay away
5 killed\, 20 injured in Pakistan blast: Assistant Commissioner Zakaullah Durrani
Time-management lessons during WFH: Bosses (in cabins and cubicles) need to strike a balance between FYI and FYA
You can use your home electric cooker to efficiently sanitise N95 masks
Bullish on IT services\, there is no competition for India: Vikas Khemani
All that glitters is gold! Jeweller makes $1.5 mn gold and diamond-encrusted coronavirus mask
Vertices Partners boss has 'Shoe Dog'\, 'Chaos Monkey' on her reading table\, says she gains a new perspective from every book
75% Indian students find it risky if colleges reopen\, 71% feel it’s vital for economy: Study
Indian Railways extends train shutdown till September 30\, only special trains to run
We have got government approval for IPL in UAE: League Chairman Brijesh Patel
Jimi Hendrix's Japanese sunburst electric guitar from '60s sells for USD 216K at auction
CBI books Ambience Group promoter & HUDA officials for alleged illegal construction of commercial complex
Kolkata: Fire in city building in Pollock Street\, 10 fire tenders pressed into service
A small move away from China means huge tailwinds for contract research in India: Anshul Saigal
Locust swarms persist\, no significant crop loss reported so far\, says government
Top up your SIP to reap maximum benefit over long term
Sebi amends rules for filling of executive director posts
Rebel Congress leader Sachin Pilot meets Rahul Gandhi\, Priyanka Gandhi Vadra amid hints of breakthrough
BoB Q1 results: Lender reports net loss of Rs 864 crore\, loans under moratorium fall
Warren Buffett is carefully picking his spots and not waiting on the sidelines anymore
Akzo Nobel India Q1 results: Posts Q1 net loss of Rs 20 crore
PESB picks Soma Mondal as the next chairman of Steel Authority of India
Work from home boosting India's comfort-wear sector as hosiery market sees a spike in demand
Ready to help Pakistan\, India within mandate on Kashmir issue if requested by both: UNGA president-elect
S&P 500 ends up slightly\, tech-related shares underperform value
Shree Cement Q1 results: Net profit drops 13.5% to Rs 330 crore
Bootstrapped startup Dhiway taps blockchain-based data verification for growth
European firms\, banks take outsourced jobs back home fearing data leaks amid Covid-19
Andhra Pradesh reports 7\,665 new cases\, crosses 2.35L mark in Covid-19 cases
Trade agreements should be fair and reciprocal: Piyush Goyal on India's growing business sentiments
Tamil Nadu crosses 3 lakh cases with nearly 5000 cases; death toll crosses 5\,000
Maldives' eco tourism gets a boost thanks to assistance from India as part of Centre's neighbourhood-first policy
