Banking\, infra should be on your radar; dip in with SIPs
Start SIPs in banking\, infra funds\, says S Naren
Lodha appeals against HC order curbing him from holding office in M P Birla Group
Bus operators on the brink of bankruptcy\, millions lose jobs as sector loses Rs 1.3 lakh cr
Negative prices: Sebi plans risk framework
Ahead of Market: 12 things that will decide stock action on Tuesday
Railway Ministry increases localisation content in Vande Bharat train sets to 75%\, floats fresh \"indigenous\" tender
Telecom infra providers see revenue potential of Rs21\,500 Cr-Rs31\,000 Cr over 3 yrs
Tamil Nadu reports a further decline in cases with 5344 people testing positive
India Inc welcomes new labour laws\, says it will push up costs but gives freedom
Indian economy can touch USD 10 trillion in next 15 yrs: HUL CMD Sanjiv Mehta
Bull run over? Analysts fear a long-dreaded correction in stock markets
India needs to invest Rs 5K cr to give all Indians Covid vaccine: Zydus Cadila Chairman
Angel Broking raises Rs 180 crore from anchor investors ahead of IPO
Current disruption will lead to a massive shift from combustion vehicles to electric vehicles: Amitabh Kant
BPSL's Sanjay Singal appeals against SBI invocation of personal guarantee\, cites Anil Ambani case
Assam\, Meghalaya and Nagaland has soft reopening of school on Monday after several months
Trade Setup: Upside limited for Nifty50 now; stick to defensives
Tiger Global moves High Court seeking stay against Flipkart-Walmart deal tax ruling
Lok Sabha passes Insolvency and Bankruptcy Code Amendment Bill
View: Freeing up the financial system to expand with Bilateral Netting
NSE-BSE bulk deals: Goldman Sachs\, Kuwait Invt Authority lap up Route Mobile
Fiscal stimulus\, faster bank recapitalisation needed to return to 7 pc growth rate: Panagariya
Work-from-home\, online learning fuelling need for massive investment in digital infra: Trai chief
SBI launches e-facility for restructuring of retail loans for borrowers affected by Covid-19 stress
Microsoft doubles down on gaming with $7.5 billion deal for Doom-owner ZeniMax
Affordable smartphone sales shoot up as demand grows due to e-learning needs
Sebi constitutes technical group on social stock exchange
8 Opposition MPs suspended in RS; hold indefinite sit-in inside Parliament complex
US presidential polls: Facebook launches new campaign to encourage voting
British Prime Minister Boris Johnson mulling 2nd lockdown as virus cases surge
View: Why National Education Policy 2020 may not change India's govt schools for better
How FinCEN leak came to haunt banks at worst time
Shriromani Akali Dal’s rebel faction to approach EC for new political party
View: A more explicit analysis of the impact of monetary policy on inflation is needed
Fitch Ratings takes rating action on four NBFCs
Kia hopes to breach compact SUV top 3 with Sonet launch
Seven months into pandemic\, finding a hospital bed is still tough in many places
To get approval in India\, vaccines must work in at least 50% cases
Covid helping SBI General gain share in health
New agri bills will change farmers' fortune\, says Agri Minister Tomar
GST compensation: Opposition states harden stance\, threaten legal action
Centre hikes up rabi MSP by 6.3%\, assures farmers of no dilution of minimum support prices
MPL bags $90m; valuation rises to $450 million
Creation Investment leads Rs 100 crore round in Vivriti Capital
Renew Power\, Mytrah Energy\, Torrent Power seek termination of wind power PPAs
Court of Inquiry into shoddy construction\, crumbling officer’s enclave in capital
