Need to have modern\, effective\, and sensitive security system for all\, says PM Modi
Next tranche of gold bond to open for subscription on Aug 31\, issue price at Rs 5\,117/gm
RBI announces launch of latest round of surveys on consumer confidence\, inflation expectations
Dhaka witnesses protests against China’s treatment of Uyghurs
Retirement fund body EPFO settles 46 lakh COVID-19-related claims worth Rs 920 crore
Babri Masjid case: Court expresses concerns over defence counsels not submitting arguments
Indiabulls Ventures to raise Rs 588 cr via preferential allotments of shares
Supreme Court asks two CERC members to go on leave
ITC plans to merge three subsidiaries with itself\, board meeting in a week
United States to hold high-level talks with Australia\, Japan and India
Padma awards nominations open till September 15: Ministry of Home Affairs
Manufacturing defect leads Boeing to ground several 787 jets
Punjab CM goes into self-quarantine after 2 Congress MLAs test COVID-19 positive
NSE-BSE bulk deals: ICICI Bank sells 2% in I-Sec; DSP MF laps up shares of Sheela Foam
Sushant case: CBI questions Rhea for more than 10 hours
In J&K\, IAS\, IPS and ACB will now come under direct control of Lieutenant Governor
View: A 'whatever-it-takes’ mindset is now needed for India's agricultural reforms
Government launches contest to promote startups in small towns
Stagflation risks spill over to bond markets: Report
August passenger vehicle despatches to grow in double digits\, first time in 26 months
Amazon taps Voot’s Akash Banerji to head marketing of central mobile biz development unit
Defence Minister Rajnath Singh expected to visit Russia next week to attend SCO meet
States' GST revenue shortfall can be bridged by monetising debt\, NSSF: SBI report
Bank credit grows 5.52% in fortnight ended Aug 14: RBI data
Future Enterprises postpones board meeting
GST Council meeting: opposition-ruled state governments start informal discussions
Jammu and Kashmir Bank to raise up to Rs 4\,500 cr by issuing shares\, bonds
Kolkata stock brokers ask WB govt to scrap or cap stamp duty on proprietary transactions
Foreign Tablighi members now stare at exit permit roadblocks
Easing FRBM limit by 50bps not adequate\, say Kerala\, Punjab\, criticising Centre's borrowing options
‘Avoid safe harbour clause in digital trade chapters in India-US trade deal’
Chan Zuckerberg fund backs education tech startup Eruditus; valuation doubles
View: India Inc stands to gain from embracing gender equality in the boardroom & beyond
2 prosecution witnesses in Babri demolition trial want to furnish ‘additional evidence’
Central govt moves full steam ahead to conduct examinations
Relief for road transporters as capacity utilisation rises
GST Council meet: NDA-ruled states welcome centre’s borrowing plan
US election: Donald Trump assails rival Joe Biden in acceptance speech
World Bank’s review unlikely to impact India’s ease of doing business ranking
