US\, Taliban sign deal to pull foreign forces from Afghanistan
Donald Trump imposes international travel restrictions after first coronavirus death in US
China reports 35 more virus deaths\, 573 new cases
13 missing off Japan after cargo ship\, fishing boat collide
Coronavirus\, GDP data\, SBI Card IPO among key factors that will guide market next week
American Airlines suspending flights to Milan after US travel warning
Central banks on coronavirus alert as stock markets seek action
South Korea closes churches as coronavirus tally passes 3\,500
Relief to consumers as fuel prices cut sharply on Sunday
BPCL valuation high\, evaluating bid: Anil Agarwal\, Vedanta
India can fill up export market space vacated by China due to coronavirus: Assocham
Heavy police deployment in Shaheen Bagh as precautionary measure
Tweet Buster: Markets in ‘panicdemic’ & why RBI can’t soften coronavirus hit
View: The pluses and minuses of Shaheen Bagh model are now clear
India Inc gradually shifting to recruiting firms for quality talent: Study
India's crude steel production drops 3 pc to 9.3 MT in January: Report
Indian companies’ supply of heroin chemical helping fund Afghan Taliban: Narco body
Maxxis bets big on India as it eyes to enter top 5 global tyre maker list
Crude oil may remain soft until China demand revives
Ajanta-Orpat group plans to double turnover to Rs 2\,400 crore by FY25
Congress\, CPI(M) stage rallies in Kolkata against Amit Shah visit
Labour ministry keen to retain 8.65% interest rate on EPF deposits for 2019-20
Abu Dhabi wealth fund weighs stake in BR Shetty’s troubled NMC
Three killed after two goods train collide in MP
IRCTC's Golden Chariot to run again from March 22
Polish student asked to leave India after attending anti-CAA rally
Humbled Saudis may still clinch Opec+ deal as virus crisis worsens
View: Uttarakhand CM Trivendra Rawat may still have an uphill fight ahead
Trump says it's 'about time' Fed cuts interest rates
Coronavirus impact: MG Motor February retail sales take hit due to component supply constraints
Bank credit growth dips to 8.5 pc in January: RBI data
Coronavirus may contract China GDP by 6%: Pimco
SpaceX prototype spacecraft blows up during pressure test
Audit committees need to play more active role: CEPR
Maruti Suzuki sales dip 1 per cent in February to 1\,47\,110 units
13 PSU banks hit 52-week lows; should you start cherry picking?
No private drones in air\, traffic diversions as UP CM Yogi Adityanath on 2-day visit to Noida
Situation peaceful but tense in Delhi; Sri Sri Ravi Shankar visits riot-hit areas
Recalling history's 10 deadliest diseases that came before the coronavirus
Why is Israel holding its third election in a year?
Coronavirus and market sentiment: Could this get worse?
Capgemini to hire up to 30\,000 employees in India this year
Pope Francis expels Kerala priest convicted of rape
Uttar Pradesh government transfers 12 IPS officers
Maruti\, Hyundai\, Toyota say production schedules unaffected so far by coronavirus outbreak in China
India has developed proactive defence policy: Amit Shah
View: As dust settles on Trump's India trip\, here's a relook at the road ahead on trade
Opposition to strongly raise Delhi riots in Parl\, demand Home Minister Amit Shah's resignation
'Test checks' on AGR-hit telcos' dues assessment may start this week: DoT sources
Delhi violence\, anti-CAA protests likely to dominate RSS annual meet in Bengaluru
US-Taliban deal: American lawmakers skeptical of Taliban adhering to its commitment
Olympics-Japan's crowdless sport: A prelude to a coronavirus-hit Games?
Afghanistan's partial truce will continue\, 'with goal' for full ceasefire: Ghani
View: Is US-Taliban peace deal a compromise?
Monthly GST lottery offer for B2C invoices to start from April 1
Bring in more efficient\, adaptive tech to further smoothen working of PFMS: FM Nirmala Sitharaman
Sundaram Mutual waives off exit load on redemptions in its schemes
Former India hockey player and Olympic bronze medallist Balbir Singh Kullar dies
Top 10 firms lose Rs 3.35 lakh crore in m-cap in a week
Malaysia swears in new prime minister as Mahathir forced out
Taxmen conduct test-purchase\, fine 1052 dealers
The week in 10 stocks: 470 BSE 500 stocks in the red; Mishra Dhatu & Max India hit 52-week highs
Bill to bring cooperative banks under RBI regulation to get Parliament nod during Budget session
Will see how to provide house to every mill worker: Uddhav Thackeray
NDA united\, will win more than 200 seats: Nitish Kumar
Cisco says India highest growing country in APJC region
Mahindra and Mahindra sales fall 42 per cent to 32\,476 units in February
All refugees in India will be granted citizenship under CAA\, says Amit Shah
Trade setup: Nifty oversold; but don’t try to catch a falling knife
Over 160 rape cases reported on railway premises\, on board trains from 2017-2019: RTI
Dronacharya awardee athletics coach Joginder Singh Saini dies
Government to infuse Rs 200 crore in IFCI next fiscal
Hyundai sales dip 10 per cent in February to 48\,910 units
Strict action should be taken against those involved in Delhi riots: Anurag Thakur
Women protesters vacate anti-CAA protest site in Aligarh
FPIs put Rs 6\,554 crore into Indian capital markets in Feb
What is the real size of the coronavirus epidemic in Iran?
Set up permanent Standing Comm on Comprehensive Administrative Reforms: Manish Tewari
From water to aggregate supplies\, 'Jal Kranti' in drought-prone Vidarbha villages
Emirates offers leave to staff as virus saps demand for travel
House torched in Delhi violence\, BSF man gets Rs 10 lakh from Odisha CM
View: Markets are pricing in a coronavirus recession
Coronavirus update: WHO says window to contain outbreak is narrowing
What the coronavirus end game will look like
Congress links 'cloak-and-dagger' I-T raids to graft probe by Chhattisgarh government\, slams use of CRPF
View: A $30 oil is the real virus threat to Opec
IOC says Maharashtra government positive about Ratnagiri refinery
Delhi riots \"targeted structural violence\": Owaisi
AirAsia India Oct-Dec loss narrows to Rs 123.35 crore
Sterling & Wilson bets big on data centre business\, eyes Rs 800 crore topline in FY21
Hindustan Aeronautics Ltd plans to produce Apache-like military helicopter in India
Security forces arrests an associate of Lashkar militant killed in encounter last year
Mandatory for government departments to make 20 per cent handloom purchase from KVIC\, registered weavers
CBDT to link field officers' annual appraisals\, postings with 'Vivad se Vishwas' mop-ups
Amit Shah performs puja at Kalighat Temple
Realme band features revealed ahead of launch
Tata Motors\, M&M\, MG Motor say coronavirus outbreak in China impacting parts supply
Free voice calls no excuse for poor service quality\, says Trai chief
Syria says 2 warplanes downed by Turkey as tensions soar
Nirbhaya case: SC to consider on Monday curative plea of fourth death row convict Pawan Gupta
Used cars keep Africans moving\, but dumping concerns remain
Govt aims at making India among top three world economies by 2025: Anurag Thakur
Government will unravel conspiracy\, if any\, behind Delhi violence: G Kishan Reddy
ITC focuses on innovation to sustain leadership position in cigarette biz
GST collections for February stand at Rs 1.05 lakh crore\, fall short of target
Delhi violence: 254 FIRs registered\, 903 people arrested or detained
I may never be excited again about a crowd after going to India: Trump told supporters at rally
Punjab prohibits online supply of food from FBOs not possessing hygiene rating
Tata Motors domestic sales drop 34 per cent in February
Coronavirus outbreak batters economies\, raises fear of spread
Emotionally influenced people launched anti-CAA stir in Assam: BJP
Centre responsible for Delhi violence: Sharad Pawar
Assam to get funding from New Development Bank for six lane extra dosed bridge over river Brahmaputra in Guwahati
Water insecurity rising in Hindu Kush Himalayan region: Study
Hyderabad hotel files insolvency plea against Oyo
Honda Cars reports 46 per cent decline in domestic sales in February
No use of carrying out delimitation exercise on 2011 Census\, asks Congress
Ram temple's basic structure to be ready before 2024 polls: Ram Vilas Vedanti
'Companies may default on Rs 2.54-L cr bank loans in next 3 years’
CBI arrests two IAS officers in Jammu & Kashmir arms licence scandal
Citizens of Maharashtra need not worry about CAA-NRC-NPR: Deputy Chief Minister Ajit Pawar
False rumours of violence spark panic in parts of Delhi; police\, AAP leaders appeal for calm
If no minority will be affected by CAA\, why keep Muslims out of it: Chidambaram to Amit Shah
Flying smart: Wi-Fi on flights allowed\, government notifies new rules
Shikha Pandey's contribution has been crucial in taking India to the semi-finals
Watford end champions-in-waiting Liverpool’s 44-match undefeated streak
Wealthy Indians see a route to US via Grenada
Yash Birla case to decide status of offshore trusts
Infosys sees a spot as insurance companies look to vet cyber infra of clients
M&M in talks with Ashok Leyland\, Renault & Hyundai to supply electric powertrains
