Azad and Sharma marked; Rahul boys supersede Lok Sabha seniors
The infection fatality rate of Covid-19 is inversely proportional to testing: Study
Testing for babies born of coronavirus positive mothers may get ICMR nod
Moscow announces advanced trials for new COVID-19 vaccine
Dream Sports’ FanCode launches fan merchandise store
Tablighi Jamaat: MEA says 1\,095 look out circulars deleted\, 630 foreign members left India
Future Enterprises board meets tomorrow to seal Reliance Retail deal
World Bank halts country business climate rankings
IDBI Bank plans to raise Rs 6\,000 cr via share placement
Why you can give HAL Offer for Sale a miss
HDFC Bank\, IndusInd & Kotak out of FTSE indices
Traders carry bullish bets to Sept\, expect Nifty to top 11\,750
Stocks in the news: Edelweiss Financial Services\, GMR Infra\, ZEEL\, NMDC\, IOC and M&M
Tata Sons FY20 profit doubles with TCS help
Future Enterprises board meets tomorrow to seal RIL deal
Gold steady as economic worries counter stronger Treasury yields
Oil dips as US rigs\, refiners appear to have avoided worst of storm
Dollar buoyed by yields surge jump after Fed's inflation shift
Mistry family firms flag high debt level of Tata Steel and Tata Motors
Mistry firms flag high debt at Tata Steel\, TaMo
GOQii to launch medical-grade wearables in 6-12 months: CEO
India can create $500 billion value via Open Digital Ecosystems by 2030: Study
SBI to meet RBI brass on dismissal of UV Asset Reconstruction Co. Ltd bid
SBI to meet RBI brass on Aircel insolvency
Delhi master plan 2041: Delhi Development Authority chalks out citizen engagement strategy
Bankers raise alarm over negative returns
Animal spirits stir\, fresh data shows Indian economy probably past the worst phase
Jio GenNext pings domestic companies with 5G tech; offers buyout\, funding
SGX Nifty up 30 points; here's what changed for market while you were sleeping
Musicians too are birds of a feather
Mayer’s exit signals TikTok deal at hand\, Bytedance founder says firm ‘moving quickly’ to resolve issues
Trump\, Republicans attack Joe Biden amid coronavirus crisis\, street protests
Finance minister Nirmala Sitharaman's proposals on GST compensation unclear: States
Hurricane Laura makes landfall in Louisiana; kills 6 and causes widespread destruction in US
HPE India MD has a super-early start to his workdays; feels WFH has raised expectations of being available 24/7
Corporate bond issuers caught in a bind
Maharashtra firm to run first privately-operated RO-RO freight train between Bengaluru & Solapur
Japan PM Shinzo Abe to address health concerns in press conference
China has escalated its exercise activities by firing ballistic missiles in South China Sea\, says Pentagon
Most Asian markets up with Fed rates seen low for longer
Sunny Leone's name 'mischievously' makes it to top of Kolkata college's merit list
The ideal business laptop to ace work-from-home: HP ProBook x360
Donald Trump formally accepts Republican presidential renomination for elections in November
India GDP forecast is tricky even in the best of times. But this quarter is another matter altogether
What can Elon Musk’s brain startup Neuralink do? We will soon find out
Govt spending preferable to cash handouts: Credit Suisse
2021 will belong to real estate\, play this theme with 4 top picks: Sanjiv Bhasin
BJP to promote a 'lite app' called Kamal Konnect to amplify campaign in Bihar
After Bombay High Court’s scathing Tablighi order\, Maharashtra govt mulls filing appeal
Electric-truck maker Rivian hires ex-Tesla exec as top engineer
Stock market news: YES Bank shares rise over 3% in early session
View: Theatrics aside\, Kamala Harris may turn out to be a key factor for evolving India-US ties
Donald Trump promises tariffs on companies that leave U.S. to create jobs overseas
Stock market news: Vodafone Idea shares surge 15%
How to file ITR-1 with salary\, house and other incomes for FY 2019-20
Stock market news: State Bank of India shares gain nearly 2%
Centre urged to hold back funds to Andhra Pradesh discoms until dues cleared
Fed tolerating inflation over 2% not really that big: Hugh Albert Johnson
Gold rate rises to Rs 51\,100; silver nears Rs 66\,000 mark
Government may review blacklisting of foreign Tablighi Jamaat members
Trump says Tennessee Valley Authority dropped outsourcing plan after his intervention
Axis AMC offers mutual fund transactions on WhatsApp
Stock market news: ICICI Bank shares gain nearly 2%
Share price of NMDC Ltd. rises as Nifty strengthens
Sensex adds 200 points on US Fed's focus on growth; Nifty above 11\,600
Back to school edition: France and other nations are returning to class\, India remains shut amid pandemic
Federal Bank Ltd. shares gain 6.33% as Sensex rises
Share market update: 59 stocks hit 52-week highs on NSE
Airlines can now provide meals to passengers after Centre relaxes norms
Bank of Baroda shares rise 6.06% as Sensex climbs
Joe Biden's victory will endanger nation and destroy American greatness: Donald Trump
Stock market news: Reliance Industries shares flat in early trade
Ranbaxy case: Malvinder Singh provides proof of financial deals with Radha Soami Satsang head
Share price of Mahindra & Mahindra Financial Services Ltd. jumps as Sensex gains 145.09 points
Investors review MF portfolios early due to high return difference between schemes
India Inc chants inclusive mantra by hiring trans people
Bharti Infratel Ltd. shares gain 2.78% as Sensex rises
With remote working\, even traditional setups today are re-looking at the workforce: Anuranjita Kumar
Rupee opens 2 paise down at 73.84 against dollar
Share price of LIC Housing Finance Ltd. jumps as Sensex gains 228.09 points
Buy Can Fin Homes\, target price Rs 475: Yes Securities
Reduce Mahanagar Gas\, target price Rs 882: ICICI Securities
Buy Hawkins Cookers\, target price Rs 5682: Angel Broking
Buy Godfrey Phillips\, target price Rs 1320: Centrum Broking
Buy Firstsource Solutions\, target price Rs 90: Emkay Global
Buy EIH\, target price Rs 101: ICICI Direct
Hold Nalco\, target price Rs 39: ICICI Securities
Buy VIP Industries\, target price Rs 348: Angel Broking
Hold Jindal Stainless\, target price Rs 52: Emkay Global
Buy NMDC\, target price Rs 130: ICICI Securities
Buy LIC Housing Finance\, target price Rs 353: Geojit
Hold GAIL (India)\, target price Rs 101: ICICI Securities
Add Avanti Feeds\, target price Rs 590: ICICI Securities
Buy Bharat Forge\, target price Rs 523: ICICI Direct
Buy Voltas\, target price Rs 670: ICICI Direct
Provision of original inhabitant fraudulently used to make it to NRC\, claim officials
Stock market news: Bandhan Bank shares climb 3%
Share price of Zee Entertainment Enterprises Ltd. jumps as Sensex gains 266.52 points
Stock market news: Bajaj Finance shares gain 1%
Indiabulls Housing Finance Ltd. shares gain 2.71% as Sensex rises
RLDA invites bid to redevelop New Delhi station\, to offer 30 acre for real estate development
Inflation spike brings India bond rally shuddering to a halt
Stock market news: Tata Motors shares down 2%
India reports 77\,266 new COVID-19 cases pushing virus tally to 33\,87\,500
250 stocks under Rs 25 surge up to 1\,600% in 5 months! Vijay Kedia says this market has got high BP
Shriram Transport Finance Company Ltd. shares up 3.69% as Nifty gains
Sushant death: CBI questions Rhea on events of June 8\, shift to Waterstone resort & alleged drug link
Power Finance Corporation Ltd. shares rise 1.54% as Sensex climbs
Jan Dhan scheme game-changer\, foundation of poverty alleviation initiatives: PM Modi
Stock market update: Nifty Bank index jumps over 2%; Axis Bank leaps 7%
Vehicle insurance policies must be renewed on time: General Insurance Council
As tax revenues fall\, south states increase borrowings
Piramal Enterprises Ltd. shares drop 0.68% as Sensex rises
Maruti Suzuki launches vehicle subscription programme for consumers
ICICI Prudential Life Insurance Company Ltd. shares up 1.77% as Nifty gains
AGP holds meeting despite court barring it\, re-elects Atul Bora as president
ICICI Bank climbs on selling 2% stake in ICICI Securities
Karnataka Congress leaders stand by Gandhis to keep party flock together\, retain power
boAT Lifestyle records 20% jump\, sells 15\,000 units every day during lockdown
Stock market update: Nifty PSU Bank index zooms nearly 5%; Canara Bank surges 8%
Container Corporation of India Ltd. shares gain 3.21% as Sensex rises
Share price of Tata Consumer Products Ltd. jumps as Sensex gains 305.42 points
Ikea cuts price for some bestselling range of products calling it a long-term\, inclusive strategy
Stock market update: Auto stocks fall; Ashok Leyland slips 2%
Share price of REC Ltd. rises as Nifty strengthens
Pradhan Mantri Jan Dhan Yojana scheme completes six years\, benefits 40.35 crore people
ZEE gains 3% on positive commentary on OTT platform
Share price of Hindustan Petroleum Corporation Ltd. rises as Nifty strengthens
Japan PM Shinzo Abe\, Japan's longest-serving premier\, resigns over worsening health
States\, universities cannot promote students without holding final year exams by Sept 30: SC
Kunj Bansal on why laggards are becoming leaders in the market
Share price of Page Industries Ltd. rises as Nifty strengthens
People have benefited from ayurveda in these times of Covid: Physician Devendra Triguna
How does Japan's longest serving PM\, Shinzo Abe\, score on his policy agenda?
Trump says India 2nd largest country to conduct Covid-19 tests after US
Siemens Ltd. shares rise 0.99% as Sensex climbs
Worried about disconnect between markets and economy? Here’s what you should do
Amazon enters the fitness-tracking business with Halo\, says it won't use data for ads
Share price of Crompton Greaves Consumer Electricals Ltd. jumps as Sensex gains 423.33 points
Stock market update: Nifty Private Bank index jumps nearly 4%; Federal Bank soars 8%
Petronet LNG Ltd. shares rise 0.96% as Sensex climbs
Ambuja Cements Ltd. shares gain 0.05% as Sensex rises
Voda Idea surges 15% ahead of AGR verdict
Stock market update: Nifty Media index rises over 1%; PVR jumps 4%
Ankita Lokhande refutes Rhea Chakraborty’s claims about Sushant being ‘depressed’; denies having met him after 2016 break-up
Share price of GAIL (India) Ltd. rises as Nifty strengthens
Congress launches campaign against holding of NEET\, JEE; Rahul Gandhi asks people to speak up for students' safety
'Scooby-Doo' co-creator Joe Ruby passes away at 87 due to natural causes
ACC Ltd. shares rise 0.3% as Sensex climbs
Stock market update: Nifty Financial Services index gains 1%; Shriram Transport Fin leaps 6%
New York's Museum of Modern Art re-opens after a nearly six-month shutdown
Share price of Apollo Hospitals Enterprise Ltd. jumps as Sensex gains 381.51 points
Nikkei closes down more than 1.4% after reports Japan PM to resign
Supreme Court notice to Centre on PIL to frame guidelines for identifying minorities at state level
UN Chief Antonio Guterres calls out Indian govt to phase out use of coal
SC says COVID can't be ground for postponing polls\, dismisses PIL for deferring Bihar elections
NMDC's Board approves demerger of iron and steel plant in Chhattisgarh
Stock market update: Realty stocks mixed; Oberoi Realty gains 4%
Rhea has never used drugs\, claims her lawyer; petition filed in Bombay HC to stop 'media trial'
Big Bull about to erase 2020 losses: What’s delivering and what’s not?
RevPAR in Delhi hotels declined 44.3 per cent YoY from January to July: JLL India
Info Edge (India) Ltd. shares gain 1.51% as Sensex rises
Divi's Laboratories Ltd. shares gain 0.11% as Sensex rises
Larsen & Toubro’s IT arm to create India’s one-stop digital repository of official data
Terrorism is cancer; affects everyone just like pandemic: EAM S Jaishankar
Stock market update: MidCap stocks rise; Future Retail leaps 7%
Tata Power Company Ltd. shares down 1.38% as Nifty gains
GMR Infra rallies 10% on group rejig plan
Amazon orders 1\,800 Mercedes-Benz electric vans for European deliveries
Indraprastha Gas Ltd. shares gain 0.8% as Sensex rises
RBI’s decision on one time loan restructuring will help stressed projects: Housing secretary
Nearly 2 million opt for Atal Pension Yojana since April: PFRDA
USFDA 'closes' warning letter for three sites of Dr Reddy's Laboratories
Pidilite Industries Ltd. shares down 0.71% as Nifty gains
Max India lists at Rs 80 on BSE
NMDC rallies 10% after Q1 result
Have I chosen the right mutual funds for goals?
Delhi High Court junks Mehul Choksi's plea to preview Netflix series 'Bad Boy Billionaires'
Lupin Ltd. shares drop 0.46% as Sensex rises
Occupiers are keen to take up spaces in greener buildings: Arshdeep Sethi\, RMZ Corp
8 turnaround stories of June quarter have stock investors glued to them
Congress leaders detained while staging stir against holding of JEE\, NEET
US embassies in India to accept applications for certain visa categories\, including H-1B renewals
Biocon Ltd. shares down 0.58% as Nifty gains
HAL OFS received enthusiastic response from non-retail investors: Dipam Secy
In broader markets\, you can get phenomenal returns with a 3-5-year perspective: Sunil Subramaniam
Share price of MRF Ltd. jumps as Sensex gains 284.79 points
Colgate-Palmolive (India) Ltd. shares drop 0.53% as Sensex rises
Milkbasket plans to launch IPO next year
Bombay HC declines bail to activist Sudha Bharadwaj in Elgar Parishad-Koregaon Bhima case
Aurobindo Pharma Ltd. shares decline 0.35% as Sensex climbs
What's next after Japan PM Shinzo Abe quits? Potential successors?
Delhi HC disposes plea on 'Gunjan Saxena' stay\, asks Centre to treat film as work of art
Shree Cements Ltd. shares drop 0.78% as Sensex rises
Marico Ltd. shares rise 0.13% as Sensex climbs
Retail portion of HAL OFS subscribed 4% so far
Indian solar power cheap\, but much higher than the Middle East\, shows report
Having a purpose helped me get through the lockdown: Saurav Ghosal
Exide Industries Ltd. shares drop 0.95% as Sensex rises
ANMI urges govt to rethink e-campaign on voluntary compliance of I-T
Jharkhand HC defers Lalu Prasad's bail plea hearing in a fodder scam case to Sept 11
Havells India Ltd. shares drop 1.92% as Sensex rises
India can be business hub to achieve Sustainable Development Goal of ensuring clean energy: UN chief
European stocks slide as heavyweight tech\, healthcare drag
Recoveries exceed actives cases of COVID-19 by more than 18 lakh; case fatality drops to 1.82 per cent
French defence minister likely to visit India next month to attend Rafale's induction
Berger Paints (India) Ltd. shares decline 0.13% as Sensex climbs
China stocks climb on upbeat economic data\, listings momentum
GST rate cut will boost two-wheeler firms' EPS: CLSA
Talent from consultancies in high demand as faltering businesses need a post-Covid reboot
The golden era for the common Indian bank depositor is gone forever
Share price of Bajaj Holdings & Investment Ltd. falls as Nifty strengthens
Defence ministry to host Aero India in its traditional venue of Bengaluru from Feb 3-5
Demand for delivery agents on the rise as e-commerce business booms during pandemic
Ashok Leyland Ltd. shares decline 1.59% as Sensex climbs
Australia shares end lower on virus woes; post second weekly loss
FIIs bullish bets in index futures hit record high in Modi second term
Share price of Avenue Supermarts Ltd. falls as Nifty strengthens
DoT mulls proposal for making it easier to migrate from pre-paid to post-paid
OnePlus India R&D centre to become its largest globally by 2022
US-based BCM ties up with India's BE for COVID-19 vaccine production
Robinhood investors are the heart of the market as they provide liquidity: Sunil Subramaniam
Yen jumps as Abe resignation sparks political uncertainty
CPI(M) targets government over 'Act of God' remark on GST revenue shortfall
Govt will work tirelessly to ensure efficient norms for MSMEs\, startups: Kant
View From New York: The Future is what it is!
Delhi BJP announces names of presidents for 14 district units
India at inflection point in digitisation journey\, on cusp of a paradigm shift: Report
Stock market update: BSE SmallCap index flat; Adani Green jumps 8%
Congress leader Adhir Ranjan urges LS speaker not to curtail question\, zero hours
CII launches Artificial Intelligence Forum chaired by IBM's Sandip Patel
BSE Bankex climbs 900 points intraday! What's fueling the rally
Stock market update: Metal stocks down; Hindustan Zinc dips 4%
Vaccine hopes infuse new life in these Covid-positive stocks
Vistara operates its first long-haul flight from Delhi to London
Debt fund NAVs are falling. What should investors do?
Wellness startup Sarva raises funding from Cutting Edge Group
Release of World Bank 'Doing Business' report halted over fudging of data
COVID-19 effect: Pandemic management now part of MBBS course
Ujjwal Kanti Bhattacharya takes charge as Director of Projects\, NTPC
Declining sales by Patanjali drags down India's ayurvedic products market growth rate
NEET\, JEE exams: Ministers of 6 opposition-ruled states move SC\, seek review of order
More stringent checks on spam SMSes under new system: Trai
Haryana lifts weekend restrictions\, malls to now close on Monday and Tuesday
Coal India's fuel supply to power sector drops about 20% in April-July
Dream of flying car could get real as Japan successfully conducts test flight
Rupee posts biggest weekly gain in 20 months as RBI stands aside
Adobe\, Nasscom FutureSkills join hands for user experience design skills training
Ready apartments likely to see more traction in Maharashtra post stamp duty cut
Gold\, silver futures rise\, but may see selling pressure
New margin pledge system: Sebi to again meet brokers\, depositories on Monday
Listen to students\, take decision after consensus: Rahul Gandhi to govt on NEET\, JEE
ICICI Bank sells 2% stake in subsidiary I-Sec for Rs 310 crore
US big tech dominates stock market after monster rally\, leaving investors on edge
Bangladesh’s top pharma group & Serum Institute of India join hands for Covid-19 vaccine
Goldman Sachs pays Malaysia $2.5 billion as part of 1MDB deal
Robert Downey Jr to produce series based on Michael Crichton's novel 'Sphere'
Housing ministry advises states to reduce stamp duty on property transactions
Mississippi officials end up spending over $7K because of a curious dog
SES questions source of remuneration to UPL directors
Adani group could go the Reliance way: Gautam Shah
J&J to start mid-stage coronavirus vaccine trials in 3 European countries next week
AirAsia India partners with Avis to offer passengers car rental services
Total COVID-19 tests near peak of 4 crore; over 1 crore samples tested in past 2 weeks
OKAYA to provide EV charging stations to BluSmart Electric Mobility
Crop planting soars to a record\, bumper harvest expected
Lok Sabha Speaker Om Birla chairs meeting on arrangements for Monsoon Session
Rural demand to aid economic recovery but can't substitute for urban demand: Report
India's business climate has been continuously improving: Niti Aayog CEO
IFFI 2020 to go hybrid in the pandemic\, will have mix of virtual\, auditorium screenings in Goa
Sensex rises for 6th day on Fed\, RBI promise to help revive Covid hit economy
Should I sell my investments in DSP Small Cap Fund?
Multinational executives shift base to holiday destinations as pandemic rages on
Apple and Tesla split their shares\, but does it matter?
Listen to student voices\, act as per their wishes: Sonia Gandhi to govt on NEET\, JEE
IPL franchisees to remain profitable despite no gate revenues\, drop in sponsorships
Make time your best friend; start investing early
Encounter breaks out between security forces\, militants in J-K's Shopian district
Murugappa Group set to win Swiss challenge for CG Power after no fresh bids\, say sources
Construction activity can be fast tracked via LGS Construction Technology
Fantasy sports users consume more sports: Study
KFC’s first outlet in Srinagar beats company’s sales estimates in ten days
US Defense Secretary Mark Esper says China 'destabilising' the Pacific region
Want to be British high commissioner for a day? Here's a chance
Shashi Tharoor a 'guest artist' in Congress\, says KPCC working president
Defying trade tensions\, Chinese buyers snap up Indian steel
Government should announce special stimulus package for auto industry: Bosch
Edelweiss has been like a joint family\, now every business has to stand on its own: Rashesh Shah
Statue of Princess Diana to be installed at Kensington Palace on her 60th birth anniversary
Tech View: Nifty enters overbought zone\, momentum strong for now
Revolt Motors looks to raise $100 million in equity capital
Dream Sports to support athletes\, sport ecosystem with ‘Back on Track’ programme
India may get COVID-19 vaccine by early 2021\, says Bernstein Research
Probe 'BJP angle' in Sushant Singh Rajput suicide case: Congress
F&O: Nifty forms bullish stance\, buy-on-decline strategy holds
World Health Organization sweetens terms to join struggling global COVAX vaccine facility
Economy unlock may curb fleet operator revenue fall 15 pc this fiscal: Crisil
RBI’s benchmark auction sees record Rs 18\,000 crore devolvement
Four militants killed in encounter in Shopian district of Jammu and Kashmir
AITUC seeks Hardeep Singh Puri's intervention to save jobs of 2\,500 workers at Chennai Airport
Russian navy conducts major maneuvers near Alaska involving dozens of ships and aircraft
No BJP leader took Aaditya Thackeray's name in Sushant Singh Rajput's death case: Devendra Fadnavis
HAL's Rs 5\,000 crore offer for sale fully subscribed
Welcome to the future! Scientists develop four-legged robots that can be injected into blood\, treat diseases
Estrogen could be the reason why women face less severe Covid-19 symptoms than men\, says study
Sushant death probe: ED summons Goa businessman with drug link\, Rhea may be quizzed by NCB
Big Boy Toyz MD's WFH diaries include plenty of webinars\, exercising & overcoming logistical challenges
Is it safe to reuse N95 masks? Study says respirators can be used again after decontamination
Street artist Banksy helps rescue migrants\, funds rescue boat covered in his artwork
Selena Gomez's cooking wins over viewers\, her show 'Selena + Chef' gets renewed for second season
Wonderchef expects Rs 400 crore revenues in current fiscal
ANMI requests Sebi for one month extension to implement new margin rules
Will request MPs to get tested for COVID-19 48 hours before start of the session: Om Birla
Direct air connectivity between Kochi\, Europe begins; CIAL waives landing fees
State Bank of India gets global recognition for HR initiative 'Nayi Disha'
A $45bn proptech listing on NYSE\, most valued housing company in the world\, and a parallel in India
Risk-on trade is on\, focus on BFSI space: Abhimanyu Sofat
Solar manufacturers to grow\, but shouldn’t depend only on government moves\, says report
U.S. flies B-52 bombers over Europe to show NATO solidarity
Market Movers: Banks on a high\, India VIX falls for 5th week; 64 stocks turn overbought
Income Tax Department to intimate taxpayers under scrutiny about faceless assessment
Govt forms a committee to fast-track rules for work from anywhere
Banks Board Bureau recommends Dinesh Khara as next SBI chairman
China warns Norway against granting Nobel Peace Prize to Hong Kong democracy activists
India placed 72nd on global list with average monthly wage of Rs 32\,800: Report
Tech powers S&P 500 to record closing high\, Dow now positive for the year
Some of India's monetary & fiscal frameworks should be recast: EY Economy Watch
NCLAT sets aside insolvency proceedings against Sarda Agro Oils
State Bank of India and Bank of Baroda grab the biggest pie of Jan Dhan outstanding
Forex reserves surge by $2.296 bn to $537.548 bn
Inox Wind Q1 results: Loss widens to Rs 73 crore
'Freedom of speech is cardinal. Needs to be given full play'\, MeitY says to Delhi HC
COVID strikes IPL: Chennai Super Kings player\, multiple staff members test positive
Brokers want postponement of new norms on margin pledge\, Sebi calls meeting on Monday
Post lockdown\, IndiGo widens lead over competitors by adding more flights
RBL Bank MD trims stake\, sells 18.9 lakh shares for Rs 38.5 crore
With elections coming\, Bihar plans big push to Ayushman Bharat Scheme
Coca-Cola to cut 4\,000 jobs in North America after coronavirus hits Q2 profits
Pre-launch bookings of BSVI-compliant G 310 R\, G 310 GS from September 1
Parliament’s IT committee drops 4G in J&K issue from meeting agenda
No power tariff hike in Delhi for 2020-21: Delhi Electricity Regulatory Commission
25k people to get direct employment in J&K as 3 bamboo clusters coming up: Jitendra Singh
PVR guilty of profiteering in Telangana\, no penalty required: NAA
Andhra Pradesh COVID-19 tally crosses 4 lakh mark\, death toll crosses 3700
UP cracks down on properties of Mukhtar Ansari\, Atiq Ahmed; aims to 'break financial backbone of criminal-politicians'
Coronavirus tally: Tamil Nadu inches towards 6\,000 mark again; deaths cross 7000
Bihar Court restrains use of Subrata Roy's name in upcoming Netflix's series “Bad Boy Billionaires”
GOLD NEEDS A POLICY RESET
T-Series sues Roposo for alleged copyright infringement
Tamil Nadu: Congress MP H Vasanthakumar passes away due to coronavirus
JEE row: Most coaching centre students now just want to get over with the entrance exams
After nearly 200 years\, Lord & Taylor goes out of business\, files for bankruptcy
Congress protests over NEET\, JEE issue; BJP says accept Supreme Court verdict
