IPL 2020: All-round Stoinis\, cool Rabada ensure Super Over victory for Delhi Capitals
Government looks to sweeten Air India sale deal\, discusses proposals for prospective bidders
Investors may wait for clear business trends in Chemcon
A large part of corp book will come through unscathed: BoB
Mumbai court refuses ED’s intervention in Jet Airways police case
Returning to normal: With India - and Indians - opening up\, food companies see demand drop
With the Indian Premier League kicking off\, brands queue up to sponsor teams' coffee\, hygiene
Assam CM ordered inquiry into leak of question paper of test for recruitment of Sub-Inspectors in Assam police
How gold\, silver performed for the week ending on September 17\, 2020
5 smart things to know about Corona Rakshak policy
Valuation of several PSU scrips are reasonable now: Here are 8 PSU stocks worth betting on
Here's how you can judge a mutual fund distributor or adviser
Money & Relationships: 5 steps to financially secure a child with special needs
EPF vs NPS: Who should move from EPF and who should stay put
Stock pick of the week: Reasons why good days are here for Aurobindo Pharma
Know your mutual fund adviser: Here's how you can judge a distributor or adviser
MF portfolio doctor: Rana should reduce contribution to PPF\, increase equity mutual SIPs
Axis Focused 25 mutual fund review: How scheme offered superior downside protection relative to index
Planning a holiday in next few months? Avail these discounts on flights\, hotels\, travel packages now
How to buy forex for foreign travel
How to manage your money in the times of slowdown
I signed NOC to my father's property. Do I have the right to it after his death?
Realty hot spot series: This Pune locality is an established residential area
Revamped multi-cap mutual funds: Should you continue with your fund or exit now?
Rural agricultural households and their search for steady income
Portion of EPF corpus is invested in equities: Is your EPF money safe?
Revamped multi cap mutual funds: Should you continue with your fund or exit now?
Axis Focused 25 fund: Fund review
All options open in 'fight' against Google: Paytm CEO Vijay Shekhar Sharma
Happiest Minds & Route Mobile set tone for the next three IPOs
Day trading guide for Monday's market
Lower tax rates\, steps to boost sales crucial for auto cos: Kenichi Ayukawa\, MD & CEO of Maruti Suzuki India
Share purchases by promoters lift sentiment on D-Street
Bank FDs may soon cease to act as collateral in stock market
Tesla initiates talks to set up research centre in Bengaluru
Oil prices slip on potential Libyan oil return; Gulf storm supports
Maharashtra: Death toll rises to 20 in Bhiwandi building collapse; rescue operations ongoing
Shares\, currencies tentative as attention shifts to US election\, stimulus
Stocks in the news: Route Mobile\, ​RITES\, Essel Propack\, Future Enterprises and Power Grid
Gold gains as tepid dollar\, virus-induced curbs lift appeal
Dollar clings on\, yen creeps higher as Fed speakers in focus
Donald Trump celebrates TikTok deal that falls short of his key demands
Yes Bank to get fresh forensic investigation into its top 10 defaulters
SGX Nifty down 20 points; here's what changed for market while you were sleeping
'Schitt's Creek' sweeps comedy categories at Emmys\, Mark Ruffalo wins limited series award for 'I Know This Much is True'
Suspect arrested in connection with ricin letter addressed to White House
India to consider fresh responses from TikTok
MP CM Shivraj Singh Chouhan distributes Rs 200 crore as loan amount to empower SHGs
Roundabout way of making a point
More reason to celebrate India's woman power
ET Women's Forum: Over 30 leaders to highlight role of women in post-Covid economic recovery
Joe Biden calls Donald Trump's US Supreme Court push 'abuse of power'
Despite urgency\, pharma companies committed to science first policy on vaccine: Industry body
Market to go higher in days to come: Mahantesh Sabarad
India occupies top position in world in total COVID-19 recoveries: Health Ministry
Google has different rules for itself: Paytm
Saurabh Mukherjea’s 3 tenets for achieving financial goals
300 witnesses\, papers from abroad in CBI charge sheet
Military talks today\, India's focus on full disengagement
Mandi alternatives: How agri-tech startups beat the lockdown blues
PGIM India's global equity opportunities fund scales past Rs 300-cr-mark
Gold rate slips as traders book profits
China encroaches into Nepal territory\, constructs 9 buildings
Education unites\, ignorance divides\, says Prez on NEP in J&K
Will likely nominate a woman to replace Ginsburg next week: Donald Trump
LAC row: As Generals meet today\, MEA tries to keep talks within political parameters
Palm oil rises for fifth day on higher Dalian oils\, strong exports
In planes and SUVs\, world's richest 1% produced twice as much CO2 emissions as poorest half of humanity
Buy Mahanagar Gas\, target price Rs 1200: Motilal Oswal
Buy RPG Life Sciences\, target price Rs 444: ICICI Direct
Add Hindustan Unilever\, target price Rs 2500: ICICI Securities
Neutral on Indraprastha Gas\, target price Rs 470: Motilal Oswal
Add Emami\, target price Rs 400: ICICI Securities
Buy ITD Cementation India\, target price Rs 63: Anand Rathi
Add ITC\, target price Rs 220: ICICI Securities
Buy Balkrishna Industries\, target Rs 1415: ICICI Direct
Add United Spirits\, target price Rs 650: ICICI Securities
Buy Divi's Laboratories\, target price Rs 3398: ICICI Direct
Buy ITD Cementation India\, target price Rs 68: HDFC Securities
Buy Gujarat Gas\, target price Rs 360: Motilal Oswal
Buy Bharat Forge\, target price Rs 500: Motilal Oswal
Add Marico\, target price Rs 420: ICICI Securities
Add Dabur India\, target price Rs 550: ICICI Securities
Buy Somany Ceramics\, target price Rs 304: ICICI Securities
Hold Allcargo Logistics\, target price Rs 115: ICICI Securities
Bidding for CAMS IPO kicks off: Here's what leading brokerages say
Chemcon Speciality Chemicals IPO opens: What do the brokerages say
Sensex adds 40 points in a lacklustre trade; IT names surge
Delhi government's doorstep delivery of services got Covid reboot
Stock market news: Alok Industries shares down nearly 5%
Share market update: 55 stocks hit 52-week highs on NSE
Chaitanya Tamhane-directorial 'The Disciple' wins Amplify Voices Award at TIFF
Imports will now get benefits on the basis of their value addition\, here's all you need to know
How Delhi cops took cue from West\, used new tech in riots conspiracy probe
India\, Maldives will support each other in fight against health\, economic impact of Covid: PM Modi
Route Mobile lists at 105% premium over issue price
InterMiles MD wants to do a gadget-detox holiday\, has Lakshadweep\, North-East on his radar
InterGlobe Aviation Ltd. shares gain 2.4% as Sensex falls
World’s biggest lockdown chokes Indian gold smuggling routes
Delhi Capitals beat Kings XI Punjab in nerve wracking match that went down to a Superover
HCL tech acquires Australian IT firm DWS for $115.8 million
HCL Tech acquires Australian IT firm DWS for $115.8 million
Indraprastha Gas Ltd. shares up 1.68% as Nifty drops
‘Global diversification makes investors’ portfolio more holistic’
Rajya Sabha Chairman rejects no-confidence motion notice against Harivansh\, suspends 8 MPs
Share price of Hindustan Petroleum Corporation Ltd. jumps as Sensex drops 33.59 points
Zee Entertainment Enterprises Ltd. shares up 0.7% as Sensex falls
Aurobindo Pharma Ltd. shares drop 0.47% as Sensex falls
Apollo Hospitals Enterprise Ltd. shares rise 2.1% as Nifty gains
Karnataka government may face opposition attack over Covid-19 management\, floods
Airtel\, Vodafone Idea urge government to release spectrum in E & V Bands
Opposition parties in Pakistan launch alliance to oust Prime Minister Imran Khan
Stock market news: SBI Cards shares trade flat in early session
Corporate chatter: Top European bank boss faces WhatsApp group fury; CEO's family fined Rs 75K for flouting Covid norms in Mumbai condo
Kerala sees record spike with 4\,696 cases
Nokia\, Ericsson promise to make 5G gear here: Airtel
HAAH Automotive offers $258 million for a significant stake in ailing Ssangyong Motor
Voltas Ltd. shares gain 0.66% as Sensex rises
86\,961 new COVID-19 cases in India\, tally reaches 54\,87\,580; death toll mounts to 87\,882
Divi's Laboratories Ltd. shares drop 1.08% as Sensex rises
PM Modi condoles loss of lives in Bhiwandi building collapse
China's ByteDance says TikTok will be its subsidiary under deal with Donald Trump
Applying for IPOs? 7 things you must do to ensure your money is safe
Havells India Ltd. shares gain 1.14% as Sensex rises
Stakeholder capitalism: The squishy idea made more relevant by Covid-19
Want to bet on businesses of tomorrow? Go for BHARATH stocks: BNP Paribas
Rupee gains 11 paise to 73.34 against US dollar
Colgate-Palmolive (India) Ltd. share price down 0.58 per cent
GOCL Corp's UK subsidiary to sell partial stake in Quaker Chemical for $35 mn
Page Industries Ltd. shares gain 0.77% as Sensex rises
Chemcon IPO subscribed 78% within 45 mins; retail quota attracts 1.55 times bids
Homegrown social app Chingari crosses 30 million downloads
Shares of Berger Paints (India) Ltd. falls as Nifty drops
Trending stocks: SBI shares down 1%
Tata Consumer Products Ltd. decline 0.23% as Sensex climbs
China's space plans suffer with nation set to lose access to Australian space tracking station
China’s “vaccine diplomacy”: Tool to exploit economically weaker states
Share price of ICICI Prudential Life Insurance Company Ltd. falls as Sensex drops 35.65 points
Shares of Petronet LNG Ltd. falls as Nifty drops
Trending stocks: YES Bank shares fall 1%
Bharat Forge Ltd. shares drop 0.08% as Sensex falls
Supreme Court cancels NLSIU Bengaluru entrance exam NLAT-2020
Govt run chain of Navodaya schools plans 10 inch tablet to beat digital divide for its 2.8 lakh students
How much should I invest for 15 years to get a monthly income of Rs 50\,000 after retirement?
Trending stocks: REC shares slip 2%
DLF Ltd. shares decline 1.55% as Sensex slides
An American Mahabharata: Why this US election has a global audience at the edge of its seat
Future Enterprises slips as firm defaults on debt repayment
I bought a flat in February and want to sell it in October 2020. What will be the tax implication?
Lupin Ltd. decline 1.86% as Sensex slides
Shell launches major cost-cutting drive to prepare for energy transition
CLSA raises price target for media firms
Shree Cements Ltd. shares down 1.21% as Nifty drops
Will new investors shower love on mutual funds?
Commodity outlook: Crude oil gains; here's how others may fare
ACC Ltd. shares drop 1.31% as Sensex rises
BigLeap Technologies opens new facility\, plans to add 6\,000 staff by 2021
We should not expect overnight miracles in farm sector: Swaminathan Aiyar
Stock market news: RIL shares trade flat in early session
TVS Motor Company Ltd. shares fall 0.48% as Nifty drops
World Alzheimer's Day: Poor sleep hygiene can hurt brain health; taking up hobbies\, exercising daily may help
Zendaya makes history\, becomes youngest star to bag the lead drama-actress award at Emmys
Jubilant Foodworks Ltd. stock price down 0.63 per cent as Sensex slides
Tencent says WeChat will struggle to attract new U.S. users while White House\, courts spar over ban
CAMS IPO subscribed 83% on day 1; retail quota oversubscribed
MRF Ltd. shares down 1.2% as Nifty drops
HCL Technologies shares jump 5% after DWS deal
Stock market news: Vodafone Idea shares fall over 2%
Bosch Ltd. decline 0.55% as Sensex climbs
Stock market update: BSE MidCap index sheds nearly 3%; Jindal Steel & Power dips 8%
Shriram Transport Finance Company Ltd. shares down 0.39% as Nifty drops
Angel Broking IPO: Details\, valuations\, management view and analyst ratings
Power Finance Corporation Ltd. shares drop 2.04% as Sensex rises
LIC Housing Finance Ltd. shares drop 0.33% as Sensex rises
View: A tale of two Americans\, one looking for the son he lost\, the other for a country in the past
Chemcon Speciality IPO subscribed over 5 times on strong retail demand
Share price of Tata Power Company Ltd. falls as Sensex drops 18.74 points
Add Bajaj Consumer Care\, target price Rs 200: ICICI Securities
Add Asian Paints\, target price Rs 2200: ICICI Securities
Buy Dixon Technologies\, target price Rs 11\,056: Yes Securities
AgustaWestland scam: Court to pass order on cognisance of charge sheet on September 25
View: To open or not is not the question\, securing the schools is the task
Indian Railways to run 40 clone trains from today. Here are the major routes & other details
Pidilite Industries Ltd. shares down 1.69% as Sensex falls
John Abraham-starrer 'Satyameva Jayate 2' set for an Eid release in theatres next year
Many states\, UTs not providing details of farmer suicides: MHA tells Rajya Sabha
Avenue Supermarts Ltd. shares drop 1.42% as Sensex falls
HSBC HK shares drop to lowest since 1995\, StanChart falls after 'FinCEN' leak
Muting of democratic India continues: Congress on Rajya Sabha MPs suspension
Pharma rally mostly played out\, 30-40 PE for API cos not justified: Sandip Sabharwal
Container Corporation of India Ltd. shares decline 1.37% as Sensex slides
Deutsche Bank: Global GDP expected to return to pre-coronavirus levels in mid-2021
Bajaj Holdings & Investment Ltd. shares drop 2.17% as Sensex falls
Why it makes sense to try and diversify your investing style
Barclays raises 2020 oil price outlook\, expects limited downside to demand view
Rajya Sabha adjourned for the day amid uproar over suspension of members
Central trade unions extend support to nationwide protests against new Farm Bills
Nearly 1\,200 detained under NSA in 2017\, 2018 in India\, 563 still in custody
REC Ltd. shares drop 2.55% as Sensex falls
Visa extends global partnership with IFundWomen to entrepreneurs in India
Piramal Enterprises Ltd. shares down 3.72% as Sensex falls
Rakesh Jhunjhunwala sees conditions for birth of a bull market; realty\, pharma\, infra\, IT top bets
PM Modi likely to inaugurate Atal tunnel in HP's Rohtang on Oct 3: CM
2020: Year of immense significance to South Asian history
LIVE Market Technicals with CK Narayan
Bharti Infratel Ltd. shares fall 3.01 per cent in Monday's trading session
Ambuja Cements Ltd. shares drop 3.07% as Sensex falls
Marriott Bonvoy and Mumbai Indians announce sponsorship agreement for three years
Share price of Biocon Ltd. falls as Sensex drops 316.81 points
Google Pay\, Visa partner for card-based payments with tokenisation
Bihar Chief Minster Nitish Kumar condemns heckling of Rajya Sabha Deputy Chairman Harivansh
Mahindra & Mahindra Financial Services Ltd. shares down 4.28% as Sensex falls
Indian citizenship granted to 2\,120 Pakistanis\, 188 Afghans\, 99 Bangladeshis in last 4 years
FTSE 100 falls as StanChart\, HSBC slide on 'FinCEN' report
China shares end lower as key lending rate kept steady for 5th month
Australia shares end at near 3-month low as banks\, miners slump
288 people died cleaning sewers\, septic tanks in last 3 years: Government
SC stays Allahabad HC order granting bail to ex-UP minister in gang rape case
Federal Bank Ltd. shares drop 2.79% as Sensex falls
Naxal violence now in just 46 districts in country: MHA tells Rajya Sabha
Stock market update: BSE SmallCap index dips over 3%; Indiabulls Housing Fin nosedives 13%
NMDC Ltd. stock price down 4.66 per cent as Sensex slides
80\,000 new additions take PM-SYM's total subscriber count to over 44 lakh
Farm bills need of 21st century\, mandis and MSP will stay: PM Modi
Stock market update: Nifty Auto index sheds over 3%; Motherson Sumi dips 6%
Bharti AXA launches new unit linked individual insurance plan
Dwindling footfalls in malls leads to the closure of gaming centre operator Smaaash
5 takeaways from the Emmys: RBG\, 'Friends'\, and HBO ruling with 30 statuettes even sans 'GOT'
Pre-filled GST return form soon: GSTN CEO Prakash Kumar
Angel Broking IPO to open on Tuesday: All you need to know about the issue
Stock market update: Nifty Bank index slips over 2%; IndusInd Bank tumbles 7%
IT industry has struggled as clients cut spends\, but seeing more activity in digital: Wipro Chairman
China air force video appears to show simulated attack on US base on Guam
AS Judge recuses from Rs 8\,100 crore bank loan fraud case against Sterling Biotech owners
BSH launches its Direct2Customer platform
Govt has taken number of steps to increase women participation in labour force: Labour minister
Study shows that scans used to diagnose stroke may also help identify Covid-19
Oppn parties hit out at govt over suspension of 8 MPs\, hold protest on Parliament premises
How to interpret Tesla’s Battery Day lingo
Taiwan military says it has right to counter attack amid Chinese harassment and threats
ESG is the right way to invest during periods of volatility: S Naren
Rupee settles 7 paise higher at 73.38 against US dollar
Delhi riots: Court dismisses ex-JNU student leader Umar Khalid's plea seeking to meet family
'Who is our enemy?' Neutral Switzerland votes on fighter jets to replace F/A-18 Hornets
Former employee alleges sexual harassment by two Cognizant executives\, files lawsuit in US
3557 workers affected by lay-offs across India between January and June: Labour ministry data
Over one lakh posts are lying vacant in Central Armed Police Forces: Government
Natco Pharma aims to diversify product portfolio in domestic market
India's corporate real estate occupiers confident about COVID-19 recovery
Route Mobile: What should investors do after the 105% stellar listing gain?
Army commanders of India and China hold 6th round of talks on border standoff
Hundreds of whales stranded in southern Australia
Indian Air Force's Golden Arrows squadron with Rafales to have first woman pilot soon
Rs 44\,054.72 crore has been withdrawn from the EPFO till date: Govt in Rajya Sabha
There can't be universal policy on right to protest: SC in anti-CAA blockade case
Two women officers of the Indian Navy to operate helicopters from warships
India launches first ever cargo ferry with Maldives: Milestone in Indian Ocean connectivity initiatives
DPIIT to seek cabinet nod for multi-modal logistics hub\, 2 industrial corridors
Value of real estate under construction jumps to $243 billion from $94 billion in 2009: Report
Sebi must blacklist board members\, officials found guilty of governance deficit: Narayana Murthy
Opposition parties seek meeting with President\, urge him not to sign farm bills
BDR Pharma launches 80 mg version of prostate cancer drug at Rs 24\,480 per pack in India
SpiceJet to start flights to Darbhanga from Delhi\, Mumbai\, Bengaluru next month
Amit Shah wants Assam govt to engage legal experts to examine the clause 6 panel’s recommendations
SBI Life inks pact with Yes Bank to sell insurance policies
Monday Mayhem! Investors lose Rs 4.58 lakh crore; top factors behind Sensex's 812-point crash
Start nibbling at top 5-6 banks via SIPs: S Naren
Personal care brand mCaffeine raises Rs 42 crore in third round of funding
China's Didi\, BYD to launch co-designed ride-hailing EV
AIPEF writes to PM Modi; urges not to rush Electricity (Amendment) Bill
Dalmia OCL launches new refractory line in Odisha to bring down the import dependence on China
'Telcos need to pay 10% of total AGR dues by March 31 irrespective of payment made'
MPL raises $90 million in funding led by SIG\, MDI\, RTP
RITES Ltd wins Rs 475 crore contract for railway electrification works
Returning to the stands: Eifel Grand Prix at Germany's Nuerburgring track will allow up to 20\,000 fans
SBI opens online window for restructuring retail loans: Here's how to use it
Indian IT firms should focus on proactive problem recognition and solution mindset: Murthy
Surat's diamond industry workers say no to Diwali holidays as demand revives
Pakistan Army shells forward areas along LoC in Jammu and Kashmir's Poonch
Coming months going to be challenging due to coronavirus pandemic: Radico Khaitan's MD
AUM of funds linked to SIP at record high despite moderating inflows
Though smaller than before\, investors continue to SIP\, take AUM to a record
Offering free tickets on Vande Bharat flights would have further affected airlines' finances: Puri
Gold declines Rs 326\, silver tanks Rs 945
Centre asks states to stamp global convention details on International Driving Permits
MCX witnesses delivery of 1\,06\,814 tonnes in 5 base metal contracts since Jan 2019
Sebi details framework to protect investors against near zero/negative prices in commodities
Modi govt sometimes blames God\, sometimes people\, but not its 'misrule': Rahul Gandhi
State Bank of India kicks off restructuring of retail loans
SBI loan restructuring: Who can avail the scheme by when and how will the scheme work
Tata Motors announces limited-period subscription offer for electric SUV Nexon
India saved Rs 5\,000 crore by filling strategic reserves with low-priced oil: Dharmendra Pradhan
Botswana's mass elephant deaths caused by bacteria: Govt
F&O: Nifty forming lower top and bottom\, spike in VIX bad news for bulls
Tariff\, non-tariff measures to protect India's interests: Piyush Goyal
Home Minister Amit Shah expresses anguish over building collapse in Bhiwandi
90 million non-farm jobs and 8.5% growth rate needed. Can India do it?
Sushant Singh Rajput's talent manager Jaya Saha quizzed by NCB; Sara Ali Khan\, Rakul Preet Singh may be summoned
Meet SwabBot\, the robot that will conduct Covid-19 swab tests
Tech View: Nifty below 50-DMA\, needs to revisit 11\,333 for any recovery
Fountain pen\, silver pocket watch of composer Wladyslaw Szpilman up for auction in Poland
Over 3.8 lakh firms struck off under companies law in three years: Govt
Stockal Inc CEO's dedicated workspace in a quiet corner helps him improve productivity
Luxe brands try to keep the coveted status symbol as fashion weeks move online
More people in West Bengal working for al-Qaeda: National Investigation Agency
JSW Steel likely to raise up to $1 bn via offshore route
HDFC Bank denies charges by US law firm; to defend vigorously in lawsuit
PM lays foundation for 9 highway projects in Bihar\, inaugurates optical fibre connectivity
Privatise select PSU banks\, dilute role of DFS: Raghuram Rajan
Market Movers: Route Mobile shines on listing\, telcos worst hit; 417 stocks hit lower circuit
Farm bills anti-farmer\, will lead to famine: Mamata Banerjee
TN's economy to revive to pre-Covid-19 period in two months: C Rangarajan
Govt sets foodgrain output target at record 301 mn tonnes for 2020-21
India's economic recovery is gaining momentum\, Nomura data shows
Indian steelmakers turn net exporters to China in April-August: Crisil
Why bank stocks bled? Research reveals suspicious transactions
DDoS attacks are on the rise in India\, says cyber security firm Radware
Airbus reveals concepts of new hydrogen-powered zero-emission aircraft\, could enter service by 2035
Penetration of electric vehicles to remain low in medium-term in PVs\, CVs: ICRA
Covid\, no opposition whip and absentees saved government the blushes on Farm Bills in Rajya Sabha
UP RERA urges state to reduce stamp duty on property registration by 2%
Government hikes wheat MSP by Rs 50 to Rs 1\,975 per quintal
Irdai permits insurers to conduct video-based KYC
Cyber security incidents in India tripled to 3.5 lakh in July\, August from Jan-March: Sanjay Dhotre
Govt to set hydrogen energy development targets\, costs to fall: Secretary
Sensex's 812-point fall hits grey market premiums of three IPOs
Bigger money will be made in top 4 private banks over next 12 months: Aditya Khemani
BSNL raises Rs 8\,500 cr through sovereign bonds
Govt starts massive \"profile building\" exercise of workers returned from abroad
Congress agitation for recall of farms Bills; joint Opposition appeal to President
Railways has over 4\,000 khalasis\, no reports of any abuse; review of appointment underway: Goyal
Angel Broking an expensive bet\, but may offer good listing gains
CBI conducts searches in eight locations of Kwality in Rs 1\,400-cr bank fraud case
Rolls-Royce shares hit 16-year low on mooted $3 billion equity raising
Wall Street ends lower on lockdown fears\, likely delay of stimulus
Why many Indian farmers and politicians oppose PM Narendra Modi's farm laws
9\,488 pilots required in India in next five years: Aviation Minister Hardeep Singh Puri
59 employees of Air India group have availed leave without pay scheme: Puri
SBI raises Rs 7\,000 cr via Basel III compliant bonds
Banks not risk averse\, they are being prudent: SBI chairman Rajnish Kumar
Wipro 3D\, GenWorks Health Partner to enable access to Wipro Chitra AirBridge\, an emergency breathing assist system
United States Department of Labor proposes increase in H-1B wages
Day trading guide for Tuesday's market
Reliance Capital begins asset monetisation process
Modi says farmers already getting more for their produce\, Nitish Kumar backs new laws
Dept of Space doesn't want to free up any spectrum in 26 Ghz MM wave; telcos fret
Supreme Court to issue guidelines on right to protest while addressing the right to free movement
Auto fuel demand to reach pre-Covid levels in a quarter: Indian Oil Chairman S M Vaidya
Modi promises 23 bridges over rivers in Bihar\, Nitish says Patna to be reachable from anywhere in Bihar in 5 hours
No permit required for transport vehicles carrying Oxygen: Centre
BKS to push govt's point of view\, says ‘loopholes’ can be sorted out through talks
2G spectrum: Citing several reasons\, parties oppose early hearing of appeals challenging acquittal
