UP and Bihar now conducting maximum Covid tests daily\, UP to soon pip Tamil Nadu in total tests
Demand for packaged sweets\, dry fruits and pulses rise\, likely to exceed pre-Covid levels
Trade Setup: 11\,300-11\,350 zone stiff hurdle for Nifty\, as is a dollar rebound
McDonald's sues former CEO Stephen Easterbrook over alleged relationships with employees
Sebi issues guidelines to help trustees monitor AMC activities
Rajasthan Congress crisis: Sachin Pilot calls for a truce\, party ready to address his grievances
Equitas Small Finance Bank IPO to be launched once business normalcy is restored
BCCI issues EOI for IPL title sponsorship\, interested parties need to show Rs 300 crore turnover
Kozhikode plane crash: Air India Express hires US-based firm to recover baggage
Ahead of Market: 12 things that will decide stock action on Tuesday
Contempt of court petition filed in Delhi High Court against Oyo\, founder Ritesh Agarwal
Lebanon's cabinet resigns over Beirut blast amid public fury
Smooth execution without technical glitches critical for GST filing system: Experts
ICICI Bank launches QIP with interest flowing from global investors
IMC Chamber of Commerce and Industry appoints new banking committee members
NSE-BSE bulk deals: IndusInd Bank sells shares of Eveready Industries and McLeod Russel
China sanctions 11 US politicians\, heads of organizations\, says 'performed badly' on HK issues
Kotak Bank 'achieves compliance' with promoter stake reduction requirement
UBS Principal Capital Asia sells Axis Bank shares worth over Rs 150 cr
NSE sets aside over Rs 4\,000 cr from co-location facility
Edu Port of GMR Hyderabad Airport City teams up with St. Mary’s Society
India announces immediate relief to Lebanon in the aftermath of Beirut blast
Equitas Small Finance Bank Q1 results: Net profit flat at Rs 60 cr
Power Grid Q1 results: Net profit falls 18% to Rs 2\,048 cr
Pranab Mukherjee undergoes successful brain surgery\, on ventilator support
Why India's move to put import embargo on 101 defence items is no wake-up call
Gas explosion destroys Baltimore homes; 1 dead as firefighters search for victims
Eye on migrant employment\, UP to give sops to industries willing to invest in backward regions
Plaints on fleecing Covid patients: Telangana warns private hospitals\, threatens to seize 50% ICU beds
Andhra announces new industrial policy with key fiscal incentives\, also offers support services
Labour Ministry could widen scope of gratuity to include contract\, seasonal\, gig workers
View: The success of the groundbreaking NEP will fully depend on its implementation
Make things\, arms later: Why India needs to make its weapons systems at home to the extent it can
ISF seeks changes to draft wage rules\, says they are disadvantageous for part-time workers
Sebi bans 27 entities from mkts in matter of front running by Reliance Securities dealers
HDFC raises Rs 3\,693 crore via NCDs
Pay charges daily and then operate flights from airports: AAI puts GoAir on 'cash and carry' basis
Singapore-based NRI media entrepreneurs list $100 million SPAC IPO on Nasdaq
Increased demand for groceries lifts household consumption to a two year high in April-June
BCCI is under no pressure to drop IPL sponsors with links to China\, say officials
Jio proposes Rs 6\,127 crore resolution plan for Reliance Infratel
BCCI invites EoIs for Indian Premier League title sponsorship\, sets August 18 deadline
Looters descend on downtown Chicago; more than 100 arrested
