Auto companies may inject Rs 35\,000 crore to drive up sales
Anil Ambani fully involved in company operations\, says UK Court
Duty relief proposed for Harley motorcycles ahead of Trump visit
Importers of Chinese goods face supply constraints\, unable to pay via hawala routes
RIL\, Shell liability to government may drop in PMT case
With AGR ruling\, banks fear surge in bad loans
Covid-19 Impact: Pharma companies feel the pain as prices of key inputs shoot up
CPPIB looks to go big on ReNew as Goldman cuts stake
DGCA mandates health screening of passengers from 4 more countries
ATM operators seek higher fees on withdrawals
YONO largest consumer platform after e-commerce companies\, says SBI Chief
AGR issue: Telecom minister Ravi Shankar Prasad meets PM; DoT takes back order
Over 1 lakh deaths in 29 cities due to air pollution: Study
LIC Housing Finance refers 15 stuck infra projects to AIF
For Vodafone Idea\, choice is equity infusion or bankruptcy: Analysts
For Vodafone Idea\, the choice now is equity infusion or bankruptcy: Analysts
'Risk-sharing' model for Indian medium lift chopper likely
Clarification on dues order: OIL to move TDSAT\, PSUs recall pleas
Election Commission counters ex-CEC's charges of inaction against hate speeches
JetLite staff moves NCLT to be part of Jet’s insolvency resolution
Bharti Airtel faces high costs\, isolation if Vodafone Idea exits
Lenders set to recover 43.1% from insolvency proceedings
UP admits 12.5 lakh more unemployed in last 2 years
Congress\, SP vying for minority votes in UP
CM BS Yediyurappa may change forest minister
Aditya Birla flagship companies well shielded
Sharad Pawar criticises Uddhav's call on Bhima Koregaon probe
Amit Shah\, JP Nadda to attend 2 day VD Savarkar meet
UEFA bans Man City from Champions League for 2 seasons
Ethnic muslims must apply to be included in community census
NRC project manager hands over password
Turkish Prez Recep Tayyip Erdogan compares Kashmir with Gallipoli
Remembering Heroes: Anniversary of Pulwama suicide attack
People in J&K want to move on: Envoys
Bombay HC judge Satyaranjan Dharmadhikari quits abruptly
NSA slapped on UP's Dr Kafeel Khan
Global economic rebalancing has led to political rebalancing: S Jaishankar
Sebi issues notices to former top officials of CARE Ratings
Voda Idea\, bank stocks take a hit as SC refuses AGR relief
PI Industries plans a Rs 2\,000 crore QIP issue
White House economic adviser says coronavirus outbreak could 'maybe' impact U.S. GDP in Q1
Donald Trump's India visit will be delightful spectacle\, utterly successful: Experts
Making efforts to disembark Indians from cruise ship after quarantine period ends: Indian Embassy
2020 KPMG Ideation Challenge (KPMGIC): A student challenge like no other
Hotel industry association writes to railways ministry about IRSDC RFP
Do you have enough insurance? Use this thumb rule to find out
Don't interfere: India to Erdogan over his comments on Kashmir
For self-driving startups\, revenue is elusive\, but miles add up
Public Credit Registry to catalyse MSMEs’ financial inclusion: Enkash
Warning signs cropping up in crypto sphere amid 2020 resurgence
Pakistan unlikely to get any reprieve from FATF grey list at Paris meet
Brave New World: Global economic trends in five charts
Telco distress call: SBI says it’s prepared for the worst
Bhakti music\, veg food on the new Kashi Mahakal Express
Virus may hit 28% Indian imports
Jewellery line\, H&M tie-up\, NYC store: How Sabyasachi is stitching a grand play & successful legacy
How universalisation of exchanges has changed markets for investors?
To help fight lifestyle diseases\, Hyderabad masjid to hold yoga classes
Government may look at division of shares for retail push
India gears up for mega multilateral naval exercise 'Milan'
Working on a cloud offering for SMB customers: Automation Anywhere’s Milan Sheth
Coronavirus has infected more than 67\,000 people globally
Karvy fails to keep payment date with investors
4 cops hurt as anti-CAA protest turns violent in Chennai
Indo-American diaspora debates CAA
Bulls and bears engaged in a tough fight; FY-ending woes to keep market subdued
Addressing the address problem: Why mantris are refusing to vacate their homes
Kejriwal invites teachers for oath ceremony\, BJP calls it 'Tughlaqi farmaan'
States must amend laws for fiscal breach
Shah Faesal booked under PSA
India needs a robust capital market to become a $5 trillion economy: Anurag Thakur
PM Modi chairs CSIR Society meet\, urges scientists to focus on real-time social issues
PhonePe earmarks Rs 800 crore in marketing this year
Government clears Rs 540 crore in stuck housing projects from stress fund
Finance minister asks startups for feedback on taxing ESOPs
Pakistan violates ceasefire in Jammu and Kashmir's Kathua
Entire industry moving towards zero broking model: Ashishkumar Chauhan\, BSE
Pernod Ricard India growth rate falls to 5% during July-Dec 2019
Transmission of rate cuts improving; expected to improve further: RBI Governor Shaktikanta Das
Nadda appoints MP\, Sikkim\, Kerala's BJP unit chiefs
MF money needs to move towards commodities for economic growth: Vijay Kumar\, NCDEX
India urged to extend renewal date of OCI card till Dec 31
There has been total transparency in Central Vista revamp project: Hardeep Singh Puri
If India has to grow at 8-9%\, capital market needs to be further developed: Vikram Limaye
Vishnu Dutt Sharma appointed new chief of BJP's MP unit
50 people responsible for \"Delhi nirman\" to share stage with Kejriwal in his oath-taking event
SC order on AGR dues: Shaktikanta Das says will discuss internally if any issues arise out of it
Rate cut transmission gradually increasing\, to improve further: RBI Governor
Indians more focussed on quality compared to global consumers: Kantar
Jeep\, man on Pune airport's runway force early takeoff of AI plane; fuselage damaged
Oath-taking ceremony: Gupta writes to Kejriwal over directorate of education circular
Karnataka Congress leaders detained for bid to besiege CM's office
Auto dealers' body asks vehicle makers to shift completely to BS-VI compliant units
Govt closely monitoring agriculture credit given by banks: FM
Trump trumps Modi: US President quotes Zuckerberg\, says he is number 1 on FB\, ahead of India visit
TMC's Derek O' Brien leading questioner in RS during of first half of budget session
Defamation case: Delhi court imposes Rs 5000 cost on Shashi Tharoor for not appearing before it
Jaishankar meets US House Speaker Pelosi
Opposition parties in Tamil Nadu condemn police action against anti-CAA protesters
Back-to-back shoots & brand collaborations: Siddhant Chaturvedi on how 'Gully Boy' changed his life
D-Street Week Ahead: Avoid large long positions\, stay stock-specific
Credit growth momentum picking up; Budget proposals not to stoke inflation: RBI chief Shaktikanta Das
More than half of coronavirus cases in Hubei treated with traditional Chinese medicine: Official
Fashion couturier Manish Malhotra calls cinema 'first love'\, says he would love to direct a film someday
17 people from Delhi who returned from abroad before coronavirus screening showed symptoms\, hospitalised
Jhadhav travels 61\,000 kms to pay tributes to fallen CRPF men in Pulwama
Donald Trump: I'm 1st\, Prime Minister Modi 2nd on Facebook
Anti-CAA: Group protests in Delhi over Chennai police incident; detained
Kerala court summons Ravi Shankar Prasad in defamation case
Jagan seeks Prasad's help to move AP High Court to Kurnool from Amaravati
PDP leader resigns from party\, says Article 370 was 'dead stock'
Google Maps marks Kashmir's outlines as 'disputed' when seen from outside India
France announces 1st death in Europe of virus patient
American Airlines announces daily non-stop flight between Bengaluru and Seattle
Desperate times\, desperate measures: China to sanitize & quarantine cash midst Coronavirus scare
Global scenario not rosy\, will impact MF sector: SEBI official
Sebi plans to implement governance structure to ensure ongoing compliance
Russia to lose Sochi Olympic gold medal in new doping case
'Don't worry\, one democracy will settle it\,' Jaishankar to US Senator on Kashmir
Shree Cement Q3 net profit rises 3% to Rs 310 crore
Banks will have to pay price if any telco files for bankruptcy: SBI Chairman
McNally Bharat close to reaching rescue deal
Vodafone Idea assessing what it can pay as AGR dues\, to pay shortly
Vodafone-Idea assessing what it can pay as AGR dues\, to pay shortly
ANMI to mobilise one crore investors for LIC's IPO
Lakshmi Vilas Bank posts net loss at Rs 334.47 cr during Q3
Despite mixed reviews\, Kartik-Sara's 'Love Aaj Kal' rakes in Rs 12.40 cr on opening
Amazon CEO Jeff Bezos loves grocery shopping & household chores\, says bartending is back-up career
Indian Usain Bolt gets shout-out from Anand Mahindra\, sports minister Kiren Rijiju invites him for trials
Grand Canyon-esque terrain\, greenery & sparkling rivers: Rohit Kapoor on cycling from Manali to Leh
Tradition comes to rescue: China administers 3\,000-year-old medicine on patients affected by Coronavirus
Shankar Sharma says he will never touch LIC as an investor. Here's why
RBI board recommends aligning accounting year with fiscal year from 2020-21
Jaishankar meets Pompeo\, Pelosi on sidelines of Munich Security Conference
Objective of kick-starting growth not addressed effectively in Budget: Subhash Chandra Garg
Radhakishan Damani becomes India’s 2nd richest person
US President’s delegation to India may include several Indian American officials
Blanket labelling of dissent as anti-national hurts ethos of democracy: Justice Chandrachud
How British Indians are leading Boris Johnson's new cabinet
Can ambitious infrastructure projects be insulated from policy flip-flops?
Why India is also susceptible to coronavirus-like diseases
Meet five bureaucrats who show the way forward for Modi's Rs 102 trillion infra plan
View: Not the optics\, trade and defence deals to be centrepiece of Trump's visit
Novel coronavirus: The hunt for a virus killer
LV with Levi’s: High-low fashion trend is fast catching up
How a clutch of skincare entrepreneurs in the West are celebrating the brown skin
Coronavirus crisis: It's time for India Inc to create opportunities
Truecaller may have finally found a plan to make some moolah
Real estate body launched app to facilitate homebuyers
China's mobile and digital dominance runs deep into Indian economy
Govt spending remains key to India's economic growth
Oppo F15 review: One of the best-looking smartphone under Rs 20K; impressive camera performance
Sony Walkman NW-A105 review: Down the memory lane with new design and features
Honor Sport Pro review: Good battery backup\, fast-charging support; better options available at the price point
