Maletas\, mentiras y cintas de vídeo
Tierra\, mar y aire
Un vecino intenta reciclar una granada llevándola a un punto verde
Conversación en Barajas (imaginaria... o no)
Echegoyen/Barceló y Botín/López Marra\, en 49er y Pacheco y Trittel\, en Nacra\, a los Juegos
Separatismo
El chisgarabismo
¿Quién se ríe de quién?
Diputados\, concejales y afiliados de tres «familias» de Cs optan a compromisarios en una lista de unidad
El Puerto de Santa María acoge el I Simposio de Federaciones de Deportes de Agua y Cumbre de Presidentes
PP y Cs alcanzan acuerdo para ir en coalición electoral en el País Vasco
Justicia con plazos
El «Delcygate» ya es el caso Ábalos
«IDEC Sport» rompe el récord de la Ruta del Té
Herida grave una mujer al atraparle una mano la puerta de un Cercanías
Reparto de puntos en el partido aplazado
El Leipzig saca los colores al Tottenham de Mourinho
Horóscopo de hoy\, jueves 20 de febrero de 2020
Tras cuatro accidentes de coche y un divorcio\, la suerte le sonríe en «First Dates»
Llull se suma a la lista de bajas del Real Madrid
Rodri y De Bruyne ahogan las penas del City
Urdangarin disfruta de dos escapadas gastronómicas durante su permiso
PP y Ciudadanos alcanzan un acuerdo para ir juntos a las elecciones en el País Vasco
Y Pablo Motos volvió a no hacer la pregunta incómoda
La válvula cardíaca que crece al mismo tiempo que el niño
Sánchez cede ante el PNV y transferirá la gestión de la Seguridad Social al País Vasco
El Convenio del fútbol femenino se presenta en el Congreso
Mario López da la victoria al Ademar de León en el duelo autonómico ante el Atlético Valladolid (30-32)
Endesa considera que las subastas de renovables están creando una burbuja en el sector
Un juez otorga la custodia de dos menores huérfanos de la violencia de género a la hermana del asesino
Comprobar el resultado del sorteo de Bonoloto de hoy miercoles\, 19 de febrero de 2020
El Reino Unido pedirá a los inmigrantes hablar inglés y no dará visas a los trabajadores poco cualificados
Investigación abierta a un senador de VOX por un presunto caso de violencia machista
Comprobar resultados del sorteo del cupón diario de la ONCE de hoy miercoles\, 19 de febrero de 2020
El 1 de abril tendrá lugar la salida oficial del príncipe Harry y Meghan Markle de la Familia Real Británica
Teresa Ribera cambiará la ley de Costas y actualizará los deslindes en el litoral
Escucha las noticias de ABC
Escucha las noticias de ABC
La CNMC abre un expediente a Idealista por subir artificialmente el precio de la vivienda
Barcelona lanza descuentos del 20 al 35% para capear las pérdidas por la cancelación del MWC
Extirpan un tumor cerebral a una mujer mientras toca el violín
La Fundación BBVA premia a Isabelle Guyon\, Bernhard Schölkopf y Vladimir Vapnik por impulsar la inteligencia artificial
Una anciana de 90 años se cae de un séptimo piso y se salva por unos toldos
Los Mossos d'Esquadra se podrán jubilar anticipadamente a los 59 o 60 años
Batet anima a políticos a tomar ejemplo de las futbolistas
Urdangarin disfruta de un almuerzo en familia antes de volver a prisión
Detectan una extraña nube de gas orbitando algo «invisible» en el centro de nuestra galaxia
Así es «Queen & Slim»\, los nuevos «Bonnie & Clyde» para los tiempos modernos de Estados Unidos
Un proyecto repoblará con erizos de mar zonas sobreexplotadas
Guardiola\, sobre la sanción al City: «Apoyo al club al cien por cien»
Eurocaja Rural continúa creciendo con una nueva oficina en Muro de Alcoy
Muere un hombre tras quedar atrapado por la rueda de un tractor en Hontoba
Heridos siete mayores al colisionar su transporte con un turismo en Chillón
El Supremo ordena repetir un juicio por abuso sexual a un menor saharahui porque la víctima no declaró
Aumenta en Valencia una enfermedad que transmiten animales y ya septuplica la media nacional
Aumentan los casos de la leishmaniosis en la Comunidad Valenciana
Primera huelga general del sector petroquímico para exigir más medidas de seguridad tras la explosión del pasado mes de enero
Las seis noticias imprescindibles de hoy\, miércoles 19 de febrero
Garamendi se reúne con Escrivá para hablar de retos de Seguridad Social
Las jugadoras españolas presentan el primer convenio de fútbol femenino
La «Tauromaquia» de Goya aviva el debate sobre las corridas en Perú
«Soy inocente. Esto es peor que quedarme en silla de ruedas»
El Gobierno prepara una nueva edición del Plan Moves con 65 millones para incentivar la movilidad «limpia»
Reclaman que los hijos de la mujer asesinada se queden en La Puebla de Almoradiel
El mandil es tendencia: estudiantes de moda e Ikea rediseñan esta típica prenda
FMI alerta de que coronavirus puede hacer \"descarrilar\" recuperación económica
Gloria Camila se declara a su novio en Instagram
Abertis gana 1.101 millones durante 2019\, un 9% más sin contar con las plusvalías por Cellnex
Seguridad Social\, en el Festival Solidario de Ronald McDonald
Campo se reúne con asociaciones profesionales de jueces y fiscales
La Reina prohibe a Harry y Meghan usar la marca Sussex Royal
El hombre de confianza de Ábalos\, a un vigilante de seguridad en Barajas: «No tengo por qué identificarme»
Sorprenden a dos cazadores que boicoteaban una cacería con petardos
El campo gallego pide sanciones por pagar por debajo de costes
Sara Sálamo e Isco se divierten con los filtros de Instagram
Isa Pantoja aporta detalles sobre la relación con su madre
Paliza en el patio de la cárcel: dos presos linchan al asesino de una niña de 13 años
La caja de solidaridad independentista recauda dos millones de euros para la fianza del TdC por el 1-O
El Barça entrena e intenta abstraerse de las polémicas de la directiva
La mujer degollada en Moraira no quiso declarar contra su asesino en el juicio de malos tratos denunciados por un vecino
Josep Bartomeu se reunió anoche con los capitanes del Barça
Repatriados los tres polizones que llegaron a Vigo ocultos en un petrolero
PP y Ciudadanos se reúnen de nuevo para sellar el acuerdo de coalición en el País Vasco
Pablo Burillo reconoce que en la federación de fútbol «no hemos vendido bien la comunicación»
Bale y Jovic no entrenan por una gastroenteritis
Bordalás\, antes del Getafe-Ajax: \"Me he inspirado en Cruyff\"
El motivo de la trágica muerte de Caroline Flack\, presentadora de «Love Island»
La revolución silenciosa de la Berlinale\, entre el miedo al Coronavirus y el pasado nazi de su exdirector
La Polla Records suspende un concierto en Chile por invasión de escenario
Richard Learoyd: una cámara oscura contra la fotografía compulsiva del siglo XXI
La música en vivo registra un récord de facturación de 382 millones de euros
Los mármoles del Partenón podrían estar incluidos en la negociación del Brexit con la UE
La película 'El hombre invisible' aborda la violencia machista
Felipe VI preside pleno extraordinario de la Cámara de Comercio
Elisabeth Moss protagoniza 'El hombre invisible'
Braithwaite se entrena a la espera de fichar por el Barça
Carrascosa Díaz: unos gemelos fuera de serie
Mercedes avisa ya en el primer contacto con el asfalto
Unas 300 personas se concentran frente a Iqoxe para pedir más seguridad
Alessandro Lequio sobre su hijo Álex: \"Todo está bien\"
El Barcelona pagará al Leganés la cláusula de Braithwaite
La industria alemana deja de crear empleo
La mujer asesinada en Moraira declinó denunciar y declarar contra su maltratador en un juicio
El cine Conde Duque de Goya cerrará en junio y reabrirá en octubre en otro punto del barrio
El gobierno de Ada Colau estudiará endurecer la tenencia de animales exóticos en Barcelona
PP y Cs votan contra el pin parental de Vox en las Cortes Valencianas y Compromís lo tacha de «mierda»
Botànic\, PP y Cs rechazan en Les Corts la propuesta de 'pin parental'
Un diputado de Compromís califica a ABC de «xenófobo\, machista y racista» por informar
Belén Esteban acusa a la prensa de inventarse titulares sobre la muerte de Fran: «Quiero que pase todo»
Mapeada la proteína del Covid-19 esencial para fabricar una vacuna
Un camión se empotra contra el tejado de un garaje
Agricultores y ganaderos se manifiestan en Pamplona y Granada
Granada se convierte hoy en el epicentro de la protesta agraria
Reducen a un atracador que tiró al suelo a una mujer y la arrastró para quitarle el bolso
Investigadores crean el primer mapa tridimensional de la proteína esencial para fabricar vacunas
El cuento para que la hija de José Fernando entienda por qué su padre está en desintoxicación
El Atlético tiene vida
Aparcar en la zona ORA deja de ser gratuito para los concejales de Zamora
La Policía detiene a cuatro detectives vinculados con el vídeo de un juez que usó Villarejo
La muerte de Bon Scott\, el cantante de AC/DC\, el gran misterio del rock'n'roll
Dos peatones\, heridos leves en un accidente de coche
Ferri (Compromís) asegura que el 'pin parental' \"es una mierda\"
Calvo sobre mesa de negociación: \"No ha habido críticas\"
Recorrido por la huella de Gloria en Levante un mes después
Un senador de Vox por Ceuta\, investigado por un caso de violencia machista
Reino Unido limitará la entrada de inmigrantes sin estudios o que no hablen inglés
Dos impuestos de nuevo cuño: la Tasa Google y la Tasa Tobin. ¿En qué consisten?
La UE movilizará más de 20.000 millones al año para plantar cara a EE UU y China en la revolución digital
¿De dónde salen las ráfagas rápidas de radio que llegan del espacio?
Benjamin Griveaux anuncia su retirada de la alcaldía de París
Así será el exclusivo centro de experiencias de lujo de Porsche en Italia
Revuelo en un pueblo de Pontevedra por el sorteo de un juguete erótico para las fiestas patronales de San Gregorio
Un juez de Toledo determina la tutela de dos menores huérfanos de la violencia de género
Prisión para un exconcursante de «Mujeres y Hombres y Viceversa» por dejar morir de hambre a su perro
Expertos debaten sobre nuevas estrategias de prevención y tratamiento en Salud de la Mujer
Así es la casa más cara de España: a la venta por 25 millones de euros
Mutua Madrileña financiará en 2020 seis nuevos proyectos impulsados por voluntarios universitarios
Casting de mascota ideal para mayores en Valladolid
Caroline Flack\, tercer suicidio en 20 meses dentro de «Love island»
Los agricultores de Pamplona han celebrado su propio San Fermín en señal de protesta
Máxima seguridad en la búsqueda de los dos trabajadores sepultados en el vertedero de Zaldibar
Todos los detalles del reencuentro entre Sara Carbonero y Paula Echevarría
Jaime Ostos: «Tengo dolores muy fuertes. Los hay peores que la cornada de un toro»
La Fiscalía recurre el permiso de tres días a Cuixart
Pedro Sánchez propone el lunes 24 de febrero para la mesa de diálogo con la Generalitat
El abogado que iba a defender al artista ruso que filtró el vídeo sexual de Griveaux trabajó con Baltasar Garzón
Rescatada de las llamas por unos vecinos subidos a una excavadora
La Fiscalía recurre el permiso de tres días dado a Jordi Cuixart
La CNMC abre un expediente a siete empresas del sector inmobiliario por subir artificialmente el precio de la vivienda
Muere el actor John Shrapnel\, el senador Gaio en «Gladiator»
Así fue el exterminio de los rusos en Tsushima\, la batalla naval más terrible de la historia desde Trafalgar
Como anillo al dedo
«Hay que ser un animal»: once años de prisión por intentar violar y matar a su casera en Alicante
El carnaval donde se celebra la promiscuidad difunde el mensaje de «no es no»
Un hombre de 77 años se enfrenta a puñetazos a un ladrón y evita que le roben la billetera
Un camión de 15 toneladas cae en el interior de una casa en Fuente Olletas
Resuelto el misterio de la muerte de cientos de estorninos cerca de una petroquímica de Tarragona
La Airef cree que los ingresos de la tasa Google serán «nulos» si entra en diciembre
Madrid no aplicará \"las medidas intervencionistas\" en vivienda
España se opuso al plan argelino de delimitación de aguas
CEOE alerta de que las tasas Google y Tobin castigan a las empresas españolas y expulsará a los inversores
La Catedral de Barcelona revive la polémica historia de su fachada
Las cintas del «Delcygate» no saldrán\, de momento\, de Barajas
El fiscal general de Trump le amenaza con dimitir a causa de los mensajes en Twitter
Marc Serruya abandona la presidencia de Honda en España y Portugal tras una década
La Reina Letizia recupera su traje masculino
JxCat acusa a Sánchez de \"imponer\" a Torra una fecha
El «intrusismo» de Correos pone en pie de guerra a las agencias de viajes
Así son las elecciones en las que se elige al presidente de la Federación
«Seis mil millones de razones por las que sí nos interesa Venezuela»
Agricultores y ganaderos ocupan Pamplona en defensa del sector
Una dieta vegana no es lo mismo que una dieta saludable
La juez deja en libertad al exjefe de ETA David Pla entregado por Francia
Muguruza alcanza los cuartos de final en Dubai
Sindicatos ven un éxito la huelga y recuerdan que \"la precariedad mata\"
Unidas Podemos apoya a los trabajadores de la petroquímica de Tarragona
Determinan que hay pruebas para imputar un delito de aborto a la mujer que tiró a su bebé muerto a la basura
Victoria Ortega\, protagonista del Foro Justicia ICAM
Sevilla exprime sus naranjos
VOX se desmarca del resto de políticos en el minuto de silencio por el crimen de Moraira
Jefe de Policía avanza una investigación de 200 obras en un domicilio en Granada
Así lucen los diez nuevos monoplazas del Mundial 2020
La fiscal rebaja a 5 años y 11 meses la solicitud de prisión para Ángel Vizcay
Cs ve \"triste\" que \"los vascos paguen las consecuencias\" del 'no' de Feijóo
Trabajadores de Iqoxe piden cumplir \"a rajatabla\" la seguridad
AENA guarda las cintas del encuentro entre Ábalos y Delcy Rodríguez a requerimiento de una juez
Abren el restaurante favorito de una niña con leucemia para complacerla en EE.UU.
Graban a un trabajador de un local de comida rápida bañándose en el fregadero de la cocina
Albiach pide mejorar los protocolos de seguridad
\"Cocoon\"\, un macetero que multiplica por cuatro la supervivencia de un árbol recién plantado
Casado retrata a Sánchez con una oferta para pactar los Presupuestos que el presidente desdeña
La confrontación protagoniza la sesión de control al Gobierno
La inquietante «amenaza» de Klopp tras las caras felices del Metropolitano
El «número 2» del MIR 2020: «Los que estudiamos en la Complutense no hemos notado diferencia entre el examen y la carrera»
Arrimadas emplaza a Feijóo a seguir negociando pese a su rechazo a la coalición en Galicia
El Gobierno defiende el «derecho» de Marruecos a delimitar las aguas de Canarias
La Airef cree que los ingresos de la tasa Google serán «nulos» si entra en diciembre y otras noticias económicas
Bronca por las «niñas prostituidas»: Iglesias acusa a PP y Vox de «descojonarse» para tapar su inacción
El Gobierno dota con 70 millones de euros las nuevas «Misiones Ciencia y Innovación»
Un vigilante de seguridad desmiente ante notario la versión de Ábalos sobre el «Delcygate»
Hallan a un niño de doce años muerto y torturado por sus abuelos y su tío en una casa de EE.UU.
La Reina participa en una reunión de trabajo de Unicef sobre bienestar infantil
La alianza china para contraatacar a Google: ¿es posible dejar de depender de Android?
Twitter se consolida como empresa rentable: gana un 22% más que el año anterior
Meghan Markle consigue vender la mansión de lujo en la que vivía con su exmarido
Asenjo\, por tercera vez ante el juez\, declina responder sobre los audios con Villarejo
El Atlético no descansa tras la victoria frente al Liverpool
JxCat: \"Hay una necesidad de mediador en la mesa de diálogo\"
Madrid trabaja en una Ley de Infancia que promueve el acogimiento entre 0 y 6 años
Divertido y entrañable encuentro entre Feijóo y Benedicta Sánchez
PP pide a Iglesias que dé la batalla por la PAC
La Real Sociedad cumple su promesa e invita al Becerril a presenciar su partido ante el Valencia
Ábalos\, sobre el «Delcygate»: «Estoy muy tranquilo. Se cumplió con todas las normas»
La Junta pedirá al Ministerio de Cultura la ampliación del Museo del Greco
Belén Esteban regresa al foco mediático tras la triste muerte de Fran Álvarez
En los últimos siete años ha habido cuatro denuncias de abusos sexuales a menores dentro del movimiento «scout» en España
Este brazalete impide que los micrófonos de smartphones y altavoces inteligentes te espíen
El Gobierno busca eliminar la cláusula anticorrupción que limita los contratos menores
Villacís asegura que placas \"nunca estuvieron puestas\"
Los premios Yago homenajean a Hombres G en la gala más insólita del cine español
Carlos Felipe de Suecia\, víctima de unos hackers
Laya sobre la oficina de bienes españoles en el Sáhara Occidental
32 detenidos de una banda que traficaba con droga
Mata de nueve puñaladas a su bebé con unas tijeras: «No sé lo que pasó\, solo que la perdí»
Cientos de vecinos de Orcasitas claman por el amianto de sus casas: «Nos está matando»
Cómo crear una red Wifi solo para invitados
Twitter\, más cerca de copiar la función de moda en las redes sociales
El tardío adiós de Luís Villares
Marlaska asegura que no \"toma a nadie por imbécil\"
El Clínic lidera el primer programa en el mundo de detección precoz de enfermedades crónicas del hígado
Lorenzo Amor presenta su candidatura para seguir como presidente de ATA
Investigan a dos conductores «cazados» a 212 y 217 kilómetros por hora en las autovías de León
Santa Cruz de Tenerife se engalana para elegir a su Reina del Carnaval
El presidente de las Cámaras de Comercio\, al Rey: «Majestad\, estamos con usted; cuente con nosotros»
Publican un vídeo con la Policía rapando el pelo y el bigote a «El Chapo» Guzmán
Arrimadas llama a Feijoó y le dice que quiere que siga siendo el presidente de la Xunta
Albiach: \"JxCat busca excusas para posponer la mesa de diálogo\"
Prem Rawat: «No hace falta irse a un monasterio para encontrar la paz»
Smith: \"Lo que ofende a los españoles es que nos tomen por estúpidos\"
El día que Iglesias hablaba de una «purga» contra Fernando Garea
Chanel cancela un desfile en China por el coronavirus
Cae una red que exportaba marihuana a Holanda y Alemania e importaba speed a España
Una menor denuncia una agresión sexual en un piso de Bilbao
Healthy Poke llega a Valencia: la cadena abre su primer local de comida rápida saludable en la ciudad
Montero insta a que la \"crispación acabe\" en la situación con Cataluña
'Encierro' de tractores en Pamplona
A la venta por 1 millón de dólares el Cadillac de Al Capone
Muere un hombre de 70 años arrollado por un camión de reparto en una plaza peatonal de Salamanca
La contaminación del tráfico se asocia a una mayor presión arterial
La selección española de baloncesto\, premiada de manera honorífica en los Laureus
A la cárcel por propinar un puñetazo que mandó a la UCI a un hombre
Moringa
El Gobierno propone convocar la mesa de diálogo entre gobiernos el próximo lunes 24 y Torra lo rechaza
Convocan para el lunes una nueva concentración en apoyo a los exjugadores de La Arandina condenados
El partido callejero con unos niños que ha hecho viral a Novak Djokovic
El Parlamento de Cataluña se disculpa por tener aceite español en su restaurante
La CNMC inicia un expediente para determinar si Amazon es un operador postal
El aeropuerto de Alepo reabre ocho años después de su cierre
Jorge Buxadé será el portavoz de Vox en la nueva estrategia de comparecer todos los lunes
Una mujer toca el violín mientras le extirpan un tumor en el cerebro
Rufián celebra que se reúna este mes la mesa de diálogo sobre Catalunya
Dani Martín cumple 43 años
Lo que debes saber antes de usar una app que escanea etiquetas de alimentos en el supermercado
Castilla y León convocará las oposiciones para docentes más numerosas de su historia con 1.400 plazas
Sánchez fija fecha para la mesa de diálogo y Torra responde
Suicidios\, enfermedades mentales y drogas: la infancia de Ben Affleck
Un hombre rocía a su novia con gasolina y le prende fuego mientras dormía en Lisboa
Marlaska califica de «bulo y noticia falsa» los beneficios penitenciarios a los condenados por el «procés»
Padres y profesores escoltaron a una adolescente en Granada por el acoso de otras chicas
Una tractorada en protesta por el sector agrario atraviesa Granada
Meteoritos a velocidades relativistas pueden estar atravesando la atmósfera de la Tierra
Archivada la denuncia contra el alcalde de Zamora por delito electoral
La Policía auxilia a una menor tras recibir mensajes de audio «amenazantes» de su madre
Lastra: \"Sánchez ha propuesto a Torra que la mesa de diálogo se celebre el día 24\"
Huelga de los trabajadores de la petroquímica de Tarragona
La Policía Nacional alerta del riesgo de explosión al manipular este peligroso material
El vídeo de la mujer que toca el violín mientras le extirpan un tumor en el cerebro
Neymar carga contra el PSG tras caer en Dortmund
Los camiones eléctricos podrían realizar la mitad de los recorridos en la Unión Europea
Igea\, al PSOE tras ser absuelto: «Es un buen día para pedir disculpas»
El médico que abusó sexualmente de tres pacientes en Pontevedra no irá a la cárcel
Bronca en el Congreso por las niñas prostituidas en Baleares
Crean prótesis personalizadas para animales
Erdogan advierte de una operación militar inminente en el norte de Siria
Page anuncia una excavación «exhaustiva» en la Vega Baja de Toledo
Mueren tres niños con su padre después de que su coche comenzara a arder en Australia
¿Es más rentable la compra de coche o el renting?
La leche y los batidos +Proteínas Hacendado de Mercadona\, entre las innovaciones del año en España
González Laya defiende una PAC \"moderna\"
Escrivá asegura que el Gobierno no fomenta la inmigración irregular
Una investigación analizará la pérdida de neuronas en el cerebro adolescente por atracones de alcohol
Más de 10.000 hombres semidesnudos se dan cita en Japón para celebrar el «Hadaka Masuri»
Radicales
Condenan a un hombre por violar brutalmente y asfixiar con una percha a una anciana en Valencia
El insólito remedio del Raja Casablanca para evitar más lesiones: sacrificar un carnero
La Fiscalía solicita que Antifraude entregue al PP los expedientes sobre el hermano de Ximo Puig
Crece la demanda de jet privados por la cancelación de vuelos a China y Hong Kong
Irene Montero llama desde la sala de Moncloa a participar en el 8-M y «reorganizar la sociedad»
El camión de Mercadona que ha revolucionado el reparto a domicilio en España
'Tractorada' en Pamplona para defender el sector
Maroto pide al PP y a Feijóo que \"hagan política útil\"
El fiscal pide cárcel para un tuitero por difundir la foto y el DNI de la secretaria judicial del 20-S
Cómo descargar todo lo que WhatsApp sabe de ti
Reliquias a la venta\, un suculento negocio digital
Atacan a Dabiz Muñoz por cocinar un plato con pulpitos: «¿No está prohibida la matanza de crías?»
Qatar Airways eleva su participación en IAG al 25\,1%
Álvarez de Toledo pide \"llegar hasta el final\" en el asunto de las cintas
Y así se arrancó a cantar por La Lupe el consejero de la Presidencia
Piqué estalla tras el mensaje de un defensor de Bartomeu: «Títere»
El último Mozart vuelve al Liceo
El Gobierno publicará el índice de precios del alquiler a finales de marzo
Montero recrimina al PP que ninguno de sus PGE cumplió el déficit
Vecinos de Orcasitas reclaman el pago de las ayudas para retirar el amianto
Portugal estudia ofrecer cobertura sanitaria gratuita a los británicos tras el Brexit para no perder turistas
Masymas alcanza los 302 millones de facturación tras incrementar un 2\,4 por ciento sus ventas
El escándalo de las menores prostituidas en Baleares llega al Congreso
El Manchester City culpa a Real Madrid\, PSG o Bayern por su sanción
El coronavirus infecta a las cuentas de resultados de Apple
El cumpleaños más amargo del Príncipe Andrés
¿Es posible implantar el voto electrónico en España?
Un alto cargo destapa en una circular que «muchos» funcionarios no cumplen el horario
Díaz dará bonificaciones al campo por el SMI pero ligadas a la estabilidad en el empleo
Ábalos comparte la inquietud del sector agrícola
Nieblas\, paciencia y soles vencidos
Rembrandt: retrato en claroscuro
Fermín Bocos: «El crimen sigue estando al servicio de intereses políticos»
Los muertos por el coronavirus superan ya los 2.000
Tráiler e imágenes de «Caronte»\, la nueva serie de Telecinco que se estrenará primero en Amazon
George Clooney convierte la isla de La Palma en un gran plató
Palau 100 apuesta por las grandes orquestas
La dieta extrema que debilitó al gotoso Emperador Carlos V durante su «jubilación» en España
La dieta mediterránea favorece bacterias intestinales relacionadas con el envejecimiento saludable
La «jubilación» de Carlos V en un pueblo de Extremadura
El Gobierno publicará el índice de precios del alquiler a finales de marzo
El colapso del «procés» fragmenta y radicaliza la oferta electoral secesionista
El Pacto de Toledo empieza a trabajar desde lo acordado en 2019
Finalizan las obras del tramo en superfície de la nueva línea 10 del Metro de Valencia
