El Covid\, pero no solo
Siempre con las víctimas del terrorismo
Pedroche y sus nuevos hábitos saludables
El Valencia no falla y su triunfo elimina al Real Madrid
Victoria triste del Real Madrid
Horóscopo de hoy\, sábado 27 de junio de 2020
Otegi dice que el Gobierno vasco es \"ni-ni\, ni abertzale\, ni socialista\"
Rafa Nadal protagoniza el anuncio de promoción turística de Mallorca
La verdad sobre el supuesto romance entre Antonio David Flores y Chayo Mohedano
Una muerte por coronavirus y 17 nuevos casos en la Comunidad Valenciana en las últimas 24 horas
Muere una mujer de 75 años en la playa de la Almadraba de Alicante
Un juez allana la colocación de la bandera gay en el Ayuntamiento de Zaragoza
Abascal denuncia la agresión a Rocío de Meer en un \"acto de hostigamiento\"
Lo que somos
F1 reprueba la declaración de Ecclestone de que los negros a menudo «son más racistas que los blancos»
Abascal\, escoltado por la Ertzaintza al término de su mitin en Sestao
Sergio «Maravilla» Martínez vuelve al boxeo el 22 de agosto\, seis años después de su última pelea
El Almería destituye a Guti
El alcalde de Liverpool\, tras las imágenes de las celebraciones en Anfield: «Es decepcionante»
Pontón presume de aldea
Incertidumbre ante la llegada de miles de visitantes en algunos destinos turísticos
Comprobar resultados del Cuponazo de la ONCE de hoy viernes\, 26 de junio de 2020
El Real Madrid\, sin semifinales por primera vez en 12 años
Comprobar el resultado del sorteo de Bonoloto de hoy viernes\, 26 de junio de 2020
Comprobar el resultado del sorteo de Euromillones de hoy viernes\, 26 de junio de 2020
Abatido un atacante en el centro de Glasgow tras acuchillar a seis personas
Abascal desafía a los antifascistas fumándose un puro mientras la policía lucha por contener la protesta contra VOX
Aragón registra su peor dato de contagios en dos meses\, 75 en solo 24 horas: se agrava la escalada
«22 años del asesinato de Manuel Zamarreño\, concejal del PP en Rentería»
Histórica clasificación del Burgos para semifinales
La OMS necesita unos 31\,3 billones de dólares para desarrollar terapias\, diagnósticos y vacunas
Juventus - Lecce en directo
Dimite Óscar Álvarez\, el gerente de las Agencia de las residencias de la Comunidad de Madrid
Dimite el gerente de la Agencia de las residencias de mayores de la Comunidad de Madrid
Mueren un motorista en un accidente en Moraira y un trabajador al caerse de una nave en Carlet
Dimite por \"motivos de salud\" el máximo responsable de las residencias de la CAM
Antifascistas revientan el primer acto de campaña de VOX en Sestao
La relación de Canarias con Jeffrey Epstein que ayudó a desencadenar sus delitos
Casado\, Rajoy y Feijóo\, juntos en la Plaza de Toros de Pontevedra
El plusmarquista de medio maratón\, Geoffrey Kamworor\, atropellado mientras se entrenaba
Una campaña «de hashtags»
Fernando Rivas: «Carolina no es talento\, es una capacidad de trabajo asombrosa»
Los informes de la macrocausa Tándem descartan que Villarejo recabase datos policiales de Dina Bousselham
Leonor se dirige en catalán a los ganadores de los premios Princesa de Girona
Un guardia civil fuera de servicio salva la vida a un bebé de seis meses en Leganés
El Hospital Valencia al Mar echa el cierre tras acumular pérdidas desde 2012
2-5: El Manzanares se deja remontar un 0-2 por el Elche y se queda sin final
Mendia carga contra los que \"pierden el tiempo arrojándose banderas\"
Países Bajos rescatará a KLM con una ayuda de 3.400 millones de euros
Pablo Casado pone a Castilla y León de «ejemplo» en la gestión y en la búsqueda de pactos
Alba Carrillo presume de curvas con su imagen más refrescante
Aluvión de estrenos para celebrar la vuelta a los cines
La OMS compara el comportamiento del coronavirus con el de la gripe española y advierte de una segunda ola
La OMS afirma que el coronavirus se comporta como la gripe española\, que volvió en otoño y causó 50 millones de muertos
Las 8 noticias del día sobre el coronavirus
El Museo Carmen Thyssen de Andorra anuncia la presentación del «Mata Mua»
Tres muertos en el ataque múltiple por apuñalamiento de Glasgow (Escocia)
Las historias más increíbles del Festival de Glastonbury
Vox solicita al alcalde de Valladolid que retire la bandera arcoiris de la fachada del Ayuntamiento
ABC analiza mañana la decisión de la Fiscalía de investigar las filtraciones de Anticorrupción a la abogada de Podemos
Beatriz Gómez Lorenzo presenta «Serendipia» en el festival «Guadalajara en Negro»
Setién sobre el Madrid: \"Confío en que en algún momento se equivoquen\"
Consumo descarta un encarecimiento «especulativo» de los alimentos durante el estado de alarma
Participa en el Foro ABC Salud sobre el futuro de la sanidad pública y privada tras el coronavirus
Detienen en una finca de Quintanar de la Orden y Los Hinojosos a un hombre por explotar a trabajadores
La vacuna del neumococo se multiplicará por 10 y la tetravalente frente a la gripe subirá un 25%
Microsoft cerrará todas sus tiendas físicas
Aluvión de estrenos para celebrar la vuelta a los cines
Puigdemont avala el amago de escisión entre Junts y el PDECat que impulsan los presos de Lledoners
Castilla-La Mancha se une a Castilla y León y Madrid para combatir los incendios forestales
Estos son los 135 países que aún prohíben la entrada desde España o no tienen conexiones
España registra ocho fallecidos\, la cifra más alta desde que Sanidad actualizó el balance total
Guardia Civil trabaja en localizar a la persona que originó el brote en Navalmoral
El coronavirus ya circulaba por Barcelona en marzo de 2019\, según un análisis de aguas residuales
Page reclamará a Iglesias los 513 millones que el Estado debe a CLM por la dependencia
Evelyn Alonso toma posesión y crea la primera división de votos en el Ayuntamiento de Santa Cruz
El Parlamento Europeo accede a investigar la falta de EPIs en los hospitales españoles
Grave un niño de 2 años tras caer a una piscina privada en Torrejón de la Calzada
À Punt llamará a los valencianos a resintonizarla en el botón 9 del mando\, del que «nunca debió salir»
El coronavirus colapsa el fútbol ruso
Colau esquiva por ahora retirar la medalla de Oro de la ciudad a Felipe González por los GAL
El Gobierno de Colau reitera su negativa a la franquicia barcelonesa del Hermitage
Prueba del Jeep Cherokee Overland 2020: un 4x4 sin complejos
María Pombo muestra las reacciones de sus seres querido al contar su embarazo
Chiara Ferragni ensaya una coreografía y disfruta del lago de Como
La razón por la que Tita Thyssen no acudirá al entierro de su ex\, Manolo Segura
La estrategia de Rocío Flores tras conceder su primera entrevista
Se querellan contra el alcalde de Guadalajara por colgar la bandera arcoíris
Los Reyes y sus hijas se reúnen con los ganadores de los Premios Princesa de Girona
Ámsterdam prohíbe el alquiler de pisos turísticos en el centro de la ciudad
Escalan a 18 los casos en A Mariña\, con dos focos que podrían compartir origen
La Junta apoya a las Escuelas Taurinas en la presentación del XXVI Ciclo de Novilladas
La UEFA\, sin plan B ante los rebrotes en Portugal
Los municipios de la Comunidad Valenciana con más casos nuevos de Covid-19 en los últimos días
Treinta solitarios se disputan el trofeo Solo Maître CoQ
Belén Esteban se reafirma en su cabreo con Jorge Javier Vázquez: «No cuesta decir \"lo siento\"»
Los herederos de Conan Doyle denuncian a Netflix para evitar el estreno de la película sobre la hermana de Sherlock Holmes
Cyberpunk 2077: el videjuego aumenta la expectativa de sus seguidores con nuevo tráiler
Los Reyes mantienen una videoconferencia con los galardonados en los premios Princesa de Girona 2020
Cyberpunk 2077: tráiler del videojuego
Tres muertos en un «atentado» contra el responsable de Seguridad de la capital mexicana
La Princesa de Gerona: «Es una pena que este año no hayamos podido celebrar la entrega de premios»
Récord de participación en la Vuelta a Mallorca
Castilla y León\, Madrid y Castilla-La Mancha firman su colaboración en prevención y extinción de incendios
Sobera\, Agoney y Ricky Merino\, protagonistas en la presentación del Orgullo 2020
El Supremo obliga a RTVE a hacer público el sueldo de sus directivos
El Liverpool\, campeón 30 años después
Estos son los 77 centros de salud que abrirán por la tarde en verano en la Comunidad Valenciana
El Orgullo 2020 se celebrará desde ventanas y balcones y con una marcha virtual
Mascarillas que permiten traducir mensajes
Solicitud de datos para rastrear posibles rebrotes y orquestas con mascarilla: así volverá el ocio nocturno a Galicia
Cines Valencia: Lys y ABC reabren sus salas con los primeros estrenos a precio reducido
Libertad responsable
J Balvin se burla de Shakira\, y Maluma salta en su defensa
El TSJ tumba otro decreto lingüístico del Gobierno valenciano por posible «arbitrariedad» contra el castellano
Bendodo: Si el PSOE antepone el interés de Andalucía \"les recibimos con brazos abiertos\"
Dos muertes y 36 nuevos casos por coronavirus en Castilla-La Mancha
Cadena perpetua para el asesino del vallisoletano David Martínez en Londres
Robles cesa al número tres del ministerio después de  que colocara a su novia como número 1 para ascender a coronel
Los países que incorporaron las mascarillas antes tuvieron tasas moderadas de infección por Covid-19
Page: \"El estado autonómico se ha fortalecido\"
Ayuso señala que se ha peleado por salvar cualquier vida
Los sanitarios de Castilla y León recibirán en julio plus de «riesgo» por el Covid de entre 208 y 1.327 euros
César Arévalo\, ex de Nuria Fergó\, detenido por su implicación en una red de narcotráfico
La mujer de Bill Cosby rompe su silencio después de seis años: «El movimiento #MeToo es racista»
Condenado a un mínimo de 15 años de prisión el joven que lanzó a un niño desde la Tate Modern de Londres
Rescatan una serpiente tras caer a un patio de luces en Castellón
Sanxenxo aumenta la seguridad de sus playas con cuatro drones de vigilancia
El Barça deja a Setién al margen
La provincia de Toledo se vuelca con la última Carrera Virtual Solidaria Fundación Eurocaja Rural
400 vecinos de Villanueva de Algaidas (Málaga) llenan el pueblo de banderas LGTBI
Confirman ocho años y diez meses de prisión por arrancarle un trozo de labio a su expareja
Las últimas noticias de hoy de actualidad y la última hora de deportes del viernes\, 26 de junio del 2020
Últimas noticias del viernes\, 26 de junio del 2020 | Descubre toda la actualidad y última hora de sociedad
Últimas noticias de cultura hoy viernes\, 26 de junio del 2020
Últimas noticias de internacional hoy viernes\, 26 de junio del 2020
Las últimas noticias de hoy de actualidad y la última hora de España del viernes\, 26 de junio del 2020
Mañueco apuesta por \"el entendimiento\" para la reconstrucción
Un Espanyol al borde del abismo prepara la visita del Madrid
Las subidas de impuestos del Gobierno forzarían a cada español a pagar 365 euros más al año
Isla Mágica presenta su nueva temporada adaptada a las nuevas medidas de seguridad
El cine español se pone el bañador y las chanclas en el ciclo de verano de FlixOlé
El Gobierno prorroga los Erte y las ayudas a los autónomos hasta el 30 de septiembre
«Delicuescente Eva»: la Abadía apuesta (momentáneamente) por el streaming
La Escolanía del Monasterio de El Escorial\, sin banquillo
Revelan partes desconocidas de los yacimientos de Atapuerca
Dos veces viuda\, un polémico divorcio y un hijo sin casarse: los hombres en la vida de Tita Cervera
Inés Arrimadas\, de paseo por las calles de Madrid con Xavier Cima y el pequeño Álex
El primer pago del ingreso mínimo vital llega a casi 75.000 hogares
Los cazadores-recolectores del Holoceno también pescaban en el Mediterráneo
Montero garantiza que el teletrabajo se regulará en el seno del diálogo social
Aprobada prórroga hasta septiembre de los ERTE y prestación para autónomos
Adelgazar caminando: cuántos pasos debo dar por minuto para perder peso
Guaca-hummus\, la receta nutritiva del Chef Bosquet para las cenas de verano
Vecina de Navalmoral: El ambiente \"está bastante tranquilo\"
PP pide que Iglesias responda por \"escándalo de cloacas del Estado\"
Cinco ejercicios para reducir cintura con las Gemelas Pin
PP dice apoyar al Gobierno porque PSOE acepta sus \"exigencias\"
Villacís agradece la \"generosidad\" de los grupos en las mesas de los pactos por Madrid
Olvidar los cumplidos\, el pistoletazo de salida para la infidelidad
Lo que se esconde detrás de un «me siento vacío»
Bebidas saludables para olvidarte de los refrescos en verano
El helado de chocolate casero que puedes preparar en un minuto con el Chef Bosquet
Ejercicios para reducir la parte interna de los muslos con las Gemelas Pin
Señales que indican que los celos de tu pareja son peligrosos
Un hombre de 86 años muere en una piscina de Quismondo
Marlaska asciende al general de la polémica de los bulos contra el Gobierno
El Gobierno de Trump pide al Supremo que tumbe la ley sanitaria «Obamacare»
Isla Mágica reabrirá sus puertas siguiendo un riguroso protocolo de seguridad
Torra asegura que \"jamás\" convocará elecciones por motivos partidistas
«Guerra» entre la RAE y la Fundéu por la acentuación de «chi»
«Recuerda que más del 90% de tus preocupaciones nunca llegan a ocurrir»
Montero defiende la regulación del teletrabajo
Controlados los brotes de Lepe\, Orio\, en Guipúzcoa y Santander
Los casos de Valladolid\, Segovia y Soria\, «aislados» y en fase de contención\, según Verónica Casado
El Gobierno aprueba la prórroga hasta septiembre de los ERTEs
Investigan a los fiscales del caso Villarejo por filtrar información a Podemos
\"No te muevas porque si no la vamos a liar\"
Primera operación salida de la \"nueva normalidad\"
Madrid acoge la presentación del Madrid Orgullo online 2020
Dime cómo criticas a alguien y te diré cómo eres realmente
Sector agrario denuncia \"desperdicios enormes\" de cebollas y patatas
Guardia Civil busca a la persona origen del brote en Navalmoral
Los brotes de Aragón y Málaga están más controlados
La RFEF ve restringidos sus vídeos del playoff por el título
Trabajadores del transporte sanitario privado protestan ante la sede de ERC
Abengoa comunica a su plantilla que no podrá pagar las nóminas de junio de forma completa
Guardia Civil detecta secuestros virtuales en Madrid
Guardia Civil alerta sobre una nueva oleada de secuestros virtuales
Guerrilla entre búlgaros e italianos cerca de Nápoles por el coronavirus
Verizon\, gigante de las telecomunicaciones de Estados Unidos\, se une al boicot publicitario contra Facebook
El Gobierno aprueba el fondo para respaldar a la gran industria en la compra de energía verde
Teresa Rodríguez ve que IU \"construye el relato de su ruptura\" de Adelante y le invita a recapacitar
Se estrena Abre Madrid\, un nuevo espacio escénico con el apoyo de Openbank
Inoportuna rajada de James: «Es complejo mostrar tus capacidades teniendo pocos minutos»
3 de cada 4 españoles valora más la banca digital tras el confinamiento
Simeone: \"Lo que toca es resolver cada partido a la hora que sea\, en el lugar donde sea y con los parones que haya\"
El Gobierno espera que el apoyo del PP no se deba al «interés electoral» por el 12-J
Rusia respalda una posible reunión entre Trump y Maduro
La CNMV refuerza la obligación de las cotizadas de investigar los delitos de sus consejeros
El festival Bilbao BBK Live resiste al coronavirus con una edición en «streaming»
De las gasolineras al estrellato: la increíble historia del ascenso meteórico de Camela
Urkullu se compromete a \"poner en pie\" a Euskadi sin recortes
PP critica la actuación \"negligente\" de Junta y Gobierno en Navalmoral
Ciruela
Miguel Bosé mete la pata al atacar al «Gobierno pelele de Soros y Gates»
Nuevo día sin fallecidos por Covid en Castilla y León\, que suma otros dos casos en las últimas 24 horas
Victoria Federica y Jorge Bárcenas\, vacaciones en alta mar
Consejo de Ministros\, en directo: El Gobierno aprueba extender los ERTE y las ayudas a los autónomos
'Rders' critican \"unilateralidad\" de Trabajo al regular su sector
Feijóo abre la campaña en su pueblo natal\, Os Peares\, con un mensaje de estabilidad frente a experimentos
Coronavirus: Confirman que Covid-19 es generalmente leve y rara vez causa la muerte en niños
El Hipódromo de Madrid abre sus puertas al público
Moratoria de préstamos y créditos al consumo ascendió a 20.000 millones
Garzón apunta \"acción reforzada\" en norma sobre publicidad de juego
Pedrosa: «Es triste perder a Pol\, pero lo entiendo»
La NASCAR comparte la foto de la polémica
Nuevo ataque a la Policía en Londres cuando intentaba suspender una fiesta ilegal
BBVA dará acceso al juez a los correos del caso Villarejo que se negaba a aportar
El nuevo líder laborista despide a la secretaria de educación en la sombra por un tuit antisemita
Vox denuncia las amenazas de muerte e insultos contra sus dirigentes
Ana Boyer disfruta de su plan más romántico
Alejandro Fernández: «En Cataluña lo más alternativo e iconoclasta es ser del PP\, es ir contra corriente»
Algunas bodegas que ya han abierto a los turistas: viñedos y catas para este verano
Un niño que perdió las dos piernas recauda casi un millón de libras para el hospital que le salvó la vida
Italia confina un municipio cerca de Nápoles por 49 positivos en coronavirus
ONG reclaman regularizar a personas 'sin papeles'
Dos jóvenes de la provincia de Toledo\, investigados por compartir «stickers» de pornografía infantil
Una candidata para «hacer historia»
Carla Barber y Diego Matamoros comparten su primer viaje juntos
El diésel gana la batalla en los vehículos de ocasión
Un tribunal de Rusia declara culpable de malversación al director de cine y teatro Kiril Serebrenikov
Simeone: «No hay excusas\, cuando se pone un horario hay que jugar y ganar»
El BCE asegura que el momento más duro de la crisis provocada por la pandemia «probablemente ha pasado»
Bolsonaro dice que «cree que ya se ha contagiado de coronavirus» y lo ha superado
Emma Roberts espera su primer hijo
Sanitarios a Osakidetza: \"Sólo nuestro esfuerzo ha paliado la pandemia\"
Consumo pondrá en marcha el sistema de etiquetado de alimentos Nutriscore a principios de 2021
Las confesiones de Sneijder: «La botella de vodka se convirtió en mi mejor amiga»
Fallece Félix Pérez\, uno de los fundadores del dúo de música tradicional Candeal
El Ayuntamiento de Toledo suspende las Ferias de Agosto
Mercadona invierte 38 millones de euros en Castilla y León para acelerar la reactivación económica
Indemnizan con dos mil euros a una mujer que se rompió un diente con una aceituna rellena
La menopausia\, la gran desconocida para los hombres en España
La Xunta endurece sus advertencias ante el riesgo de nuevos rebrotes
El brote de A Mariña podría alcanzar los 18 positivos
Feijóo: \"El 57\,7% de actividad emprendedora en Galicia la lideran mujeres\"
El hospital Benito Menni de Valladolid consigue el primer certificado COVID-19 en España en el sector sociosanitario
Crítica de «Personal Assistant»: La diva
Roldán: «No me gusta este Govern\, pero la situación requiere que todos estemos a la altura»
Klopp\, al borde de las lágrimas: «Es increíble ser campeón con este equipo»
Global Omnium reduce su huella de carbono por segundo año consecutivo
Crítica de «Corre como una chica»: Una mujer a caballo
El Colegio de Médicos de Toledo homenajea a los médicos fallecidos por Covid-19 en el día de la patrona
Ariana Grande cumple 27 años\, ¡felicidades!
Crítica de «La posesión de Mary»: Bruja a babor
Crítica de «Algunas bestias»: Familia aislada y gangrenada
Crítica de «La cinta de Álex»: «Welcome» al cine y a los cines
Sanidad avisa de los posibles peligros del ozono y la luz ultravioleta al desinfectar el coche de Covid
Así es el «hotel refugio» de Juan Roig blindado ante el Covid-19 que rozará el lleno este verano
Jorge Javier Vázquez revela haber sufrido amenazas por sus broncas políticas
El renting\, aún más atractivo en tiempos de coronavirus
Feijóo anima a «votar sin miedo» por un «presidente limpio que no salga de los despachos»
Segovia lleva a los sanitarios al cielo para agradecer su trabajo en la crisis del Covid-19
Prince regresa a lo grande con una descomunal reedición de «Sign O'The Times»
El alcalde de Madrid propone la realización de test aleatorios en Barajas
Esta es la forma más eficiente de enfriar el interior del coche
La pandemia de coronavirus suma 178.500 casos y supera los 489.000 muertos
Dakota Johnson: «Ha sido una lucha crecer en una familia como la mía\, con tres padres famosos»
La Vela\, escuela de vida: hábitos de salud
Haaland: «Acabo de llegar\, no pienso para nada en dejar el Dortmund»
PP y Cs exigen saber si Sánchez recibía avisos de Seguridad Nacional sobre el riesgo de pandemia
El juez remite a la Fiscalía el caso del exmilitar que se grabó disparando contra fotos de Sánchez e Iglesias
La gran mezquita rural oculta en un cortijo malagueño
Elton John\, demandado por su desconocida y misteriosa exmujer
Vox pide a los anunciantes boicotear «Sálvame» y rescata los insultos de Jorge Javier a Olvido Hormigos
Los siete grandes récords a batir en el próximo Mundial de F1
Seis robots para hacer PCR y controles de aguas fecales en Madrid para combatir el Covid
La delicada gestión de Luka Romero: «Está en riesgo»
Embajadores recupera la tradición de los cines de barrio
Amazon anuncia la apertura de un nuevo centro logístico en Leganés
Investigadores españoles demuestran la presencia de coronavirus en lesiones de la piel
Un hospital gallego prohíbe el acceso a quienes lleven mascarillas con válvula
Mercadona ya duplica las ventas de algunos productos gracias al desconfinamiento
El presidente de Abuespa: «Los abuelos hemos perdido la guerra contra el coronavirus»
La retina\, clave en la detención precoz de alzhéimer en los familiares del enfermo
¿Habrá cruceros este verano? ¿Cómo será la vida a bordo? Estos son los planes de las navieras
Unos 4.000 nacimientos menos por reproducción asistida debido a la Covid-19
Los campamentos de verano se reinventan en versión online
Los expertos avisan: el peso medio de los niños ha aumentado 3 kilos durante el confinamiento
Pilar\, de 71 años\, una revelación en redes sociales\, donde conciencia sobre el párkinson
«Si la Administración no baja el ratio de niños por clases ni aumenta el número de profesores la vuelta al cole va a ser un desastre»
Nueva oleada de secuestros virtuales durante el confinamiento
Marlaska asciende al general de la polémica por los bulos
España\, Francia\, Italia y Reino Unido limitan la tasa Google por las amenazas de EE.UU.
Sanidad avisa de los peligros para la salud de los dispositivos de luz ultravioleta u ozono para desinfectar
El 70% de los ancianos en residencias tienen anticuerpos de coronavirus
El PP responsabiliza directamente a Redondo de ocultar las alertas de Seguridad Nacional para proteger Sánchez
Golpe a Facebook: crece el boicot de anunciantes a las políticas de la red social sobre los discursos de odio
Estos son los mejores auriculares bluetooth del 2020
Cómo contribuyen las grandes tecnológicas a la censura china
El gasto en pensiones sube un 0\,1% en junio\, hasta 9.862 millones
La Agencia Europea del Medicamento da luz verde al primer tratamiento para combatir la covid-19
Brutal ataque de tres perros a una pareja de septuagenarios en Valdemorillo
Fenicios
¿Puede dañar la vista la tecnología de realidad virtual?
Los usuarios de Facebook podrán desactivar los anuncios políticos en las elecciones estadounidenses
Piden siete años de prisión para los acusados de vender drogas en un locutorio de Tomelloso
Cinco detenidos por robos en fincas de caza y casas de campo en Villamanrique
Gobierno de Trump pide al Supremo anular el Obamacare en plena pandemia
Abelardo: \"El vestuario está muy jodido\, yo también\"
El verdadero motivo del trueque entre Arthur y Pjanic
El «rebote» de Sarri con Setién: «No me ha gustado lo que ha hecho»
Encuestas elecciones vascas 2020: Urkullu gana en los sondeos pero seguirá necesitando un socio de Gobierno
Victoria del líder opositor en Malaui\, según la prensa local
Cinco trucos para sacarle partido a tus cuentas de Facebook\, Instagram y Twitter
La ONU alerta del riesgo de una nueva oleada de violencia tras la anexión de Cisjordania
«Todos desde casa»\, la plataforma que ayuda a las empresas a implantar soluciones de trabajo en remoto
Trump hace campaña por el presidente polaco conservador Duda
Así sonará la nueva voz de Google Maps para eliminar el tono robótico
Así sonará la nueva voz de Google Maps para eliminar el tono robótico
El estreno de «Tenet»\, la nueva película de Christopher Nolan\, vuelve a retrasarse
Siete soldados colombianos aceptan los cargos por la violación de una niña indígena
Justin Bieber pide 20 millones de dólares a las dos mujeres que le acusaron de agresión sexual
Trasladan al hospital de Tomelloso a un hombre de 56 años herido por arma blanca
La Fiscalía General investigará las posibles filtraciones de Anticorrupción a la abogada de Podemos
Los perros de trineo aparecieron hace 9.500 años en el Siberia
Investigan la muerte de un hombre en una pelea nocturna en el centro de Barcelona
