Sunderland\, 1 - Barcelona\, 0
Ciudadanos elige a Amigo como consejera de Empleo tras rechazar al candidato que quería Igea
Madrid aún no ha obtenido respuesta del Gobierno sobre la vuelta a clases de 2º de Bachillerato
Primer juicio contra la Generalitat por la falta de protección a los sanitarios ante el coronavirus
Los nuevos planes de Renault y Nissan dejan sin encaje a Barcelona
El PP achaca la bronca entre Álvarez de Toledo e Iglesias a la crispación en la calle
Baleària reduce la capacidad de sus buques para garantizar la seguridad
Cazadores en época de coronavirus
Un enorme agujero en la capa de ozono causó una extinción masiva hace 360 millones de años
El colapso de la capa de ozono causó una extinción masiva hace 360 millones de años
Dudas ante las cifras de la pandemia de COVID-19 en Cataluña
Las películas imprescindibles de Woody Allen
Alba Carrillo se somete a una operación de onicocriptosis
Un juez investiga la interrupción de una misa en la Catedral de Valladolid durante el estado de alarma
Vox: «La naturaleza de Pablo Iglesias es hacer escraches\, quemar contenedores y asaltar capillas»
Nace el primer bebé koala tras los devastadores incendios forestales de Australia
Trabajadores de Nissan en Barcelona se concentran para conocer el anuncio de la compañía
Mike Tyson\, a golpes en una multitudinaria pelea con estrellas de la lucha libre
Uno de cada cinco pacientes hospitalizados por covid-19 en España falleció
Cuatro zapatillas Nike para volver a disfrutar del running
Coronavirus Madrid: últimas noticias | Suben los contagios y baja la cifra de muertes por coronavirus en Madrid
El 84% de pasajeros de Ryanair no han recibido aún el reembolso de vuelos cancelados por el coronavirus
La entrada de Kobe Bryant al salón de la fama se pospone a 2021
Todo lo que hay que saber sobre la batalla de los lunes
El destino emergente de Europa que se declara libre de coronavirus
Montenegro: Último país de Europa en detectar un caso de coronavirus y primero en declararse libre de la pandemia
Estados Unidos supera las 100.000 muertes por Covid-19
El Ayuntamiento de Vitoria deberá recuperar las subvenciones que dio a plataformas de presos de ETA
China aprueba oficialmente la Ley de Seguridad Nacional para Hong Kong
Dos fármacos antiinflamatorios son capaces de inhibir la replicación del coronavirus
Encuentra dos granadas de la Guerra Civil en su garaje mientras hacía limpieza
Todo lo que tienes que saber sobre el Conga\, el robot aspirador del momento
Empresas optan por un sistema de desinfección empleado por la NASA frente a virus
Trump pierde el favor de Twitter: la red social le etiqueta mensajes como información «potencialmente engañosa»
Manifiesto del sector del juguete para reconocer el 26 de abril como Día del Niño
Baviera obliga a aplazar la decisión sobre reapertura de las fronteras alemanas
Madrid espera ver el impacto de la fase 1 para pedir pasar a la 2 el 8 de junio
El Parlamento desafía al Supremo y ratifica a Guaidó
El asesinato de Romina a manos de su padre conmociona a Irán
Las clases dobles vuelven al trabajo
Sin apenas cines abiertos y sin ningún estreno en España pese a que las salas ya pueden volver a trabajar
Condena a cinco guardias jurados de Sants por acoso homófobo: «Los maricones no pueden ser vigilantes»
La hora de los psiquiatras
La Reina Isabel II ayuda a Boris Johnson a ponerse en forma
Ramón Celma: «Ir contra 16.000 festejos taurinos es ir contra el pueblo»
EE.UU. ya no considera Hong Kong autónomo de China y sopesa retirarle su régimen económico especial
Cruceros de lujo\, el sector que desafía al coronavirus
El momento más duro de Carolina Monje\, novia de Álex Lequio\, tras su fallecimiento
Contumelias o escraches
Las cataratas de Iguazú se recuperan después de la sequía
La verdad sobre el fundador de la Guardia Civil que se negó a cumplir una orden «injusta» del presidente del Gobierno
Vídeo: «Desgraciadamente\, no habrá lanzamiento hoy»
Protege tu piel este verano con los mejores protectores solares
Estos son los polideportivos municipales que abren parcialmente a partir del lunes
Las seis noticias que debes conocer hoy\, jueves 28 de mayo
Corea del Sur registra el peor repunte de casos desde el 5 de abril
Miles de personas se manifiestan en Mineápolis contra la violencia policial tras la muerte de un joven afroamericano
El mal tiempo obliga a cancelar la misión de la NASA con la primera cápsula para transportar personas a la EEI
En España fallecieron uno de cada cinco hospitalizados por Covid
El bulo de la quiniela «millonaria» que ganó Franco
El Rocío se queda sin camino pero mantiene la devoción y la alegría en Sevilla
Nissan comunica su decisión de cerrar la planta de Barcelona
¿Qué le ha pasado al pelo de los futbolistas en la cuarentena?
Un tercio del exceso de fallecidos no computa como víctima del coronavirus
Los zapatos que deberías llevar esta primavera
Henry Cavill podría convertirse de nuevo en Superman
Sanidad deberá autorizar desde ahora los test masivos de Covid-19
«El Gobierno es consciente de la importancia que tiene el motociclismo para el deporte español»
Distintos brotes ponen en alerta a Lérida y la localidad madrileña de Leganés
Así será ir a la playa
Adecco se alía con varias patronales para ayudar a quienes pierdan su empleo por el Covid-19
Los grandes museos madrileños reabren el 6 de junio
El perfil de los enfermos de COVID19: varón\, mayor de 65 y con patologías previas
Las medidas que deberán cumplir las discotecas en su reapertura
Finge su propio secuestro para extorsionar a sus padres y sacarles 7.000 euros
Así será la atención al ciudadano post-Covid en la Comunidad de Madrid
El IPC cae en mayo hasta el -1%\, su mayor tasa negativa en cuatro años
El autocine enciende sus luces: «Es un plan diferente de ocio para romper la monotonía del Covid-19»
Figo aún se siente «extremadamente feliz» de su fichaje por el Real Madrid
Estrictas medidas de seguridad para las elecciones gallegas
Los accesorios que no te pueden faltar para hacer deporte
La Abogacía del Estado obliga a la Fiscalía a pronunciarse sobre el 8-M
Marta Luisa de Noruega estalla contra los paparazzi tras la muerte de Ari Behn
Coronavirus España directo: 35 muertes en los últimos 7 días\, pero aumento de 283 fallecidos desde ayer
Las islas quieren pasar a la fase 3 la próxima semana
Asesinada una mujer en L'Escala
Cuando se jugaba al fútbol con gorra
Cómo evitar que Google «espíe» tus movimientos
La 39 edición de la Copa del Rey se disputará en 2021
Álvarez de Toledo llama «terrorista» al padre de Pablo Iglesias y estalla una bronca en el Congreso de los Diputados
La oposición cerca en el Congreso a Marlaska\, que niega cualquier «injerencia» en el informe del 8-M
Porcino de Segovia en vanguardia
América\, el nuevo foco de la pandemia
Valencia fase 2: la Generalitat propone fragmentar las playas por horarios y sectores de población
Adiós a la conexión por tren entre Lisboa y Madrid
Potente desinfección contra el Covid-19 sin rastros nocivos
Las familias de dependientes severos: «Estamos cautivos\, se han olvidado de nosotros»
Tecnología para la «nueva normalidad» que impone el Covid-19
La inquisición política de Marlaska
Liquidez para mantenerse a flote en la crisis del Covid-19
La pandemia obliga a aplazar la Copa del Rey de Vela por primera vez en 38 años
¿Sabes qué santos se celebran hoy\, jueves 28 de mayo? Consulta el santoral
Foro Asturias pagó 174.000 euros a una empresa de Álvarez-Cascos y su mujer
Fase 2: Alicante delimitirá zonas de baño en la playa y seis metros para paseo por la orilla en la desescalada
El Gobierno y la Generalitat coinciden: un solo muerto en Valencia por el Covid-19 en el último día
Vuelta a la «normalidad» en la desescalada: unos empresarios convocan una asamblea presencial y cóctel
Más de la mitad de los hogares españoles creen que su economía irá bien en los próximos meses
Encuentran restos de dinosaurios de hace 125 millones de años en Morella
Hallan el cadáver de un hombre flotando en la bocana de la Marina de Valencia
Detienen a un ghanés en situación irregular en España por violar a una antigua pareja
Mercadona lanza nuevos productos sin gluten de Hacendado en sus supermercados
Ribera Salud asegura que los sanitarios de Alicante trasladados a Madrid son voluntarios en sus días libres
La Lanzadera de Juan Roig impulsará proyectos de desempleados afectados por la crisis del coronavirus
La Generalitat corrige un plan de desescalada de la Justicia que era un «copia y pega» del de Madrid
El Gobierno se inclina por dejar pasar a la Comunidad Valenciana este lunes a la fase 2 de la desescalada
Sonsoles Ónega\, de reportera en el Congreso a presentadora del nuevo «reality» de Telecinco
Fase 2: Benidorm dividirá la playa en parcelas y hará controles de aforo en la desescalada
La mortalidad en la Comunidad Valenciana se dispara un 18% durante la pandemia del Covid-19
La rocambolesca historia de la escapada de Puskas a España
«¿Quién va a reparar los daños a Soria\, las oportunidades perdidas?»
Los diez pueblos que aspiran a convertirse en Capital del Turismo Rural 2020
Impulsan desde León una plataforma «on line» de homenaje a los fallecidos por el Covid-19
Albaricoque
Desescalada: Castilla y León pedirá que sólo El Bierzo pase a fase 2 a partir del lunes
Por qué el sexo esporádico se va a convertir en un deporte de alto riesgo
La BBC estrena el corto de Scorsese sobre el confinamiento
Sergio Ramos presume de la bandera española hasta en la bebida
Muere Manuel Álvarez\, el histórico presidente del CD Canillas
Los consejeros niegan crisis de Gobierno y le desean lo mejor a Barrios
La inesperada retirada de Marta Xargay
Un club escocés decide la continuidad de su portero a través de una encuesta
LeBron James estalla tras la muerte de un ciudadano en una intervención policial
RTVE mantendrá el crespón en forma de corazón pese a las críticas del PP
Corte de digestión
Carriedo\, el fontanero
«Perdidos» ya se puede ver al completo en España
Interior releva al Mando de Operaciones de la Guardia Civil en plena crisis por la investigación del 8-M
«LQSA»\, «3caminos»\, «Hierro» y las diarias: así han vuelto a grabar las primeras series españolas
Si Pedro y Pablo estuvieran en «El Ala Oeste de la Casa Blanca» no tendrían tiempo para tonterías
Un respiro con Mingote. El Código de Circulación
El Palacio del Capricho reabrirá 4 años después por los «errores» del plan de Carmena
«¿Puedo bajar a la piscina de mi urbanización?»
Carta de una estudiante universitaria: «Siento que estoy siendo evaluada constantemente pero no estoy aprendiendo nada»
Acoso y derribo para amedrentar a la juez
El grano y la paja
Tecnología en la medicina
El primer ministro polaco señala el 28 de junio como la fecha adecuada para las aplazadas presidenciales
Un rebrote de anarquía
La Asamblea Popular de China impulsa en su clausura la polémica Ley de Seguridad de Hong Kong
Sánchez: los derechos laborales se rescatarán «con diálogo social»
La hostelería reclama nuevos avales y una bajada del IVA al 4%
En tiempos de coronavirus\, ¿cuidamos la alimentación de nuestras mascotas? (II Parte)
Médicos forenses ven coherentes las 43.000 muertes: «Prácticamente todas hay que computarlas al Covid»
Los mejores trucos para preparar platos atractivos que se comen con los ojos
Angustia y ansiedad: las consecuencias de la pandemia entre los alumnos
Nuevo BMW Serie 5: mayor autoridad\, refinados detalles y electrificado
Mercedes-Benz Clase E Coupé y Cabrio: máxima deportividad con estilo
«Grease» inaugurará el autocine de El Barco de Ávila\, su apuesta para ver películas de forma segura
Los elementos del coche que prácticamente no han cambiado en cien años
Nicolás Cantaert\, director general de Sumauto: «Es necesario un plan estructural de incentivos a la compra»
Los estadios piden voz
La intrahistoria de la tregua en la guerra del fútbol
¿Qué tenía de normal la vieja normalidad?
El viaje sin sentido de un sueco entre yanquis
Thomas Wolfe\, certero retrato de una América en construcción
Encuentran en China unos extraños hornos cerámicos de hace 6.000 años
Hallan una tumba de hace mil años en China con una pareja «conectada» para seguir su amor en la otra vida
En busca del «rojo» O'Donnell\, el William Wallace irlandés que murió en Valladolid
Pillan a un ladrón cuando intentaba robar el mural de Banksy en homenaje a los sanitarios
Los premios en memoria del periodista que quemó el Museo del Prado
Dani Duch: «Ahora todo el mundo se piensa que sabe hacer fotos»
Sevilla F.C. y la redención de Maradona
Gucci cambia el ritmo de la moda
Bibiana Fernández\, de su eterna deuda con Hacienda a su nuevo casoplón
El legado de «La Codorniz» como nexo intergeneracional del humor absurdo
Madrid aumenta en junio un 30% los carriles bus para transportar a 32.000 viajeros más
El pavoroso vídeo de la colisión mortal de un conductor que circuló en sentido contrario por la A-4
La canina
Las puertas giran aunque nos quiebren las vidas
Primero\, detener la degeneración
Un fatalista en el Titanic
Su honor es nuestra esperanza
El padre de Pablo Iglesias\, un militante del FRAP según su hijo
Iglesias\, novela negra
El ameno vicepresidente
Madrid vive su primera noche de cine en el Autocine Madrid RACE
