El Covid\, pero no solo
El Eibar se aleja del descenso ante un Valencia fuera de los puestos europeos
Desmantelada una organización criminal que distribuía cocaína en las localidades de Barcelona y Girona
Pascal presenta candidatura para liderar el PNC
Los pacientes con fenilcetonuria piden acceder a más herramientas para mejorar su calidad de vida
Cómo adelgazar sin aburrirse y sin pasar hambre con pequeños cambios cada día
Garamendi (CEOE) alerta sobre la futura Ley del teletrabajo: «Una buena herramienta si no nos la comprimen»
El Liverpool y la liga de los treinta años
España\, puerta de entrada al Covid: La inmigración sin controles y el coladero de Barajas agravan la infección
De Cofrentes a Xauen: el viaje de un novio de la muerte
El coche de Saúl Craviotto: cuando un deportivo encuentra su media naranja
Licitan por 2\,6 millones el control de calidad de las obras del hospital de Albacete
Miguel Ángel Revilla y Pablo Motos se enzarzan por los «errores» de Fernando Simón
El gasto en pensiones sube un 0\,1% en junio\, hasta 9.862 millones\, tras pagarse 603 pensiones más
Abre el zoo de Barcelona con media docena de crías
La ruina del campo bravo: «Muchos ganaderos no pasarán el invierno»
Miguel Ángel Revilla defiende a Fernando Simón en «El Hormiguero»
Un toro se escapa de un camión a la entrada de Toledo
Guardiola: «Tenemos que ser humildes y ver que no podemos ganar todo el tiempo»
Las hermanas de Millán Astray y la memoria histórica bajo perspectiva de género
El emotivo vídeo del Liverpool para celebrar el título
Feijóo ofrece su capacidad de gestión en el escenario postcovid
Un toro se escapa de un camión en Toledo
Pontón cree que «hay partido» y llama a la movilización para encabezar el «cambio gallego»
La firma de hipotecas se desploma un 18\,4% en abril\, su menor cifra en tres años
Fallece una anciana tras ser atropellada por un camión en Casas de Haro
Unanimidad en las Cortes por la Ley de Medidas Urgentes contra la Covid
Imprudentes celebraciones de los seguidores del Liverpool
Coronavirus España directo: Sanidad notifica 196 nuevos casos y dos fallecidos más que ayer
«La casa fuerte» aprieta las tuercas a Fani: «He tenido que robar para dar de comer a mi hijo»
Hugo Lòpez-Asiaín\, 30 años fabricando tablas de surf
Fani estalla en «La caja fuerte» tras las acusaciones de su familia: «Yo nunca me he prostituido»
Zaplana apela al riesgo de contagio de coronavirus para no comparecer en el Juzgado
Sanidad y el Ayuntamiento de Rafelbunyol aseguran que el brote de coronavirus está controlado
Nueva normalidad: así será el curso 2020-2021 en los colegios e institutos de la Comunidad Valenciana
Unos 75.000 hogares cobran hoy el Ingreso Mínimo Vital por primera vez
Confinamiento para tres millones de lisboetas al dispararse los contagios de coronavirus
Arranca la campaña electoral en Galicia y Euskadi
Colón\, Fray Junípero y ahora... los Conguitos: campaña «antirracista» contra este popular dulce español
PSOE y PP unen fuerzas para aprobar y mejorar la nueva normalidad
La cloaca eres tú
Aragón y Málaga\, los brotes que más preocupan en España
Lo que el viento se llevó
La herencia envenenada que recibirá el hijo de Liz Hurley
Mercadona modifica su horario comercial en toda España a partir del lunes 29 de junio
El suicidio de Steve Bing revela una compleja historia familiar
Peldaño 22: «El ego es un veneno y es una tentación beberlo»
Villarejo maniobra para apartar a los fiscales de Tándem por vínculos con Podemos
El reloj de Obama de 355 euros que tú también podrás llevar
¿Qué santo se celebra hoy viernes 26 de junio? Todo lo que tienes que saber del santoral de hoy
Las mejores bolsas de viaje para tus escapadas veraniegas
La prórroga de tres meses a los ERTE da un respiro temporal al empleo
Las seis noticias que debes conocer hoy\, viernes 26 de junio
Prendas inteligentes para amantes de la tecnología
Balance sin fallecidos por coronavirus en la Comunidad Valenciana y ningún caso en Castellón en dos días
Las inundaciones en China obligan a la evacuación de más de 8.000 personas
Igea reconoce «preocupación» por los brotes de Covid\, aunque la Junta no cambiará de estrategia por ahora
Concha Velasco abrirá en el Calderón de Valladolid una temporada para «relanzar» la actividad teatral
España\, entre los países de la UE con mayor desfase en su número de fallecidos por coronavirus
Último adiós a Manolo Segura\, padre biológico de Borja Thyssen
De la Rosa\, sobre la «nueva normalidad»: «La Junta ha pasado el muerto a los ayuntamientos»
El fin de semana llegará con un calor asfixiante que paliarán algunas tormentas
Muere Lechuga\, mítico centrocampista del Dépor en los años 50
Simón advierte: «Un brote que se nos escape podría generar transmisión comunitaria\, incluso si son importados»
Estos son los emparejamientos de los playoff de ascenso a Segunda
El Derby de Kentucky se celebrará con público el 5 de septiembre
El asombroso cambio físico de Fernando Alonso que ha enloquecido las redes
El Real Madrid\, a rezar y ganar para seguir vivo
Archivan la denuncia contra el protocolo de la Junta para la atención sanitaria a usuarios de residencias afectados por el Covid-19
«Ningún menor con signos de maltrato volverá a su entorno hasta valorar el riesgo»
Capricho
Ocho policias de Lérida\, aislados al ser escupidos cuando detenían a un infectado de coronavirus
Lisboa vuelve a decretar el confinamiento obligatorio en 19 distritos de la capital portuguesa y los alrededores
Últimas noticias y última hora de hoy viernes\, 26\, junio 2020 en historia
Las últimas noticias de hoy de actualidad y la última hora de sociedad del viernes\, 26 de junio del 2020
Las últimas noticias de hoy de actualidad y la última hora de deportes del viernes\, 26 de junio del 2020
Últimas noticias y última hora de hoy viernes\, 26\, junio 2020 en internacional
Las últimas noticias de hoy de actualidad y la última hora de cultura del viernes\, 26 de junio del 2020
Últimas noticias de España hoy viernes\, 26 de junio del 2020
Los aficionados del Liverpool se echaron a la calle para celebrar el título
El Chelsea le regala la liga al Liverpool
Númidas: los letales demonios a caballo que aterraban a las legiones romanas
El simulador de la NASA para ver los atardeceres de otros mundos
Carta de un profesor: «Hemos ganado en soluciones imaginativas y en compromiso»
Un respiro con Mingote. Los turistas españoles
El parto de San Francisco
Las víctimas
Malestar entre los socialistas gallegos por la desidia de Ferraz y Moncloa con su candidato
Iglesias\, «normalizado» y hocicando
El PP se ve fuerte en Galicia pero advierte del riesgo de un exceso de confianza
PSOE y Podemos apoyan ahora los plazos a la investigación penal
¡Derribad la estatua de Balfour!
IUrban y Telefónica se unen para crear los hoteles «contactless»
Javier Garat (Cepesca): «El Ministerio de Sanidad nos ha ignorado por completo»
¿Cuándo empiezan las rebajas de verano este año?
Los rivales de Nadia Calviño mantienen sus candidaturas
Lanzan el reto #SinProChallenge para visibilizar el duro tratamiento de los pacientes con enfermedades metabólicas
La ONU valida como récord un rayo «eterno» caído en Argentina
Acaba la epidemia ébola en el noreste de la República Democrática del Congo en medio de un «panorama desalentador»
«No saldremos solos del atolladero\, necesitamos compartir talentos y energía vital»
El Ingreso Mínimo Vital no llegará a más de la mitad de las familias en riesgo de exclusión
Las guarderías se blindan frente al Covid-19
El reto para no gritar en casa\, ¿te atreves?
Cómo eliminar el agotamiento físico y mental durante Selectividad
Qué destino elegir para no achicharrarse este fin de semana con previsión de mucho calor
Así es la comida a domicilio de Viridiana\, uno de los mejores restaurantes de Madrid
Luka Romero\, el jugador más joven en noventa años de Liga
Mazda inicia la producción del nuevo MX-30
La Asociación de la Carretera pide «valentía» para implantar el pago por uso de las autovías «o no habrá fondos»
El renting en la nueva movilidad
Nuevos descapotables para disfrutar a cielo abierto
Los exámenes de antes
El Proceso Steinheil: asesinatos misteriosos\, bajas pasiones y faquires indios en 1909
El rebrote se ceba con los caddies
El descubridor de Luka Romero: «Es introvertido pero muy competitivo»
Caballero invita a «pasar página al proyecto agotado de Feijóo» y promete «una campaña en positivo»
Gabrielle Suchon\, una filósofa feminista del siglo XVII
La diáspora angloafricana en Londres
José María Nieto: «Hoy solo se puede hacer humor conservador»
Gómez Reino pide el voto para decir «alto y claro bye\, bye Feijóo»
Cacerolas contra Vox durante su pegada de carteles en Santiago de Compostela
Mediaset encierra a un famoso en sus estudios para su primer reality de pago
Los secretos de «Frozen 2»\, al descubierto
Marea Galeguista arranca la campaña reivindicándose como «la llave de un gobierno progresista en minoría»
La primera ministra danesa\, obligada a aplazar su boda por tercera vez
La Comunidad de Madrid estima un impacto económico hasta final de año de 3.400 millones
Madrid sustituirá con tarjeta monedero las ayudas alimentarias de emergencia
La red de «trasteros patera» hacinó a más de 60 inmigrantes entre ratas y chinches
Lamela pide al juez que paralice de forma cautelar la obra de Torres Colón
El consejero de Sanidad de Madrid salva la reprobación con el apoyo de su «rival» Reyero
Pegada de carteles de Vox en Bilbao en el inicio de campaña
Fumar y vapear endurecen las arterias\, causa inflamación y daña el ADN
Luz de gas
Militantes de EH Bildu pegan carteles electorales en Bilbao
Crímenes en Oxford
¿Vista a la derecha?
La persiana bajada
Qué triste aborrecerte a ti mismo
Poco fútbol y empate sin goles entre Oviedo y Fuenlabrada
El Espanyol se hunde sin remisión y el Betis de Alexis toma oxígeno
Seremos un parque temático
Arranca la campaña electoral en Euskadi
El único consuelo de Manuel
Barajas\, Aeropuerto 20
Parar el descrédito de la Fiscalía
Pactar contra los odiadores de España
