Sunderland\, 1 - Barcelona\, 0
De Rodney King a George Floyd
Cacerolada en la sede del PSOE
Abascal acusa a Pablo Iglesias de tener un \"discurso guerracivilista\"
Lo que somos en el mundo
Chapoteando en la cloaca
Calamitosa gestión del material sanitario
El tenso duelo en El Rosco de «Pasapalabra»
Lleno en las terrazas de la madrileña calle de Pintor Rosales
Menos industria\, mismo desgobierno
El error que le ha costado 142.000 euros a Nacho
Extinguido tras más de cuatro horas de trabajos el incendio del hospital de Hellín
En torno a 52.000 sanitarios se han infectado del coronavirus
Sánchez apuesta por apoyar a países en desarrollo para que afronten pandemia
Estas son las zonas que pasan a fase 2 a partir del lunes
Los golpistas de Nissan
La pregunta que Lorenzo Caprile no quiso responder
«Ponte en el lugar de un Consejero o directivo de Nissan»
Horóscopo de hoy\, viernes 29 de mayo de 2020
Un estudio revela\, por vez primera\, qué factores favorecen la muerte en pacientes con cáncer
Moody`s deja a las puertas del bono basura a IAG\, British Airways\, Wizz Air y Easyjet por el Covid-19
Gobierno opta por no autorizar medidas de flexibilidad de la Fase 1 a Madrid
Industria busca alternativas para Nissan junto a la Generalitat
Núñez Feijóo: \"El Gobierno se comprometió con Alcoa para tener un precio estable de la energía\"
Comprobar el resultado del sorteo de La Primitiva de hoy jueves\, 28 de mayo de 2020
La Serie A vuelve el 20 de junio
Sanidad impide a Madrid flexibilizar algunas medidas de la fase 1
Li Keqiang rechaza «la mentalidad de la Guerra Fría porque el desacoplamiento no hará bien al mundo»
Fernando Simón: \"No voy a dejar de hacer mi trabajo; no voy a abandonar el barco\"
Trump amenaza a Twitter con una orden ejecutiva para que no cuestione sus mensajes
Fase 3 o avanzada de la desescalada: ¿qué se puede hacer?
Comprobar el resultado del sorteo de Bonoloto de hoy jueves\, 28 de mayo de 2020
¿Nacionalizar la planta de Nissan? La peligrosa solución «mágica» de Rufián y Errejón
Eva y Hugo se aúpan a la final de «Operación Triunfo» junto a la favorita Nia
Simón\, tras ser denunciado por desobediencia y denegación de auxilio por el 8-M: «No abandonaré el barco»
A partir del lunes\, casi el 70% de la población podrá retomar las actividades recogidas en la fase 2
Podemos da cobertura a Bildu en su negativa a condenar los ataques de los proetarras en Durango
Lleida se quedará en fase 1 y refuerza camas\, mientras Barcelona ganará movilidad el lunes
Gabilondo no descarta presentar una moción de censura en la Comunidad de Madrid
Confirmado: Toledo\, Albacete y Ciudad Real pasan a la fase 2
Torrejón comenzará este viernes a hacer las pruebas del coronavirus gratuitas a los vecinos
El Bierzo (León) estrenará la fase 2 en Castilla y León el próximo lunes
Coronavirus Valencia en directo: la Comunidad Valenciana avanza a la fase 2 a partir del lunes
Rosa María Mateo: «Me marcharé cuando acabe la comparecencia\, pero para volver a RTVE»
Revelan el origen del pueblo bíblico de los cananeos
Fase 2 o intermedia de la desescalada: ¿Qué se puede hacer?
Fase 2 o intermedia de la desescalada: fechas\, qué se puede hacer y todo lo que necesitas saber
Alcoa anuncia el despido colectivo de hasta 534 trabajadores de una de sus plantas en Lugo
La Premier vuelve el 17 de junio
Los fotógrafos deportivos de Valladolid se plantan contra la Liga
Maroto resalta la importancia de defender a los trabajadores
Los hosteleros de Toledo exigen negociar con el Gobierno medidas por el parón del Covid
Un incendio en el hospital de Hellín obliga a desalojar a todos los pacientes
«Votar no conllevará riesgo» si se cumplen las medidas de la Xunta\, según el epidemiólogo Juan Gestal
El Superior de Justicia de Aragón da por válida la adjudicación de la plaza de Zaragoza\, anulada por el Tribunal de Contratos
Crítica de «Dragged Across Concrete»: Thriller para estómagos resistentes
Crítica de «Mi vida con Amanda»: Tragedia tremenda sin tremendismo
Crítica de «Entre la razón y la locura»: Soñar por encima de la cordura
Un fallecido por el choque entre dos camiones en la A-3 a su paso por Tarancón
Un joven milanés con los pulmones «quemados» por el coronavirus\, salvado milagrosamente con un trasplante
La acusación pide a la juez del 8M que impute también a Fernando Simón
El paro subió un 7\,9% respecto a finales de 2019
Escucha las noticias de ABC
Juan Magán encabeza 'Dancing in my car'\, el primer festival español en formato autocine
Álvarez de Toledo\, sobre Iglesias: «En vez de defender a su padre\, llamó a los abogados como hacen las folclóricas»
La Premier regresará el 17 de junio
Escucha las noticias de ABC
Las 8 noticias del día sobre el coronavirus
Los disturbios por la muerte de un negro desarmado a manos de la Policía incendian Minneapolis
Carta de despedida a su abuela muerta por coronavirus: «Murió sola\, en un hospital\, sin saber nada de su familia»
Patxi López se harta tras una nueva bronca entre Vox y Unidas Podemos
Kara Keough se hace un tatuaje con las cenizas de su bebé fallecido
Directo Castilla y León: últimas noticias sobre el coronavirus y el estado de alarma
John Boyega\, estrella de «Star Wars»\, tras la muerte de George Floyd: «Que os jodan\, racistas blancos»
El Athletic sigue cogiendo ritmo de cara al reinicio liguero ante el Atlético en San Mamés
Aumentan la fabricación de Ventolín al dispararse la demanda por el Covid-19
La liga rusa sí tendrá espectadores en las gradas
ABC analiza mañana lo que supone la salida de Nissan de Barcelona
Entrenamientos colectivos en Francia\, a partir del 2 de junio
Rosalía lanza nueva canción con Travis Scott
Bayer incrementa sus ventas un 3\,3% en España e invierte más de 60 millones de euros en 2019
La biografía de Rocío Jurado regresa en el aniversario de muerte de 'la más grande'
Nissan Barcelona\, una planta heredera de 101 años de historia
Una casa del casco antiguo de Tarazona se derrumba sin causar víctimas
Operación de la Guardia Civil en un chalé de Nambroca
Riesgo amenaza con cerrar si siguen las protestas en La Coruña
La Comunidad pedirá abrir más pasos fronterizos con el norte de Portugal
La patronal de la automoción dice que el cierre de Nissan es una «dolorosa llamada de atención»
Herrera sobre el fútbol sin público: \"Va a ser complicado la vuelta sin tu gente o sin la gente del rival\"
Un restaurante de Benidorm reserva una mesa a Pedro Sánchez para invitarle a dialogar con el sector
Iberdrola lanza una emisión de bonos adicionales referenciados a sus acciones de 150 millones
Tres muertos por coronavirus (3 menos)\, 2 en Ciudad Real y 1 en Toledo
David Guetta dará un segundo concierto para recaudar fondos para la lucha contra el coronavirus
El canal de odontología más visto del mundo en Youtube es español
El final de Las chicas del cable se estrenará el 3 de julio
Ceuta podría volver a la fase 0 por un repunte de casos que supera ya a Madrid
Pablo López pospone su gira 'Unikornio' y da nuevas fechas
Protesta de los reporteros gráficos contra la Liga
Francia avanza en la desescalada y reabrirá bares y restaurantes el 2 de junio
Calviño asegura que Nissan trasladó un \"mensaje muy distinto\" al Gobierno
Paz Padilla\, feliz de estar con su hija Anna
Mercedes reduce un 5% su producción en Vitoria y cerrará la planta durante el mes de agosto
Los autónomos valencianos empiezan a cobrar este viernes las prestaciones del Gobierno por el coronavirus
Una firma viguesa lanza un seguro de hogar anti-okupas
Detenido en Ibiza un hombre de 38 años por mostrar sus genitales a dos menores
Las tres buenas noticias de hoy sobre el coronavirus
Chayo Mohedano se desvincula de Rocío Carrasco y habla sobre la guerra con su hija
García-Page se compromete a ayudar al sector taurino para lidiar la crisis
Fran Vázquez no disputará la fase final: «Creo que estamos yendo demasiado deprisa»
El panorama electoral del Barça toma forma
Patxi López abronca al líder del PCE a causa de un nuevo desencuentro con Vox
Bertín Osborne estalla contra las webs de prensa del corazón: «Es un basurero»
Así fue la vuelta a la playa de los canarios
Más de 500 policías de Tenerife se pagarán de su bolsillo las pruebas del Covid-19 ante la falta de actuación del Gobierno
ANFAC dice que la decisión de Nissan debe servir como \"llamada de atención\"
El Real Madrid hace oficial la renovación de Carroll
El Instituto de Empresa Familiar y el IESE piden a Sánchez un plan de relanzamiento de la economía por sectores
Pablo Iglesias acusa a Vox de querer dar un golpe de estado.
Marín retoma los entrenamientos lista para \"ir a por el oro\"
Moreno espera que toda Andalucía \"camine en su conjunto\" hacia la fase 3
Muere Irm Hermann\, musa de Fassbinder y gran dama de la escena alemana
El primer raquetazo de Carolina Marín tras el confinamiento
Alcoa anuncia el despido colectivo de hasta 534 trabajadores de una de sus plantas en Lugo
Los impagos en el alquiler se triplican por el coronavirus
El mensaje diario de un profesor para animar a sus alumnos ante el trastorno causado por el Covid-19
Corts Valencianes aprueban la Ley del Juego con los votos del Botànic
Calviño plantea un plan de inversiones y reformas hasta 2023
Calviño propone un plan de inversiones y reformas en los próximos dos años
Las fábricas españolas de coches que están en riesgo y las que tienen un futuro más prometedor
La impactante imagen de un teatro alemán que dibuja el futuro post-pandemia
Un empresario duerme en el ayuntamiento para que le paguen una factura de hace un año
UGT muestra su indignación por el cierre de las plantas de Nissan
Simón advierte de que «podría producirse un brote no detectado que nos genere una nueva onda epidémica»
Tamara Rojo y ABC Cultural\, premios Pop Eye 2020
Los 'sí\, quiero' regresan a Sevilla con la entrada en la fase 2
Apple\, al rescate de la nueva película de Scorsese con Leonardo DiCaprio y Robert de Niro
CC.OO muestra su \"rechazo\" a la decisión de Nissan
Sin problemas de espacio para tomar el sol en Laida
No hay test de la Covid-19 para hacer en casa que tengan garantías sanitarias
Alteraciones cromosómicas explican por qué las personas obesas sufren diabetes o hipertensión
Los donostiarras aprovechan la bajamar para pasear por la orilla en La Concha
Por qué la voz de algunas personas nos agrada y la de otras nos molesta
Patxi López se disculpa por lo ocurrido en la Comisión de reconstrucción: «No he estado a la altura»
Los test de personalidad triunfan\, ¿por qué nos gusta tanto conocernos?
El PP acusa a Illa de buscar la \"confusión\"
Las diferentes vías de infección del coronavirus: ¿más allá del sistema respiratorio?
Moreno pide \"que toda Andalucía camine hacia fase 3\"
Cinco recetas de tartas y bizcochos sin gluten y fresquitos
Sergio Ramos y sus recuerdos de la undécima Champions
Todo lo que puedes hacer para tener el vientre plano
Ocho recetas de helados caseros con base de frutas o cacao
Javier Castillo: «Proust se me ha atragantado siempre. Quizás me seduzca en el futuro»
Castilla-La Mancha\, de luto
Fotoperiodistas reclaman acceso a entrenamientos y partidos de LaLiga
Alcoa anuncia el despido de 534 empleados de su planta de aluminio de San Cibrao
Se saltan las medidas de seguridad en un entierro multitudinario de Tenerife
Sofia Richie y Scott Disick ponen fin a su relación tras tres años juntos
Pastora Vega: dos matrimonios fallidos en su búsqueda incansable del amor
Muere un hombre al caerle unas puertas encima en Las Pedroñeras
Cuenca cancela las fiestas de San Julián y San Mateo
La receta de la tortilla de patatas perfecta\, paso a paso
El uso de mascarillas no provoca déficit de oxígeno o intoxicación por CO2
'El Vaporcito' de El Puerto de Santa María toda una seña de identidad
Puerto Vaivén presenta nuevo videoclip: 'Silencio'
Ayuso guarda un minuto de silencio por los fallecidos de Covid-19
Aparece una escultura en Benimàmet que rinde homenaje a los fallecidos por la COVID-19
Las ventas del comercio minorista registran un desplome histórico del 31\,5% en abril por el covid-19
Montero ve un \"claro margen\" de mejora recaudatoria
Rosell: \"La injusticia es mayúscula\"
Dos exministros socialistas y un asesor de Podemos entran en el consejo de Enagás
La Galería de los Uffizi propone que los museos italianos devuelvan obras a la Iglesia
Escucha las noticias de ABC del fin de semana del 30 y 31 de mayo
Sale de Ferrol la última plataforma del primer parque eólico semisumergible del mundo
Resignación en la plantilla de Nissan en España: «Esto no da más de sí»
Los pistachos son una proteína completa como el pescado o la carne\, según un estudio
Los blancos entrenan por primera vez en el Alfredo Di Stéfano
41 millones de personas solicitan el subsidio de paro en Estados Unidos en los últimos dos meses por el Covid
Nissan comunica el cierre de su planta de Barcelona\, previsto para diciembre
Estas son las fábricas de coches españolas y los modelos que producen
Los obispos catalanes claman contra el boicot de la Generalitat a algunos colegios concertados
Nissan asegura que el cierre de Barcelona ha sido «muy difícil» pero «está decidido»
Nissan salva a Ávila y Cantabria tras el cierre de Barcelona
El listado de puertos y aeropuertos que están operativos como puntos de entrada a España
«Nuestro Sistema Solar\, fruto de una colisión galáctica»
Escrivá dice que los primeros beneficiarios del ingreso mínimo vital lo cobrarán a final de junio
La Comisión quiere usar 750.000 millones para salvar a España e Italia
Ribó celebra que la final de la liga ACB sea en Vàlencia
Illa defiende a su equipo: \"estoy orgulloso de ellos\"
Torra activará \"los mecanismos\" para que Nissan se quede en Cataluña
Palma aprueba limitar a 30 km/h la velocidad máxima en el 90% de sus vías urbanas
Joaquín Prat\, contra Fernando Simón: «Los muertos merecen un respeto»
Montero niega que el Gobierno vaya a suprimir la extra a los funcionarios
desconsolado padre pierde hijo covid19
El dramático mensaje de un padre que pierde a su hijo agobiado por el confinamiento del Covid-19
Iglesias acusa a Vox de \"querer dar un golpe de Estado\"
La Liga se jugará en tres horarios: 17\,30\, 19\,30 y 22 horas
Crisis en la cúpula de la Guardia Civil por las renovaciones de Grande-Marlaska
Nissan anuncia el cierre de sus tres factorías en Barcelona
Limitaciones en el aforo\, el acceso y la permanencia en las playas españolas
1 de cada 5 hospitalizados por coronavirus falleció
Estadio de Mestalla abre sus puertas para el reparto de alimentos
Torra activará con Sánchez \"mecanismos\" para evitar marcha de Nissan
Carta de despedida a un padre: «No estuvimos allí para cogerte de la mano\, ni para aliviarte en nada»
Iglesias corresponsabiliza al PP de los muertos por Covid y dice que Vox querría dar un golpe de Estado
Robles y Marlaska reciben al DAO de la Guardia Civil que dimitió tras la destitución de De los Cobos
Dos nuevos pequeños repuntes de casos positivos en Lérida y Leganés
Euskadi registra dos nuevas muertes por covid-19
PNV: \"Si hay prórroga\, tendrá que ser la última\"
El hotel Ayre Colón se mantendrá para aislar a positivos por Covid-19
Divorcios online para superar el aumento de casos por culpa del coronavirus
Sevilleja de la Jara reclama una conexión a internet de calidad en un concurso
El comité empresa de Nissan en Ávila muestra su «absoluta repulsa» al cierre de Barcelona
Monasterio ve \"pobre\" el plan transversal de la Comunidad y Ayuso lo defiende
«La juez Lamela ha prevaricado o se ha equivocado mucho»
Castilla-La Mancha pide formalmente al Ministerio de Sanidad que Albacete\, Toledo y Ciudad Real pasen a la fase 2 el lunes
Última hora sobre el coronavirus en Castilla-La Mancha
Ayuso acusa a la izquierda de intentar \"politizar\" con una comisión sobre residencias
Capturan una serpiente en una vivienda de Arroyomolinos
Aguado emplaza a los grupos a una reunión \"mañana mismo\"
\"Gobierno\, te reservamos una mesa para el diálogo\"
Castilla y León reprocha al Ministerio el «baile de cifras» con el recuento de víctimas del Covid-19
El día que «confundieron» a Rafael el Gallo\, el más genial de los toreros\, con un chino
Pablo Iglesias se jacta de que Trabajo «ya está desmontando» la reforma laboral
Carlota Amigo\, nombrada consejera de Empleo e Industria
Iglesias se burla de Vox y alienta el guerracivilismo: «Les gustaría dar un golpe de Estado pero no se atreven»
Iglesias insiste en el impuesto a las grandes fortunas «para que los que más tienen arrimen el hombro»
Iglesias apuesta por el impuesto a las grandes fortunas «si queremos ser patriotas de verdad»
Quejas contra Amazon por el foco de contagios en uno de sus centros logísticos de Alemania
La planta de Nissan de Ávila no se verá afectada por el cierre de Barcelona
Iglesias considera \"unos demócratas\" a los 'jordis'
Iglesias: \"A Vox le gustaría dar un golpe de estado\, pero no se atreven\"
Iglesias defiende abrir un «diálogo» con  Puigdemont
Page propone al sector taurino la bonificación de tasas y un reglamento excepcional
Vox abandona la Comisión de Reconstrucción tras acusarle Iglesias de querer dar un golpe de Estado
Los vecinos de Aluche en Madrid no encuentran espacio para tanta hambre
Chrissy Teigen decide quitarse los implantes mamarios
Manifestación de hosteleros valencianos contra la ley del Juego
China enseña los dientes a EE.UU. por la ley de seguridad de Hong Kong
AWS desembarca en la educación universitaria española a través del CEU
Sancionan a un juez de EE.UU. por preguntar a una víctima de violencia sexual si cerró las piernas
La Comunidad Valenciana aprueba una ley pionera en España para alejar a los menores de las apuestas
Una tatarabuela americana celebra que ha superado el Covid-19 con su cerveza favorita
Blanco asegura que el cierre de Nissan es \"un ataque al corazón industrial\"
El covid-19 obliga a comunicarse desde la calle con los internos en una residencia
Illa reconoce que hay que «poner al día» la administración de vacunas a niños y embarazadas
El Congreso de EE.UU. aprueba una ley para sancionar a China por su trato a la minoría uigur
Moneda\, ministros y leyes propias: la extraña Asturias independiente que irritó a España en la Guerra Civil
Castilla-La Mancha inicia en junio un diseño de auditoría en residencias
Navarra pone en marcha ayudas para el ganado de lidia: 90 euros por animal
La Jara tiene mucho futuro
«Dancing in my car»\, el primer festival de la desescalada se verá desde el coche
La RAE lanza Enclave de Ciencia\, su plataforma para la difusión del lenguaje científico
La mejor dieta para la embarazada no es la hipocalórica\, es la mediterránea
Francisco Javier Panizo sustituye a Ana Carlota Amigo como procurador por la provincia de León
El padre de Pablo Iglesias denunciará a Álvarez de Toledo por llamarle «terrorista»
La IE University estrenará un método con alumnos presenciales y virtuales conectados de forma simultánea
Protestas de los trabajadores de Nissan en Barcelona por el cierre
Descubren bajo unos viñedos los maravillosos mosaicos de una villa de la Antigua Roma
Mujeres al borde de un ataque de pop
Un vecino de Villarejo de Fuentes\, pillado sextuplicando la tasa de alcohol en un patinete eléctrico
Familias con menores de 3 años podrán optar a ayudas de hasta 90 euros al mes para guarderías privadas
El coronavirus acelera el fin del dinero en efectivo
Illa reconoce un descenso de la vacunación durante marzo y abril
Altas temperaturas y especial cuidado con la radiación solar tras el confinamiento
Valencia fase 2: El Corte Inglés abrirá todos sus centros el lunes 1 de junio con medidas adicionales de higiene
Cascos cobró más de un millón de euros y pasó 230.000 en gastos personales en 8 años
Iberia y Vueling reactivan parte de su programación de verano
Jugar en casa como un forastero
\"El enfado por tener un gobierno incompetente hace que tengamos reproches muy duros en el Congreso\"
Díaz Ayuso a Más Madrid: \"Son ustedes la mayor fábrica de pobreza que ha existido nunca en la historia\"
Cascos cobró más de un millón de euros de Foro Asturias
'The Sun' fantasea con el once del Madrid y asegura que ofrece a Odegaard por Pogba
Bale: «Mucha gente tiene problemas conmigo porque juego al golf\, no sé cuál es la razón»
El búnker de la ACB en Valencia contará con un hospital de campaña
La alta cocina se apunta al delivery: los mejores restaurantes a domicilio que puedes pedir en Madrid
La emotiva sorpresa de unos padres: «Hoy es mi última quimio»
Dos geólogos de Zaragoza descubren en Marte los restos de un lago de hace 3.700 millones de años
Desmantelado un taller clandestino en Madrid donde se desmontaban coches robados para venta de piezas
Desmanteladas dos narconaves en Barcelona donde se producía marihuana industrialmente
Cómo decorar tu balcón con los elementos imprescindibles para este verano
Estrasburgo niega indemnizar a la viuda de un presunto etarra muerto por los GAL
El Gobierno madrileño dispondrá 9.000 test para los profesionales de Justicia
Las claves del intenso calentamiento antes de dar el primer paso
La Audiencia Nacional retoma el 8 de junio el juicio a Trapero
Iglesias pide un Sistema de atención a la dependencia \"de calidad\"
Archivada una denuncia de Vox por las muertes en geriátricos de Salamanca
La cuarentena a los turistas extranjeros pone en jaque la reactivación del turismo
De luto y con esperanza
Cómo será este verano en el embalse de Orellana\, la playa de interior con diez años de bandera azul
Acciona destaca que cada millón de euros invertidos en infraestructuras genera 14 empleos
La vieja línea férrea de Teruel recibe un millón de euros para mejorar el tráfico de mercancías
El Club Cocherito de Bilbao estudia organizar algún festejo taurino esta temporada
Ofertas especiales en tecnología y moda deportiva de las mejores marcas
Los alcaldes de A Mariña: «De Alcoa comemos todos»
Castells consigue imponer la reducción de los precios universitarios sin ofrecer financiación a las comunidades
Descubren el papel de la proteína p38MAPK en el envejecimiento de las células madre neurales
Medidas que generen mayor actividad económica para salir de la crisis
El desconfinamiento del lujo en la Milla de Oro de Madrid
Protestas por la decisión de Nissan de cerrar su planta en Barcelona
Sánchez\, sobre Nissan en enero: «El mantenimiento del empleo en Barcelona está garantizado»
Sánchez aseguraba hace unos meses que el empleo estaba garantizado en Nissan Barcelona
Dos equipos españoles en el podio de los más valiosos
El prior de los agustinos pide «tomar decisiones valientes\, arriesgadas\, renovadoras»
La Comunidad baja de los 800 contagios activos con los fallecimientos estancados desde hace días
Más de la mitad de los españoles son vulnerables ante la desinformación
Paradores reabrirá sus puertas \"el próximo 25 de junio\"
«Con el derecho a la información no se juega»: protesta de los fotoperiodistas valencianos contra la LaLiga
Gente en el interior\, música y bebidas: la Policía cierra un local de Lugo abierto en plena madrugada
Fallece a los 57 años el alcalde de Grisén y vicepresidente de la Ribera Alta del Ebro
El fichaje de Lautaro se tuerce
Cox Energy América\, primera fotovoltaica que sale a Bolsa en México y en Latinoamérica
Madrid abrirá un «hospital Covid» con 1.000 camas
El vaticinio de Pedro Sánchez: «El empleo en la planta de Nissan en Barcelona está garantizado»
Madrid permitirá que las discotecas instalen terrazas hasta la fase 3
Comité de empresa de Nissan asegura que van a revertir el cierre de la planta
Un estudio en un barco sobre el Covid-19 revela el alto porcentaje de asintomáticos que tienen el virus
Mediapro y LaLiga llevan el fútbol a las residencias de la tercera edad
La Guardia Civil alerta sobre una nueva ciberestafa por correo que busca robarte el dinero
Localizada una mujer que circulaba a 216 km/h por un tramo limitado a 120 en Orense
Paradores nacionales reabrirá todos sus hoteles el 25 de junio con habitaciones a 65 euros
«Nadar en la ambulancia»\, «los preservativos de la boda»... ¿Cuál es el mejor lapsus linguístico?
Nissan califica como \"una decisión muy difícil\" el cierre de la planta
La cifra de fallecidos desde el inicio de la pandemia del coronavirus crece un 52% y alcanza ya los 43.000
Maruja Torres: «El periodista tiene que luchar contra la mentira y no complacer al lector»
Ada Colau: de pedir la desactivación de la industria del automóvil a clamar por la salvación de Nissan
Trabajadores de Nissan queman neumáticos ante la planta de Montcada i Reixac
Los Globos de Oro prohíben que los actores enmascarados puedan ser nominados
«Si el Madrid hubiera sido líder antes del confinamiento LaLiga habría terminado»
Primark reabre desde hoy todas sus tiendas en Galicia
Oficial: la F1 aprueba la hoja de ruta para salvar la crisis
La juez que investiga el 8-M pospone al día 10 la declaración del delegado del Gobierno\, que será presencial
Aguado plantea en la Asamblea que los partidos «nos sentemos mañana mismo» a pactar
El vaticinio de Pedro Sánchez en enero: «El empleo en la planta de Nissan en Barcelona está garantizado»
BBVA alerta del riesgo de subir impuestos y del enfrentamiento político en Cataluña
