Sánchez\, ese gran trilero
Nueva jornada de protestas contra la gestión del Gobierno en toda España
Las mujeres tienen menos probabilidades de enfermedad cardíaca y de morir por su causa
Irresponsables
Los hoteles de Palma Beach prevén abrir sus puertas a partir del 1 de julio
Adiós\, mérito\, adiós
Realismo desechable
Amaños contables sobre coronavirus en EE.UU. en medio de la «reapertura»
Protesta contra el Gobierno en Alcorcón (Madrid)
La UE ayuda\, pero exige reformas y ajustes
Los ciudadanos afrontan con \"respeto\" la obligatoriedad de mascarillas
Nueva protesta contra el Gobierno en Sevilla
Horóscopo de hoy\, jueves 21 de mayo de 2020
Ciudadanos se desmarca del pacto entre el Gobierno y Bildu para derogar la reforma laboral
Protestas en Oviedo pidiendo la dimisión del Gobierno de España
Aragón notifica decenas de pacientes que enfermaron de coronavirus tras salir del hospital
EH Bildu pacta con PSOE y Unidas Podemos derogar de forma «íntegra» la reforma laboral
Caceroladas contra Sánchez\, en directo: nuevas protestas contra la gestión del Gobierno
Se dispara la venta de mascarillas
Boris Johnson: «running» en Westminster tras superar el coronavirus
Un motorista de 40 años muere tras chocar con un coche en Elche
Ciudadanos sobre el uso de mascarilla: \"Es algo que hay que hacer\"
Vecinos de Chamberí (Madrid) protestan contra el Ejecutivo de Sánchez
La policia vigila la cacerolada en Alcorcón para evitar enfrentamientos
El sector del turismo en España alerta que Grecia\, Italia y Portugal nos sacan ventaja
María Bouzas («El Secreto de Puente Viejo»): «La villana tiene más seguidores que los buenos»
La Guardia Civil custodia con fuertes medidas de seguridad el domicilio de Pablo Iglesias e Irene Montero
Así suenan las protestas de este miércoles contra la gestión del Gobierno
David\, «el Chelo»\, detenido en Navalcán por la muerte de su vecina María\, que le daba la merienda cuando era niño
Gobierno pacta con Bildu la derogación \"íntegra\" de la reforma laboral
Las caceroladas contra Sánchez llegan al barrio de Sarrià\, en Barcelona
Detectan señales del nacimiento de un nuevo planeta
El Congreso convalida las ayudas para la Cultura
Seis positivos en las 748 pruebas de coronavirus de los equipos de la Premier
¿Son Gema y Nacho los nuevos Jero y Orestes?
La presidenta de Bolivia cesa al ministro de Salud por el sobrecoste de los respiradores
Montero insta a los ayuntamientos a aportar «al gran pacto por la reconstrucción»
Hasta 3.500 bares y restaurantes de Barcelona sin terraza podrán tenerla excepcionalmente
Golf GTI 8\, el deportivo de tracción delantera promete que el subviraje es «casi» historia
Sánchez logra el aval del Congreso para mantener el estado de alarma pero sus alianzas se resienten
Sindicatos\, padres y patronales de la concertada inician una «cacerolada digital» contra la «ley Celaá»
Denuncian que los nuevos plazos de la ITV acortan su validez hasta seis meses
La duda de los dos metros para usar la mascarilla: ¿Cuándo me tengo que cubrir la cara?
Polvo y gas\, el nuevo poemario de Jesús Maroto
Ya está aquí el trailer de la última temporada de 'Por 13 razones'
El Congreso da luz verde a la prórroga del estado de alarma
Cristiano Ronaldo y el resto de jugadores de la Juve ya trabajan en grupo
El Congreso aprueba la quinta y última prórroga del estado de alarma
Bruselas pide reducir un 50% el uso de pesticidas y un 20% el de fertilizantes en los próximos diez años
Varias comunidades autónomas se preparan para reabrir sus colegios en la fase 2
Page desvela que la Junta se reúne con el sector taurino para ofrecer corridas por televisión
Cambian el césped del estadio «El Prado» de Talavera después de 17 años
Volkswagen se disculpa por un anuncio racista en Instagram
El Congreso se suma a los aplausos de las ocho de la tarde
Innovando en formación
Galdós\, «Ángel Guerra» y una epidemia de cólera
Renault baraja cerrar tres plantas en Francia\, según la prensa gala
Directo Castilla y León: últimas noticias sobre el coronavirus y el estado de alarma
Aprobada la quinta prórroga del estado de alarma
Reliquias
El Gobierno de Ayuso denuncia ante el Tribunal Supremo la decisión de Sanidad de dejar a Madrid en la fase 0
Cae una banda de okupas violentos que exigía 6.000 euros a los dueños de las casas para irse
Javi Sánchez seguirá entrenando al Villarrubia
Bisbal se prepara físicamente mientras la vida vuelve a la normalidad
«Esto es ciencia con mayúsculas»
Escucha las noticias de ABC
Tellado afirma que el PP quiere acordar con la oposición una campaña corta
Las clases se retoman el lunes: desdoble de profesores\, streaming y 15 alumnos por aula
¿Cómo iremos a la playa este verano? A debate | Última hora
Del tiempo y sus caminos (25): Chesterton o cómo no ser hijo de su tiempo
Cataluña obliga a los centros educativos en territorios de fase 2 a abrir en junio
Escucha las noticias de ABC
El bonito gesto con el que Ana Obregón rinde homenaje a su hijo\, Álex Lequio
ABC analiza mañana la demanda de Ayuso contra Sánchez por no dejar pasar de fase a Madrid
España pide que la UE avale a las aerolíneas que devuelvan los vuelos cancelados con bonos
Encuentran el cadáver del popular rapero portugués Mota Jr.
Disney World toma ventaja como sede única para terminar la temporada
S&P mantiene el «rating» de ACS pese a la pandemia del coronavirus
El Rey se reúne con el presidente del Tribunal Constitucional
El Rey recibe al presidente del Tribunal Constitucional
Madrid recurrirá ante el TS la decisión de denegarle el pase a fase 1
Aguirre niega la reducción de 3.000 empleos que recoge el Servicio Madrileño de Salud
Aprender en los bares
Castells da por cumplido su objetivo de acabar el curso con rigor
SATSE denuncia que la CAM está incumpliendo el acuerdo con el personal
Calviño sugiere a Oramas no utilizar \"expresiones hiperbólicas\"
Macron estudia convocar la segunda vuelta de las municipales el 28 de junio
Las 8 noticias del día sobre el coronavirus
El juez anula la multa de 300.000 euros impuesta a Airbnb por comercializar pisos turísticos en Baleares
Romay: «Soy el único español que le ha puesto un tapón a Michael Jordan»
Caos en el SEPE para reincorporar a los afectados por ERTE
Aduriz anuncia su adiós definitivo
Calviño asume la \"enorme deuda\" que tendrán \"las generaciones futuras\"
Antonio Bañuelos: «Los ganaderos vivimos tiempos muy difíciles\, con pérdidas de cerca de 80 millones de euros con esta crisis»
Instantes de Nueva York (14): Desde la ventana
El Pleno del Parlamento de Andalucía dedica una ovación a Julio Anguita
¿Cuándo es la final de «Supervivientes»?
Luz verde a una inyección de 2\,5 millones para reactivar la ciudad de Toledo
El burgalés Antonio Bañuelos\, nuevo presidente de la Unión de Criadores de Toros de Lidia
Garzón asegura que sus declaraciones sobre el turismo siguen el discurso de los economistas\, los sindicatos y la CEOE
Un vecino de Borobia (Soria) de 62 años pierde la vida en un accidente de tráfico en la SO-P-2102
«No se engañen\, lo que estamos haciendo ahora no es ni teletrabajar ni conciliar»
¿Me pueden despedir cuando se deje de aplicar el ERTE en el que estoy incluido?
La Fiscalía investiga a la consejería de Interior catalana por las manifestaciones secesionistas de la Meridiana
Igea cuestiona los datos que ofrece Madrid porque son «diferentes» y aparecen cosas «que no son buenas»
El número de fallecidos repunta ligeramente a 95 y se notifican 416 nuevos positivos
En Italia vuelve la movida\, presidentes regionales amenazan con cerrar de nuevo bares y restaurantes
Vox suspende a tres parlamentarios de Murcia que denunciaron irregularidades en las contrataciones
Un vídeo revive con nostalgia el concurso de patios del Corpus de Toledo
Alfonso Merlos pierde su puesto en el Colegio de Abogados de Madrid tras el escándalo
El calor se alía con las terrazas durante la desescalada
Nicaragua multiplica por diez su número de enfermos por Covid-19 en una semana
«Mi hijo ha cumplido un mes y no lo hemos visto ni abrazado»
Xunta y trabajadores de Alcoa vuelven a pedir al Gobierno que rebaje el precio eléctrico
El autocine más grande de Europa se inaugura en Alicante
Coronavirus: 13 fallecidos y 62 nuevos casos en Castilla-La Mancha en las últimas 48 horas
Aduriz da por terminada su carrera
Última hora\, coronavirus Castilla-La Mancha: 13 fallecidos y 62 nuevos contagiados en dos días
Nuevo aumento en muertes diarias por Covid-19\, 95 en las últimas 24 horas
Una influencer iraní\, condenada a 74 latigazos por el contenido que comparte en redes sociales
Carmen Lomana\, sobre su situación económica: «Tengo para comer\, pero no sé por cuánto tiempo»
El alivio de Paco Arévalo: «Lo he pasado muy mal»
Dos estudios muestran que los monos desarrollan inmunidad protectora contra el SARS-CoV-2
Primera carrera virtual en Guadalajara de Eurocaja Rural a favor del Banco de Alimentos
Iglesias acusa al PP de hacer oposición a los sanitarios con las protestas
Masivo respaldo institucional en Guadalajara a la carrera solidaria de Eurocaja Rural
Bruselas pide a España medidas contra el paro y reforzar el sistema sanitario
«El cociente emocional predice el éxito con más precisión que el cociente intelectual»
El Ibex 35 conserva los 6.600 puntos y cierra en positivo a pesar del cerco de los bajistas a la banca
Los jugadores del Rayo regresan a los entrenamientos
Empresa Familiar entrega 336.000 euros y 80 toneladas de productos a los bancos de alimentos de Castilla y León
El Supremo remite al TSJC la decisión sobre las manifestaciones de Vox prohibidas por Interior
Hallan el cuerpo de Shad Gaspard\, ahogado en el mar tras salvar a su hijo
España registra un nuevo aumento en muertes diarias\, con 95 en las últimas 24 horas
Una leyenda argentina no se fía de Luis Suárez
Los sindicatos denunciarán a Norwegian por cesión ilegal de trabajadores
Vídeo: los nervios delatan a un conductor con droga oculta en el cambio de marchas de su coche en Valencia
Bal a los partidos independentistas: \"Da gusto ver a quién enfadamos\"
¿Tengo que ponerme la mascarilla desde mañana?
Torra agradece a JpC\, ERC y CUP su no al estado de alarma: «Este es el camino para la independencia»
Los funcionarios de Castilla-La Mancha que teletrabajan podrán seguir haciéndolo hasta que lo diga Sanidad
Un semáforo regula el paso a los aseos de un restaurante en Toledo
Johnson & Johnson anuncia que dejará de vender polvos de talco para bebés en EE.UU. y Canadá
Investigadores localizan un tercer géiser en la zona volcánica de Ciudad Real
Fallece en Tokio el padre Adolfo Nicolás a los 84 años\, quien fue superior general de la Compañía de Jesús
La CNMC quiere que REE y Enagás informen de actividades internacionales y diversificación
La Guardia Civil ordena rastrear datos sobre las caceroladas en redes sociales y otras fuentes
A destacar
Zidane: «Hay que pensar en positivo»
Una institución con proyección internacional
Zidane asegura que sus jugadores están deseando volver a las competiciones
A destacar
Abbas vuelve a amenazar con cancelar los acuerdos de seguridad con Israel y EE.UU. si no se frena la anexión
Una formación profesionalizada de calidad
Referencia en estudios audiovisuales
Las autoridades rescatan a catorce médicos que estaban secuestrados en un hotel de México
La Reina Letizia\, elegida como la «royal» mejor vestida por una revista americana
Kim Kardashian incumple las normas sanitarias pero arrasa con su último negocio
«White Lines»\, la «extrema» sucesora británica de «La casa de papel»
El calor mata en España a más personas con enfermedades respiratorias que el frío
Se retrasa el juicio contra Harvey Weinstein por el coronavirus
PSOE y Cs cierran un preacuerdo por la recuperación de Castilla-La Mancha
La Orquesta Sinfónica de Euskadi regresa a los ensayos
El Colegio Valle Inclán de Madrid reparte cerca de 900 comidas diarias
¿Se contagia el coronavirus a través de las lágrimas?
El Ayuntamiento de Albacete suspende la Feria «por responsabilidad»
Castilla-La Mancha permitirá abrir las piscinas públicas y privadas este verano
Un filandón 2.0: volver a contar cuentos en tiempos de confinamiento
Euskaltel echa un pulso a las grandes telecos en toda España con su oferta convergente de Virgin Telco
Lastra lleva el debate al fango y acusa a Ayuso de ser un peligro para la salud pública y la democracia
La mayor oferta de grado y postgrado de España en la empresa\, el marketing y la economía digital
Tercera sesión en grupo del FC Barcelona y tercer día centrados en los rondos
Casado: \"¿Se pondría un notable mirando a los ojos a las 27.000 familias?\"
Rufián tacha la actitud de Echániz de \"auténtica vergüenza\"
«Tratan a los futbolistas como a ratas de laboratorio»
A destacar
La F1 en España\, hacia una segunda edad de oro
DirecTV cesa sus operaciones en Venezuela presionada por las sanciones internacionales
Compromiso con la excelencia
Lastra a un diputado del PP: \"¿Me estás amenazando?\"
Emotiva despedida al nefrólogo del Gregorio Marañón Alberto Tejedor
La pandemia de COVID-19 pone de relieve la importancia de los ensayos clínicos
Las tres buenas noticias de hoy sobre el coronavirus
Antonio Bañuelos\, nuevo presidente de la Unión de Criadores de Toros de Lidia
Mujeres refugiadas confeccionan mascarillas frente al coronavirus
Compromís vota no a la prórroga del estado de alarma: «El Gobierno ha faltado al respeto a los valencianos»
El Palau de la Música limpia y restaura las esculturas del escenario y se prepara para reabrir en julio
Mutilaciones genitales de «puerta en puerta» durante el confinamiento en Somalia
«Quaranchella»: música callejera contra el confinamiento y la falta de conciertos
C-LM permitirá la apertura de piscinas municipales y de comunidades
Ministro de Seguridad de El Salvador: «Los pandilleros no son niños\, son terroristas»
El drama del coronavirus en Nueva York: de los muertos\, al hambre
Societat Civil Balear apoya que el youtuber mallorquín Miquel Montoro haga ahora sus vídeos en castellano
Neuer renueva con el Bayern hasta 2023
Echenique: \"La epidemia suspendió temporalmente el politiqueo\"
Aitana dispara su proyección internacional con Reik y 'Enemigos'
España es el cuarto país del mundo con más ensayos en marcha sobre coronavirus
El estado de alarma se prorrogará con apoyo de Ciudadanos y PNV
Venus pudo estar «vivo» durante miles de millones de años
Invasión ciclista en la única gran zona verde abierta en Madrid
Crecen los enfrentamientos entre vecinos durante las caceroladas
Vigilanciapolicial para controlar las aglomeraciones de personas
Las piscinas. ¿Se preparan?
Sanchez a ERC: \"Hemos mantenido y mantengo nuestros compromisos de investidura\"
Abascal acusa a Marlaska de perseguir a los críticos
Edmundo Bal\, a Vox: «Vayan a un hospital y explíquenle a los médicos por qué siempre votan no»
Casado recalca que el PP \"no usa a ETA\"
Carta de una estudiante: «A los profesores solo tengo que decirles gracias por todo el esfuerzo extra para intentar que salvemos el curso»
Van Nistelrooy desmiente a Capello: «El vestuario del Real Madrid no olía a alcohol»
Varios detenidos y registros en una operación antiyihadista de la Policía Nacional en Bolaños de Calatrava
«Piratas del Caribe 6»\, sin Johnny Depp: los fans reclaman la vuelta de Jack Sparrow
Sánchez acusa a Casado de \"dimitir de su responsabilidad de Estado\"
Empresas pirotécnicas \"agonizan\" por la cancelación de eventos
Obligatorias las mascarillas en vía pública\, y espacios de uso público donde no se puedan mantener los dos metros de seguridad
Calor\, largas jornadas laborales\, hacer deporte\, los problemas del uso de las mascarillas
Aplausos para (y en) empresas y comercios
La prórroga del estado de alarma tambalea la mayoría de la investidura y evidencia la fragilidad del Gobierno
Candela Serrat y Daniel Muriel\, ¿a punto de ser papás?
C-LM propondrá que Cuenca y Guadalajara pasen a fase 2 el lunes
PNV pide firmeza ante ataques como el sufrido por Mendia
Mujeres refugiadas confeccionan mascarillas solidarias
Vecinos de Badajoz salen de terrazas con las altas temperaturas
Cómo evitar el dolor de cuerpo por no hacer ejercicio en casa
El capitán Moore será nombrado caballero por Isabel II tras recaudar 37 millones de euros para el sector sanitario
Farmacéutica: \"No al acopio de mascarillas\, como pasó con el papel higiénico\"
Nuevo debate en el Congreso sobre la prórroga del estado de alarma
Rufián a Abascal: \"Rece para que Marlaska no envíe inspectores de Hacienda porque se dispersarían quienes hacen ruido con la cubertería de plata\"
Cómo ha entrado Keany West en la lista de milmillonarios del mundo
Gran afluencia\, y muchas dudas sobre si se puede tomar el sol\, en la reapertura de las playas de Barcelona
El campo de golf de Layos abre sus puertas con un lleno
Capacidad diagnóstica 24H y más sanitarios\, propuestas de Más Madrid
PP resalta que \"pese a dificultades\" el sector primario sale \"adelante\"
Lastra pregunta qué pasaría si el PSOE jalease manifestaciones contra Díaz Ayuso
El grito de un hombre tras dos días de confinamiento: «¡Sáquenme de aquí! ¡No aguanto más a mi mujer!»
Misuri lleva a cabo la primera ejecución en Estados Unidos durante la pandemia
El metro de Madrid tendrá control de aforo desde el lunes
Howard Carter\, a ABC: «He propuesto utilizar la Gran Pirámide de Giza para dar sepultura a la momia de Tutankamón»
Aganzo no dimite y pasa al ataque: «Cuando tenga pruebas\, diré quién está detrás»
Barcelona demolerá la escuela donde se rodó la serie «Merlí»
Los Reyes se reúnen con los músicos David Bisbal\, José Mercé y Miguel Poveda
Cs avisa a Sánchez de que no es su nuevo aliado
Los científicos estallan contra Pablo Motos: «No tiene ni pajolera idea»
Gabriel Rufián estalla por el pacto con Ciudadanos y acusa al Gobierno de «escoger a la derecha»
Los Reyes se reúnen con David Bisbal\, José Mercé y Miguel Poveda
El Círculo Monárquico de Alicante retoma este jueves por internet su ciclo de conferencias
Los Reyes\, con la nueva generación de escritores
Mejoran el servicio de abastecimiento de agua a pueblos de la Sierra de San Vicente
El TNC abrirá temporada con un homenaje al «Decamerón» de Pasolini
El sindicato Csif denuncia a la consejera de justicia catalana por la gestión de las cárceles
Carlos Núñez: «El toro bravo produce admiración y no deja indiferente a nadie»
Muere el músico Ernesto González\, exlíder de The Pribata Idaho y miembro de Grupo Salvaje
Hallan un complejo subterráneo de hace dos mil años a pocos metros del Muro de las Lamentaciones
Las grandes ciudades de España se vuelcan para reactivar el sector cultural
Un viaje al fatídico día en el que Pompeya fue sepultada por la erupción del Vesubio
La exclusiva mansión que se vende con 100 coches en su interior
Un hombre se reencuentra con sus padres biológicos en China tras haber pasado 32 años secuestrado
«El videojuego puede ayudar a aumentar el PIB de España»
Convertirse en modelo: la última ambición de Alexia Rivas
El mundo del toro crea un comité de crisis frente a «la discriminación y la censura» de Cultura
El tabaco mentolado no podrá venderse ni fabricarse en España desde este miércoles
El 60% de usuarios españoles desconoce cómo comprobar si sus contraseñas han sido filtradas
Baldoví votará en contra de prorrogar el estado de alarma
EH-Bildu negocia con el Gobierno la derogación \"íntegra\" de la reforma laboral
PP y VOX critican la despedida espontánea de decenas de cordobeses a Anguita el pasado domingo
La Coordinadora 25S\, que pretendía rodear el Congreso\, aplaza su protesta
«Quiéreme mientras se pueda»\, el increíble éxito del reguetón de homenaje a los sanitarios
Así serán los nuevos viajes de lujo en tiempos post Covid-19
PNV apoyará la prórroga porque recoge sus peticiones
Farmacia instala dispositivo para medir la fiebre y el uso de mascarilla
Lastra a Casado: \"¿Se harán usted y la señora Ayuso responsables de las consecuencias si en Madrid hay un rebrote?\"
Bal reprende a los diputados por no llevar mascarilla un día antes de su obligatoriedad
Liderazgo responsable
Adrián Barceló: «Ha sido duro tener que cancelar las citas internacionales\, pero lo primero es la salud»
Abascal sube la tensión con Iglesias: «No mande a sus lacayos\, venga usted mismo a nuestras casas»
Vacunas
Detienen a una mujer en Tarragona por estafar hasta 18.000 euros a su abuela incapacitada
La pandemia podría acabar con el Shakespeare's Globe Theatre
El enfado de Grant con Michael Jordan: «Los puñetazos no eran necesarios»
El crimen de Guadarrama del que el asesino confeso salió absuelto
La Unesco incluye a Risco Caído en la selección de joyas de la humanidad que se muestra al mundo en Google Arts & Culture
«Madres que...» una iniciativa para cambiar las predicciones negativas de Google y honrarlas
La Junta pedirá que Cuenca y Guadalajara pasen a la fase 2 el lunes
Rolls-Royce recortará al menos 9.000 empleos\, casi el 20% de su plantilla
Detienen en Guadalajara a un acosador que abordaba a menores en la red
Errejón avisa de que el bloque de la investidura \"se desvanece\"
Minuto de silencio en el Gregorio Marañón para homenajear a Alberto Tejedor\, médico fallecido por Covid
Borrás confirma el no de Junts a prorrogar el estado de alarma
Bal: \"Todos estamos enfadados\, hartos del confinamiento\, pero hay que votar con la cabeza\, no con las tripas\"
Fedeto advierte de que un rescate forzoso de trabajadores en ERTE supondrá «más cierres de empresas y más paro»
«Más que teletrabajo\, estamos llevando a cabo un extenuante ejercicio de multitarea»
Talavera reabre el domingo los mercadillos
Se cancela la regata de Valencia\, en julio\, y el Mundial se celebrará en Puerto Portals\, en septiembre
Así es «Space Force»\, la nueva serie de Steve Carell
César de la Fuente\, biotecnólogo: «La cuestión sobre la vacuna es si será lo suficientemente efectiva»
Abascal carga contra Cs por su apoyo \"equidistante\"
Villacís muestra \"respeto\" por la marcha de De Quinto
Los deportistas también ironizan con los datos del CIS de Tezanos
Muere el Príncipe Otto Von Hessen a los 55 años en un trágico accidente
Belén Esteban cambia de «look»
La impactante confesión de Susana Molina: «Estuve en busca y captura»
La suegra de Elon Musk\, cansada de sus locuras\, arremete contra el padre de su nieto
Mercedes le cierra la puerta a Vettel... de momento
«Cóndor» actualiza la paranoia y el espionaje del filme clásico de Sydney Pollack
Valencia Fase 1: horarios para salidas y paseos en la Comunidad Valenciana
La Generalitat descarta ahora pedir el paso de la Comunidad Valenciana a la fase 2 esta semana
Dónde comprar mascarillas infantiles en Galicia
Aragonès muestra el rechazo de ERC a la prórroga del estado de alarma
Rufián: \"Sacrificar\" a ERC pactando con Cs es acabar con espíritu de investidura
Registro de cambio climático en Marte en rocas analizadas por Curiosity
Valencia fase 1: horarios para las actividades permitidas en la desescalada hasta el 31 de mayo
El recuento de contagios activos en la Comunidad se reduce hasta rozar los 1.000 casos
Averiguan el sexo de los individuos más jóvenes hallados en Atapuerca por sus dientes
Desactivado un punto de venta de droga a menores en Carbonero el Mayor (Segovia)
Una alcaldía brasileña manda a ayunar y orar por 21 días para protegerse del coronavirus
La nueva mansión de lujo que ha comprado Pharrell Williams durante la cuarenta
China busca respaldo diplomático de África en plena polémica por los casos de racismo
Arden tres coches aparcados en el casco antiguo de Calatayud\, entre ellos un Porsche
Una barrera transparente para las personas sordas
Así compraremos ropa en un futuro no muy lejano
Mascarillas: detenido un vendedor fraudulento que operaba en Zaragoza y Huesca
Las mascarillas serán obligatorias desde mañana para mayores de 6 años
Inditex\, Mercadona y Seat\, las empresas con más compromiso y responsabilidad social durante la pandemia
Villacisneros denuncia al Delegado del Gobierno en Navarra por permitir la concentración de apoyo al etarra Patxi Ruiz
Scarlett\, la niña de cinco años que lucha contra la enfermedad de Kawasaki tras haber padecido Covid-19
Alicante inaugurará el autocine más grande de Europa en junio
Coronavirus: Cómo identificar la mascarilla adecuada para el Covid-19
El maravilloso mundo del circo llega a Toledo este viernes para... repartir mascarillas infantiles
La presidenta de Taiwán abre su segundo mandato rechazando de nuevo la unión con China
Juana Acosta encuentra el amor en un atractivo financiero francés
Brasil supera por primera vez los mil muertos por coronavirus en un día
Lleno en las playas de Barcelona ante el anuncio confuso del Ayuntamiento de abrir al público
Un muerto en un incendio y cinco heridos leves por inhalación de humo
Almeida: \"Si hay colas en Aluche es porque Gobierno no nos deja usar recursos\"
La directora de ARCO\, sobre la celebración de la pasada edición: «Creo que hicimos lo correcto»
El avión espacial «secreto» del Pentágono inicia una nueva misión
Condenan a un hombre a pena de muerte en Singapur a través de una videollamada
