Sánchez\, ese gran trilero
Echenique culpa a Ayuso de que Madrid sufra los peores datos de la pandemia: «Es la Trump castiza»
Así fue el despegue de la nave del Pentágono que contiene elementos clasificados
Los pájaros\, los amos de la ciudad
Almeida confía en que esta semana se ponga fecha a reunión con grupos
Rufián: \"Hoy estamos llevándonos por delante el espíritu de investidura\"
Mendia pide \"contundencia\" a la IA tras el ataque a su vivienda
¿Qué mascarillas serán obligatorias en Galicia a partir de mañana?
Macron pierde la mayoría absoluta en la Asamblea Nacional tras la escisión de su grupo parlamentario
Porcelanosa reabre este miércoles todas sus tiendas en España
Venezuela demanda al Banco de Inglaterra por negarse a entregar más de 30 toneladas de oro
Coordinadora 25S aplaza su protesta prohibida frente al Congreso
Marcos de Quinto explica su dimisión: «Inés Arrimadas está haciendo un viraje»
Alemania blinda sus vacunas para evitar posibles compras hostiles y extranjeras
El «Sálvame» de los misterios sin resolver triunfa en Telecinco
Madrid suspende los contratos de campamentos urbanos\, pero no los descarta definitivamente
La policía europea se enchufa al Hyundai Nexo
Iker Casillas celebra su 39 cumpleaños ¡Felicidades!
Círculos de distanciamiento para disfrutar del aire libre
Los expertos alemanes dan la cara
Papa Francisco: «La vida es demasiado breve para consumirla en la tristeza; alabemos a Dios\, contentos de existir»
La OMS aprueba la investigación de la pandemia en medio de amenazas de EE.UU.
El Barça podrá fichar en mitad de un ERTE
Risto Mejide celebra su aniversario con Laura Escanes
Videojuegos\, una muestra de riqueza cultural
Apple Glass: así serán las gafas de realidad aumentada de la empresa estadounidense
Se pincha el globo de Neymar
«El maricón\, la nenaza y el monstruo»: así fue el particular viacrucis de Little Richard
Mike Tyson rememora cuando en 1988 sorprendió en la cama a su mujer con Brad Pitt
«Si no fuera el tío ni el entrenador de Rafael\, me gustaría que Federer ganara todos los partidos»
Abascal: \"Ustedes conocían la letalidad del virus el 10 de febrero y el 8 de marzo sabían que se habían disparado los contagios en Madrid\, son culpables\"
Casado censura los escraches en domicilios particulares \"sean de quien sean y a quien sean\"
Rey Misterio\, ¿crítico tras una grave lesión en el ojo?
Los Reyes se reúnen con la nueva generación de grandes escritos del país
Detenidos dos vecinos de Épila por apalear al vigilante de un polígono industrial de Muel
Campamento para personas sin hogar en un parking de San Francisco
El PP pide «una radiografía real» para decidir si apoya el acuerdo de recuperación
Detenido un joven de Épila por escupir y patear a dos guardias civiles
Casado condena los escraches a dirigentes políticos
Los peligros del running: «No estamos hechos para correr»
Detienen a Félicien Kabuga\, el «banquero» que financió el genocidio de Ruanda
La LNFS solicita al CSD la calificación del futsal como deporte profesional
Casado acusa a Sánchez de negligencia: «Ha impedido salvar miles de vidas y millones de empleos»
El Festival Cultura Inquieta de Getafe cancela su edición de 2020
EE.UU. considera una amenaza el envío de cinco buques con fuel de Irán a Maduro
La dura crítica de Casado a Sánchez: «Todo lo que dependía de usted ha salido mal»
Sánchez defiende la legalidad del estado de alarma
Las altas temperaturas ya son más letales que el frío para las personas con enfermedades respiratorias
El FBI investiga a las empresas mexicanas que negocian con el crudo venezolano\, según Reuters
La Audiencia Nacional rechaza suspender la Orden de fin de curso de Educación sin escuchar al Ministerio
Lesoto tiene nuevo primer ministro tras la esperada dimisión de Thabane
Una multinacional hispano-japonesa promueve una gran planta solar junto al Aeropuerto de Zaragoza
Jude Law será padre por sexta vez junto a Phillipa Coan
Sánchez: \"La prórroga que pedimos es de 15 días\, ni un día más\"
Consejos de uruguayo a uruguayo: «No sigas el ejemplo de nadie\, sé tú mismo»
UP pide un programa cultural estival por la posible suspensión de la Feria Albacete
Nuevas claves para un nuevo liderazgo empresarial
Javier Izquierdo: «Ya no veo en Mañueco la lealtad y la unidad del principio»
Los Oscar barajan posponer su gala de 2021 por el coronavirus\, según «Variety»
El RACC pide más frecuencia de transporte público y flexibilizar los horarios de entrada
La Zona Franca lleva a Barcelona la semana de la nueva economía
Brasil supera el millar de muertes por coronavirus en un solo día
¿Qué tienen las zapatillas más caras del mundo para costar 560.000 dólares?
Zaragoza pospone el Festival Vive Latino para septiembre de 2021 por el coronavirus
Madrid-Canarias\, el primer vuelo libre de coronavirus del mundo
Una bronca en el Rayo para acabar con ERTE
Rusia planea reabrir su industria turística hacia el 1 de julio
La desescalada en televisión: cuándo y cómo regresan todos los programas
LeBron James: «Yo habría llevado a Michael Jordan a otro nivel»
Detenidas tres personas por la venta fraudulenta de material sanitario
Coronavirus Madrid\, en directo | Repunte de contagios\, con 92 en 24h\, y los fallecidos ascienden a 31
Barceloneta’s rule: toalla solo para el sudor
Venus fue un planeta similar a la Tierra: este es el motivo por el que cambió
Biden promete nombrar consejero de política alimentaria al chef José Andrés si gana las elecciones
Hoy termina el plazo para solicitar el cambio de fase
El misterio de las palabras
Ultimátum de ERC a Sánchez: «El PSOE y Podemos han elegido socio»
«Fábricas microbianas» para la producción de fármacos de gran valor
Tras las huellas del Covid-19
Se prorrogan seis meses las autorizaciones de residencia y trabajo de extranjeros
Investigadores: a hombros de gigantes con pies de barro
Los gestores administrativos estiman que más de 900.000 afectados por ERTE aún no han cobrado
Los problemas de Capello con Ronaldo: «Van Nistelrooy me decía: 'míster\, aquí huele a alcohol'»
La OMS inicia una investigación para dar una respuesta mundial a la pandemia
El coronavirus está transformando nuestras ciudades
Se disparan las ventas de piscinas hinchables
La importancia de la investigación
Las colas del hambre en Madrid: «Nunca me he visto así. Yo no estaría aquí si me hubiesen pagado el ERTE»
Reciben el alta tras pasar el coronavirus y quieren que su caso sirva de ejemplo
El nuevo etiquetado de la miel especificará si la procedencia es «cien por cien española»
Coronavirus Valencia en directo: la Generalitat retrasa el pase a la fase 2 por un repunte de la reproducción de casos
Pete Townshend cumple 75 años: las historias más locas del salvaje guitarrista de The Who
La falsa hija de Dalí\, condenada a pagar el coste de la exhumación del artista
Desde hoy está prohibido el tabaco mentolado
Soderbergh aprovecha el confinamiento para escribir la secuela de «Sexo\, mentiras y cintas de video»
Manifestación de surfistas en A Coruña
Congreso guarda minuto de silencio por los casi 28.000 fallecidos
El Gobierno fuerza a los ciudadanos al pago de las mascarillas obligatorias desde mañana
«No vas a poner al vecino del quinto con un silbato a controlar la piscina»
Primera manifestación contra el Gobierno de Sánchez en Galicia
El discutible negocio de Tom Brady aprovechando la pandemia de coronavirus
El PP presiona al Gobierno en el Senado para que active el Portal de la Transparencia
Estos son los seis proyectos selecionados y apoyados por la Fundación La Caixa para derrotar al Covid
El Gobierno prevé reactivar los plazos procesales el 4 de junio
El enésimo engaño de «Sálvame» a la audiencia
Se investiga a dos vigilantes por una agresión en un tren de Barcelona
Atacan la casa de la secretaria general del PSE en Bilbao
Con 22 años\, Sergio Arranz sustituye a su padre\, fallecido por coronavirus\, como alcalde de Cantalojas
Delgado siembra la confusión con los plazos de los casos de corrupción
Torra responde a Ayuso relatando su confinamiento en un «gastado» apartamento del Palau de la Generalitat
Edmundo Bal presume de liberar al Gobierno de los «chantajes nacionalistas»
Convocan una protesta en Twitter\, coordinada desde Castilla y León\, contra la Ley Celáa
La Abogacía del Estado pide el archivo de la causa contra el delegado del Gobierno en Madrid por el 8-M
El grafeno\, material prometedor para desarrollar naves más rápidas
De cómo Almodóvar conoció a Antonio Banderas y consiguió financiar «Laberinto de pasiones»
Así regulan en Europa el uso de las mascarillas
El cumpleaños más atípico de Íker Casillas
Facebook\, acusado de tener un sesgo hacia la izquierda en su «tribunal supremo»
Coronavirus España\, en directo: España registra 59 muertos en las últimas 24 horas
Desvelan los detalles del espectacular castillo portátil con el que el Rey Enrique VIII acudía a la guerra
María Casado: «Esta semana ha sido toda una lección de vida»
¿Por qué Alemania votó nazi? Las dolorosas mentiras del ascenso de Hitler
Phishing: el peor enemigo del internauta en tiempos de pandemia
Adele\, la nueva consejera de Meghan y Harry en Los Ángeles
Vania Millán anuncia que se casa con Julián Bayón
Cuatro hospitalizados al colisionar un turismo y un bus urbano en Valladolid
«La muerte de Joselito ha proporcionado ocasión a algunos periódicos ingleses para decir unas cuantas frivolidades sobre España»
La pérdida de apoyos fuerza a Sánchez a limitar la nueva prórroga a quince días
El santo emparedado en Madrid durante la Guerra Civil
El (no) bombazo de «Sálvame» supera por la mínima a «Pasapalabra»
La crítica de Màxim Huerta a TVE tras ser despedido: «No sé si ha sido elegante quitarnos»
La broma viral de COPE en la que el Grupo Risa imita a Echenique llamando a un hotel de Núñez de Balboa
La Copa Europea de la Solidaridad\, otro título del Real Madrid
«No podemos dejar atrás en la digitalización a las pymes»
Más de 160 investigaciones penales abiertas en residencias de toda España
Seur: «El crecimiento del comercio electrónico durante estas últimas semanas está en los niveles de Navidad»
Apple acelera sus planes: prepara un iPad de bajo coste y unas gafas de realidad aumentada
El drama de Elena\, la madre de Adara\, en «Supervivientes»: «Cada correazo de mi madre me hacía más pequeña»
Nueve recetas ligeras para aprovechar los beneficios de las pipas y las semillas
Las duras críticas del general republicano Vicente Rojo a la bandera tricolor: «Solo consiguió dividir a España»
«Carlos IV no era el pelele bobalicón y cornudo que pintaron sus detractores»
El oscuro pasado de la sede del Ministerio de Asuntos Exteriores: una cárcel de lujo para asesinos y corruptos
Marlaska y Laya incumplen reiteradamente resoluciones firmes de Transparencia
Dos metros pueden no ser siempre suficiente para evitar el contagio
Despliegan una bandera de España gigante en el centro de Valladolid para protestar contra Sánchez
La amenaza velada de Iglesias: si continúa la crispación\, los próximos escraches pueden ser contra Ayuso o Abascal
Tabarca\, la isla más pequeña de la España del confinamiento que quiere ser como La Graciosa
¿Necesito seguro si decido desplazarme en bici durante la desescalada?
Tezanos\, «muy orgulloso» de su carné socialista\, aconseja «no confiar en las encuestas»
Ruido\, fango\, humo
Los Administradores de fincas advierten de que la mayoría de comunidades no podrán abrir las piscinas
¿Sabes qué santos se celebran hoy\, miércoles 20 de mayo? Consulta el santoral
Iglesias movilizó a la Guardia Civil el 6 de marzo por las protestas de unos desconocidos ante su chalé
Miedo
Las seis noticias que debes conocer hoy\, miércoles 20 de mayo
Los rastreadores del coronavirus
Valencia Fase 1: así es el proceso de admisión para el curso 2020-2021 en los colegios de la Comunidad Valenciana
Lanzan un SOS al Gobierno para que salve la profesión de artista de Hogueras y Fallas por el coronavirus
Vídeo: sesenta fallas más esperarán a las fiestas de 2021 en Feria Valencia tras la suspensión por el Covid-19
José Luis Ábalos condena unas pintadas llamando «vendida» a la alcaldesa de Alborache
Receta de clafoutis de albaricoques\, el postre fácil de primavera
Valencia fase 1: así se pueden realizar visitas en residencias de mayores
Valencia Fase 2: desarrollan una app para conocer la ocupación de las playas en tiempo real
La Generalitat da 89.000 euros a un proyecto del exministro Bernat Soria contra el coronavirus
El 72% de los valencianos se ha adaptado «bien o muy bien» al confinamiento por el coronavirus
Preocupación en Bruselas porque España no apoya a sus empresas
«Sánchez dimisión»: fuerte presencia policial en la manifestación en Valencia contra el Gobierno
Las fobias sociales que van a aumentar tras la pandemia
«Tenemos que ir todos juntos en este viaje. O salimos juntos o no salimos»
Thuram y sus terribles pesadillas con Munitis
La Premier League confirma seis positivos por coronavirus en tres clubes diferentes
El drama del pádel: «Nos exigen 1.000 metros cuadrados para 10 personas que luego beben una cerveza en 60»
El Málaga da un paso más y es el primer club en anunciar un ERE
«Piqué perdió dinero en la primera edición y no busca soluciones para salvar la Davis»
Carlos Sainz: «Un mensaje muy bueno sería irse de McLaren como un señor»
El ministro Marlaska ataca a los manifestantes: «¿Salen a pasear o a criticar»
Carlos Sainz: «Mi hijo sorprenderá a todos en Ferrari»
Educación amplía el plazo de admisión de alumnos por el colapso informático debido a la «alta demanda»
Incertidumbre sobre la apertura de piscinas comunitarias
Michael Phelps confiesa que la Covid-19 ha afectado a su salud mental
«El Barça me dijo que no iba a jugar mucho\, pero no me importó porque iba a ser millonario»
El coronavirus golpea a Khabib Nurmagomedov: «Tengo a mi padre en cuidados intensivos»
Fase política
Nacho vuelve a quedarse a las puertas del Rosco
Los caminos de las series canceladas siguen siendo inescrutables con Netflix
Vuelve OT 2020: Todo lo que tienes que saber antes de ver la gala de esta noche
Alcorcón\, un polvorín entre adeptos y contrarios a las protestas: «Hemos salido a defender nuestro barrio»
Máximo Huerta: «Me niego a quejarme de mi despido de TVE en estos tiempos de dolor gigante»
Un respiro con Mingote. La crispación
Carta de una joven contagiada: «Como yo habrá más personas que no aparecemos en ninguna estadística porque no se nos ha diagnosticado»
El faro
Otro mundo global
La despedida de Marcos de Quinto fractura de nuevo a Ciudadanos
La Generalitat ajusta la ley para que los líderes del «procés» eludan pagar al erario
Las remesas de España a Venezuela fueron de casi 400 millones de euros en 2019
Macron pierde el control del Parlamento en plena crisis social
Las ayudas al alquiler del Gobierno se atascan en los bancos
Crecen un 21% los agresores de género menores de edad en 2019
Los docentes denuncian que Celaá carece de un plan para la vuelta al cole
La digitalización del catering está servida
PSOE y Podemos pactan endurecer la ley contra el cambio climático en las Cortes
Austria\, Finlandia y Suecia rechazan el plan franco-alemán
Ansiedad\, fatiga mental y culpa: La realidad de las madres que teletrabajan
Avalancha de peticiones para rebajar o extinguir las pensiones alimenticias de los hijos
Un padre de familia con 5 hijos: «el colegio y el trabajo no caben en una casa de 80 metros»
Un collar que vibra y suena: el invento de la catedral de Florencia para mantener las distancias
La mejor anchoa del mundo
Diez planes baratos por España para vivir un verano de aventura
Valencia lidera el proyecto para diseñar los aviones ecológicos del futuro
Jaguar Land Rover facilita la desescalada con desinfecciones gratis y descuentos en taller
La herencia judía en la base de nuestra civilización
Agota Kristof: los diálogos más duros sobre la ocupación soviética
Nuevo Ford Ranger Thunder: solo 4.500 unidades en toda Europa
Museos y desescalada: con el pie cambiado en Europa
Cuántos días te quedan para pasar la ITV si te ha caducado durante el confinamiento
La cuesta
Los Sussex cumplen con la promesa a la Reina: comienzan a pagar su deuda
Proetarras atacan la casa de la líder del PSE en plena oleada de movilizaciones en favor de Patxi Ruiz
El español\, en estado de alarma
La paguita
Un parapentista herido tras sufrir una caída en Montaña de Taucho
¿Salud o dinero?
Hasta las gónadas
Caceroladas
